business_id,business_name,business_url,business_rating,business_categories,business_locationaddress,business_country,business_city,business_statecode,business_zipcode,business_reviewcount,is_claimed,snippet_text,offset
bubs-subs-algonquin,Bubs Subs,https://www.yelp.com/biz/bubs-subs-algonquin,4.5,"[Category(name='Sandwiches', alias='sandwiches'), Category(name='Specialty Food', alias='gourmet'), Category(name='Fast Food', alias='hotdogs')]",['260 S Randall Rd'],US,Algonquin,IL,60102,151,True,"Amazing subs and fresh, Chicago Italian beef. Love the homemade breads and spicy mayo & giardiniera is delish. Better than Pot Belly and gives Jersey Mike's...",467
millrose-south-barrington,Millrose,https://www.yelp.com/biz/millrose-south-barrington,3.0,"[Category(name='American (New)', alias='newamerican'), Category(name='Steakhouses', alias='steak')]",['45 S Barrington Rd'],US,South Barrington,IL,60010,126,True,"Food - Delicious! The stuffed roasted chicken came with so much food!!! Good mashed potatoes, awesome corn bread, stuffing was out of this world (tasted...",468
chessies-restaurant-barrington-2,Chessie's Restaurant,https://www.yelp.com/biz/chessies-restaurant-barrington-2,3.5,"[Category(name='American (Traditional)', alias='tradamerican')]",['200 Applebee St'],US,Barrington,IL,60010,36,True,"I've enjoyed Chessies for over 30 years. The warm wood panel bar room is inviting and comfortable. My kids enjoy eating in the train dining car, watching...",469
just-hot-dogs-and-more-carpentersville,Just Hot Dog's & More,https://www.yelp.com/biz/just-hot-dogs-and-more-carpentersville,4.0,"[Category(name='Hot Dogs', alias='hotdog'), Category(name='American (Traditional)', alias='tradamerican')]",['142 S Western Ave'],US,Carpentersville,IL,60110,57,False,Terrific little place.  Was in there for the first time on Saturday.  Was pleasantly surprised.  There was nice seating and friendly staff.  The hot dogs...,470
mi-casa-restaurant-wheaton,Mi Casa Restaurant,https://www.yelp.com/biz/mi-casa-restaurant-wheaton,4.0,"[Category(name='Mexican', alias='mexican')]",['1720 N Main St'],US,Wheaton,IL,60187,139,True,"This wonderful little family-owned restaurant serves some of the best Mexican food in the area.  The food is consistently delicious, portion sizes are...",471
taqueria-los-laureles-rolling-meadows,Taqueria Los Laureles,https://www.yelp.com/biz/taqueria-los-laureles-rolling-meadows,4.5,"[Category(name='Mexican', alias='mexican'), Category(name='Grocery', alias='grocery')]",['2212 Algonquin Rd'],US,Rolling Meadows,IL,60008,49,True,Loved it! Amazing flavor on the beef steak and the beef lingua. The gordita was nothing like we've seen before --so delicious!  Had grilled veggies on the...,472
davids-burrito-express-hoffman-estates,David's Burrito Express,https://www.yelp.com/biz/davids-burrito-express-hoffman-estates,3.5,"[Category(name='Mexican', alias='mexican')]",['870 North Roselle Rd'],US,Hoffman Estates,IL,60169,12,False,"Friendly staff and excellent food.
Only wish they had more salsas and alcoholic beverages.
Perfect for lunch or dinner. 
They use grilled seasoned chicken...",473
steamboat-bbq-wheaton,Steamboat BBQ,https://www.yelp.com/biz/steamboat-bbq-wheaton,4.5,"[Category(name='Barbeque', alias='bbq'), Category(name='Chicken Wings', alias='chicken_wings')]",['322 E Geneva Rd'],US,Wheaton,IL,60187,412,True,"Hands down best BBQ around. 
The river bender is amazing. Ground brisket with pulled pork on top. Onion rings are really good too.
Great owner",474
portillos-hot-dogs-and-barnellis-salad-bowl-schaumburg,Portillo's Hot Dogs & Barnelli's Salad Bowl,https://www.yelp.com/biz/portillos-hot-dogs-and-barnellis-salad-bowl-schaumburg,4.0,"[Category(name='Hot Dogs', alias='hotdog'), Category(name='Salad', alias='salad'), Category(name='Burgers', alias='burgers')]",['611 E Golf Rd'],US,Schaumburg,IL,60173,337,True,"Cannot go wrong here. I was in town for 7 days and ate here 3 times. 

If your hungry try the combo.  It's Italian sausage and Italian Beef on a bun. Had...",476
snuggery-schaumburg,Snuggery,https://www.yelp.com/biz/snuggery-schaumburg,2.5,"[Category(name='Pubs', alias='pubs'), Category(name='American (Traditional)', alias='tradamerican')]",['1540 N Roselle Rd'],US,Schaumburg,IL,60195,86,True,"The first time I went here it was just to check the place out.  I sat at the bar, ordered a draft beer and people watched.  It looked like I place I wanted...",478
casa-lara-elgin-2,Casa Lara,https://www.yelp.com/biz/casa-lara-elgin-2,1.0,"[Category(name='Mexican', alias='mexican')]",['7 Clock Tower Plz'],US,Elgin,IL,60120,1,True,Horrible.. meat was old.. food was cold and we were the only ones here.,478
bannermans-sports-grill-bartlett,Bannerman's Sports Grill,https://www.yelp.com/biz/bannermans-sports-grill-bartlett,2.5,"[Category(name='American (Traditional)', alias='tradamerican')]",['858 S Rt 59'],US,Bartlett,IL,60103,70,True,"Decent bar when you want to enjoy some games, darts, and drinks in the Bartlett area. Nice staff too",479
lou-malnatis-pizzeria-schaumburg-2,Lou Malnati's Pizzeria,https://www.yelp.com/biz/lou-malnatis-pizzeria-schaumburg-2,4.0,"[Category(name='Pizza', alias='pizza'), Category(name='Italian', alias='italian')]",['1 S Roselle Rd'],US,Schaumburg,IL,60193,414,True,"Famous classic Chicago pizza

The place is packed at 6:30pm on a Thursday night.  Looked mostly like regulars and locals. I had to park in the back 40 and...",480
chicago-prime-italian-schaumburg,Chicago Prime Italian,https://www.yelp.com/biz/chicago-prime-italian-schaumburg,4.0,"[Category(name='Italian', alias='italian'), Category(name='Music Venues', alias='musicvenues'), Category(name='Wine Bars', alias='wine_bars')]",['1370 E Bank Dr'],US,Schaumburg,IL,60173,135,True,"Amazing food!

We got the sausage and pepper appetizer which was very yummy.

The vodka sauce with square noodles were amazing! Add the scallops for even...",481
gabutto-burger-rolling-meadows,Gabutto Burger,https://www.yelp.com/biz/gabutto-burger-rolling-meadows,4.5,"[Category(name='Burgers', alias='burgers')]",['1410 Golf Rd'],US,Rolling Meadows,IL,60008,21,True,My husband and I stopped by on a Friday evening. We were looking to try a new spot that was quick since we were on a time crunch. We ordered the shrimp and...,482
the-beehive-tavern-and-grille-saint-charles,The Beehive Tavern & Grille,https://www.yelp.com/biz/the-beehive-tavern-and-grille-saint-charles,3.5,"[Category(name='Bars', alias='bars'), Category(name='American (Traditional)', alias='tradamerican')]",['204 W Main St'],US,Saint Charles,IL,60174,66,True,"While bopping around downtown St. Charles we stopped into Beehive Tavern & Grille for a drink and some food - we were pleasantly surprised at both.

Décor:...",482
kfc-elgin-2,KFC,https://www.yelp.com/biz/kfc-elgin-2,1.5,"[Category(name='Fast Food', alias='hotdogs'), Category(name='Chicken Wings', alias='chicken_wings')]",['465 Dundee Ave'],US,Elgin,IL,60120,4,True,I been in this place before and don't remember having this experience other than they running out of something. Was driving home and decided to go here to...,482
sushi-ya-schaumburg,Sushi Ya,https://www.yelp.com/biz/sushi-ya-schaumburg,4.0,"[Category(name='Japanese', alias='japanese'), Category(name='Sushi Bars', alias='sushi')]",['261 S Roselle Rd'],US,Schaumburg,IL,60193,522,True,"This place is delicious! The rolls are fantastic, the service is good, and the chefs make the entire experience fun! We have been here a few times, once for...",483
bulldog-ale-house-roselle,Bulldog Ale House,https://www.yelp.com/biz/bulldog-ale-house-roselle,3.0,"[Category(name='Burgers', alias='burgers'), Category(name='Fast Food', alias='hotdogs'), Category(name='Sports Bars', alias='sportsbars')]",['394 Irving Park Rd'],US,Roselle,IL,60172,199,True,"Definitely improved since they opened.  Back then the bar stools were very uncomfortable  and there were some scary dudes in there each time. 

They did...",483
hugs-and-mugs-hoffman-estates,Hugs & Mugs,https://www.yelp.com/biz/hugs-and-mugs-hoffman-estates,5.0,"[Category(name='Cafes', alias='cafes'), Category(name='Gift Shops', alias='giftshops')]",['2350 W Higgins Rd'],US,Hoffman Estates,IL,60169,5,False,"A cafeteria you will love more than any cafeteria ever.

Its not just a cafe. It offers you wide range of yummy gelatos, smoothies, shakes and what not....",485
moveable-feast-geneva-2,Moveable Feast,https://www.yelp.com/biz/moveable-feast-geneva-2,4.5,"[Category(name='Caterers', alias='catering'), Category(name='Cafes', alias='cafes')]",['321 Franklin St'],US,Geneva,IL,60134,37,True,"Our first time here and so glad we tried this place! The inside is really cute and they also sell kitchen goods and specialty food items. 

We celebrated...",488
skippys-gyros-south-elgin,Skippy's Gyros,https://www.yelp.com/biz/skippys-gyros-south-elgin,4.0,"[Category(name='Fast Food', alias='hotdogs'), Category(name='Greek', alias='greek'), Category(name='Mediterranean', alias='mediterranean')]",['554 S Randall Rd'],US,South Elgin,IL,60177,57,True,"Family owned - they take pride in their restaurant!!
Great food (& service) - you don't have a server - but they bring your food to your table & clean it up...",488
la-fogata-restaurant-streamwood,La Fogata Restaurant,https://www.yelp.com/biz/la-fogata-restaurant-streamwood,3.0,"[Category(name='Mexican', alias='mexican')]",['89 E Irving Park Rd'],US,Streamwood,IL,60107,34,False,"I thought the food was really good. Cute place with friendly service.  The carne asada dinner was a nice portion, tender steak and tasty corn tortillas. The...",489
pie-five-pizza-co-schaumburg,Pie Five Pizza Co,https://www.yelp.com/biz/pie-five-pizza-co-schaumburg,4.0,"[Category(name='Pizza', alias='pizza'), Category(name='Salad', alias='salad'), Category(name='Gluten-Free', alias='gluten_free')]",['1428 N Meacham Rd'],US,Schaumburg,IL,60173,91,True,"The food was amazing. What I appreciated most was the pricing. It was $7.49 for a pre-designed pizza, create your own pizza, or a salad. 
The choices for...",490
gia-mia-wheaton-3,GIA MIA,https://www.yelp.com/biz/gia-mia-wheaton-3,4.0,"[Category(name='Italian', alias='italian'), Category(name='Pizza', alias='pizza'), Category(name='Tapas/Small Plates', alias='tapasmallplates')]",['106 N Hale St'],US,Wheaton,IL,60187,101,True,"We love pizza, who doesn't?! We have a seriously love affairs with brick oven wood-fired pizza! Especially if it's done right! I just happened upon this...",492
montri-thai-warrenville,Montri Thai,https://www.yelp.com/biz/montri-thai-warrenville,4.0,"[Category(name='Thai', alias='thai'), Category(name='Asian Fusion', alias='asianfusion')]",['2S535 Rt 59'],US,Warrenville,IL,60555,139,True,Awesome Thai food! Very new to the area and was looking for a new Thai place nearby. What a find! I got the red curry and it was amazing. The pad see eiw...,492
carlos-tequila-grill-algonquin,Carlos Tequila Grill,https://www.yelp.com/biz/carlos-tequila-grill-algonquin,3.5,"[Category(name='Mexican', alias='mexican'), Category(name='Bars', alias='bars')]",['113 S Main St'],US,Algonquin,IL,60102,22,True,"We love Carlos Tequila Grill, and probably go there for dinner (or order carry-out / deliver) about once a week.  The location (on Main St.) is convenient,...",494
urban-counter-aurora,Urban Counter,https://www.yelp.com/biz/urban-counter-aurora,4.5,"[Category(name='Burgers', alias='burgers'), Category(name='Sandwiches', alias='sandwiches'), Category(name='Fast Food', alias='hotdogs')]",['1395 Butterfield Rd'],US,Aurora,IL,60502,40,True,"Wait a minute, burgers at a gas station?  That's right, peeps, a yummy burger cooked to order at a gas station.  Or maybe you're hungry for a salad or a...",494
burnt-toast-algonquin,Burnt Toast,https://www.yelp.com/biz/burnt-toast-algonquin,4.0,"[Category(name='Breakfast & Brunch', alias='breakfast_brunch')]",['2520 Bunker Hill Dr'],US,Algonquin,IL,60156,142,False,"Fast, friendly service. Great food. Huge portions. Great prices. Need I say more?
This is by far our favorite breakfast restaurant. They serve breakfast and...",497
mcdonalds-elgin-3,McDonald's,https://www.yelp.com/biz/mcdonalds-elgin-3,2.0,"[Category(name='Fast Food', alias='hotdogs'), Category(name='Burgers', alias='burgers')]",['401 Summit St'],US,Elgin,IL,60120,15,False,Went to McDonalds drive thru today 9/13 at 12:18am  I ordered 1 fish fillet. 1 Big Mac. 20 piece Mcnugget. I was informed that there was no Fish Fillet...,497
jcs-cafe-cary,JC's Cafe,https://www.yelp.com/biz/jcs-cafe-cary,5.0,"[Category(name='Waffles', alias='waffles'), Category(name='Sandwiches', alias='sandwiches'), Category(name='Cafes', alias='cafes')]",['77 W Main St'],US,Cary,IL,60013,10,True,I wanted something sweet for lunch and I thought about JC's cafe.  :).   Made a great decision.   Had the iced chai and strawberries banana waffles.  Yum....,498
jamesons-charhouse-bloomingdale,Jameson's Charhouse,https://www.yelp.com/biz/jamesons-charhouse-bloomingdale,3.0,"[Category(name='American (New)', alias='newamerican')]",['94 Stratford Dr'],US,Bloomingdale,IL,60108,175,False,"I have never had such a singularly ""meh"" experience in my life.

Pros: The service was AMAZING. Prompt, courteous and professional.

The place is clean,...",499
tamazula-tacos-carpentersville,Tamazula Tacos,https://www.yelp.com/biz/tamazula-tacos-carpentersville,3.0,"[Category(name='Mexican', alias='mexican')]",['91 S Kennedy D'],US,Carpentersville,IL,60110,7,False,"I only get the fish tacos so I can't say much about other items on the menu. 

I personally prefer baja style and fried in a light beer batter. The tacos...",501
michaels-dawg-house-palatine,Michaels Dawg House,https://www.yelp.com/biz/michaels-dawg-house-palatine,4.0,"[Category(name='Hot Dogs', alias='hotdog'), Category(name='Burgers', alias='burgers'), Category(name='Sandwiches', alias='sandwiches')]",['809 N Quentin Rd'],US,Palatine,IL,60067,36,True,"Fresh cut fries are AWESOME!!!!    double cooked for a perfect crisp & perfect flavor!!!

Cheddar char-burger is almost as good as Paradise Pup!   This has...",501
vivaldos-restaurant-bloomingdale,Vivaldo's Restaurant,https://www.yelp.com/biz/vivaldos-restaurant-bloomingdale,4.5,"[Category(name='Mexican', alias='mexican')]","['300 Glen Ellyn Rd', 'Unit 308']",US,Bloomingdale,IL,60108,17,False,"A hidden gem!

A friend brought me here the other night when visiting.  I don't know much about the area, but this appears to be one of those ""hole in the...",502
wok-n-fire-st-charles,Wok N Fire,https://www.yelp.com/biz/wok-n-fire-st-charles,3.5,"[Category(name='Asian Fusion', alias='asianfusion'), Category(name='Sushi Bars', alias='sushi')]",['181 S 1st St'],US,St. Charles,IL,60174,199,True,Outstanding place to eat. I ordered the shrimp dish with green peppers and brown rice. I can't remember the last time I had such a unique and awesome meal...,503
pupusita-express-lake-zurich-2,Pupusita Express,https://www.yelp.com/biz/pupusita-express-lake-zurich-2,4.5,"[Category(name='Gluten-Free', alias='gluten_free'), Category(name='Salvadoran', alias='salvadoran'), Category(name='Mexican', alias='mexican')]",['69 S Rand Rd'],US,Lake Zurich,IL,60047,73,True,Service here is fantastic. Not to mention the authentic feel and delectable food. I would definitely come back.,505
mod-pizza-kildeer-2,MOD Pizza,https://www.yelp.com/biz/mod-pizza-kildeer-2,4.5,"[Category(name='Pizza', alias='pizza'), Category(name='Fast Food', alias='hotdogs')]","['20505 N Rand Rd, Suite 520', 'Ste 520']",US,Kildeer,IL,60047,60,True,"What a wonderful concept. Fast, delicious pizza. The guys behind the counter were friendly. The mini was cheap enough that I was able to try a few different...",505
chef-ping-rolling-meadows,Chef Ping,https://www.yelp.com/biz/chef-ping-rolling-meadows,4.0,"[Category(name='Chinese', alias='chinese')]",['1755 Algonquin Rd'],US,Rolling Meadows,IL,60008,631,True,"AMAZING restaurant. Will absolutely return and put this on my ""favorite places to eat in Chicago area"" list. Sesame chicken, homemade noodles, fried rice,...",507
la-cocina-de-maria-west-chicago,La Cocina de Maria,https://www.yelp.com/biz/la-cocina-de-maria-west-chicago,4.5,"[Category(name='Mexican', alias='mexican')]",['142 W Washington St'],US,West Chicago,IL,60185,8,True,Was looking for a place to grab a quick bite while waiting to get my nails done. Saw Jaqueline B.'s review of this place down the street and decided to...,507
tonys-chinese-kitchen-elk-grove-village,Tony's Chinese Kitchen,https://www.yelp.com/biz/tonys-chinese-kitchen-elk-grove-village,4.0,"[Category(name='Chinese', alias='chinese')]",['784 S Arlington Heights Rd'],US,Elk Grove Village,IL,60007,21,True,"In our quest to find our new ""Go-To"" Chinese place, we may have landed on Tony's Chinese Kitchen. We tried them out for a Friday evening delivery and chose...",508
bella-vista-algonquin,Bella Vista,https://www.yelp.com/biz/bella-vista-algonquin,4.5,"[Category(name='Mexican', alias='mexican')]",['10400 S Ilinois Rt 31'],US,Algonquin,IL,60102,14,False,Great food and friendly service! I have lived in the area for years and I'm extremely happy to have a Mexican restaurant that serves quality food! Every...,508
serino-italian-deli-addison,Serino Italian Deli,https://www.yelp.com/biz/serino-italian-deli-addison,4.5,"[Category(name='Delis', alias='delis')]",['1720 Army Trail Blvd'],US,Addison,IL,60101,89,False,Best Reuben at around here.  I love this plac,509
luong-loi-wheaton-3,Luong Loi,https://www.yelp.com/biz/luong-loi-wheaton-3,4.5,"[Category(name='Vietnamese', alias='vietnamese'), Category(name='Chinese', alias='chinese')]",['111 N Main St'],US,Wheaton,IL,60187,42,True,"It's so far the best Vietnamese place in Wheaton. I have been there several times with friends. Tried takeout, lunch and dinner and never get disappointed....",509
mugs-pizza-and-ribs-schaumburg,Mugs Pizza & Ribs,https://www.yelp.com/biz/mugs-pizza-and-ribs-schaumburg,3.0,"[Category(name='Pizza', alias='pizza')]",['24 W Schaumburg Rd'],US,Schaumburg,IL,60194,59,True,We placed our first order with Muggs at almost 1 a.m. and it arrived in about 40 min which was great as they said an hour and 15 !  All the food was hot. We...,512
connie-jeans-cuisine-schaumburg,Connie Jean's Cuisine,https://www.yelp.com/biz/connie-jeans-cuisine-schaumburg,4.5,"[Category(name='Delis', alias='delis'), Category(name='Cafes', alias='cafes'), Category(name='Breakfast & Brunch', alias='breakfast_brunch')]","['1933 N Meacham Rd', 'Ste 130']",US,Schaumburg,IL,60173,6,True,Connie is a true life saver and exactly the kind of small business owner you want to support.  Ive been here every day for breakfast since I found out about...,512
koi-sushi-and-grill-wheaton,Koi Sushi & Grill,https://www.yelp.com/biz/koi-sushi-and-grill-wheaton,4.5,"[Category(name='Japanese', alias='japanese'), Category(name='Chinese', alias='chinese'), Category(name='Asian Fusion', alias='asianfusion')]",['N684 Gary Ave'],US,Wheaton,IL,60187,99,False,"Great neighborhood Sushi restaurant. Good service at reasonable prices.

We had the variety platter with accessories. Brought our own wine. No corkage fee.",513
thai-thanee-streamwood,Thai Thanee,https://www.yelp.com/biz/thai-thanee-streamwood,3.5,"[Category(name='Thai', alias='thai')]",['1036 E Schaumburg Rd'],US,Streamwood,IL,60107,43,True,The owners are very friendly and the food is delicious. Some of the best pad Thai and pad woon sen,515
bahama-breeze-schaumburg,Bahama Breeze,https://www.yelp.com/biz/bahama-breeze-schaumburg,3.5,"[Category(name='Bars', alias='bars'), Category(name='Seafood', alias='seafood'), Category(name='Latin American', alias='latin')]",['406 E Golf Rd'],US,Schaumburg,IL,60173,331,True,I am in love with the happy hour half off apps... the best coconut shrimp  The cocktails are the best  as soon as I walk In Bahama breeze I feel like I'm in...,515
coopers-hawk-winery-and-restaurants-arlington-heights-2,Cooper's Hawk Winery & Restaurants,https://www.yelp.com/biz/coopers-hawk-winery-and-restaurants-arlington-heights-2,4.0,"[Category(name='Wine Bars', alias='wine_bars'), Category(name='Wine Tasting Room', alias='winetastingroom'), Category(name='American (New)', alias='newamerican')]",['798 W Algonquin Rd'],US,Arlington Heights,IL,60005,416,True,I came here for a late night business dinner at the recommendation of a work colleague. Overall I am quite happy with my visit. The food was delicious and...,516
rock-n-ribs-bbq-lake-zurich,Rock 'N Ribs BBQ,https://www.yelp.com/biz/rock-n-ribs-bbq-lake-zurich,4.0,"[Category(name='Barbeque', alias='bbq')]",['463 S Rand Rd'],US,Lake Zurich,IL,60047,126,True,"Rock n Ribs is worth a visit. The menu is standard fare for a BBQ house. The pulled pork was good, but served on a weak tasteless bun. The beef brisket was...",517
all-chocolate-kitchen-geneva-3,All Chocolate Kitchen,https://www.yelp.com/biz/all-chocolate-kitchen-geneva-3,4.5,"[Category(name='Desserts', alias='desserts'), Category(name='Coffee & Tea', alias='coffee'), Category(name='Breakfast & Brunch', alias='breakfast_brunch')]",['33 S 3rd St'],US,Geneva,IL,60134,217,True,"After hearing so many  great reviews  about this place  We went with our 2 kids to visit 
This place is out of this world and for a Monday was very busy...",518
rox-city-grill-hotel-baker-saint-charles,Rox City Grill - Hotel Baker,https://www.yelp.com/biz/rox-city-grill-hotel-baker-saint-charles,3.5,"[Category(name='American (New)', alias='newamerican')]",['100 W Main St'],US,Saint Charles,IL,60174,72,False,The atmosphere here is worth the  trip alone.  The food was really very good.  We ordered the lobster bisque to start.  It was served in a hot skillet and...,518
grove-kitchen-palatine,Grove Kitchen,https://www.yelp.com/biz/grove-kitchen-palatine,3.5,"[Category(name='American (Traditional)', alias='tradamerican')]",['795 W Dundee Rd'],US,Palatine,IL,60074,112,True,"First time trying this place last night. It was a Thursday night, but not busy at all. Maybe 4 tables were taken. The interior is very modern with white...",520
egg-yolk-cafe-west-chicago,Egg Yolk Cafe,https://www.yelp.com/biz/egg-yolk-cafe-west-chicago,4.0,"[Category(name='Breakfast & Brunch', alias='breakfast_brunch')]",['100 S Neltnor Blvd'],US,West Chicago,IL,60185,95,False,"buiscuits n gravy was delicious!! so were my over easy eggs, toast n sausage patties i ordered!!",520
north-of-the-border-mexican-restaurant-bartlett,North of the Border Mexican Restaurant,https://www.yelp.com/biz/north-of-the-border-mexican-restaurant-bartlett,3.5,"[Category(name='Mexican', alias='mexican')]",['961 S Il Rt 59'],US,Bartlett,IL,60103,90,True,"I still stop in here on occasion on Tuesday afternoons, and still find their tacos ""very good"" and fairly priced compared to their competitor's pricing for...",522
brauer-house-lombard-3,Brauer House,https://www.yelp.com/biz/brauer-house-lombard-3,4.0,"[Category(name='Bars', alias='bars'), Category(name='Pizza', alias='pizza'), Category(name='Burgers', alias='burgers')]","['1000 N Rohlwing Rd', 'Ste 13']",US,Lombard,IL,60148,194,True,"Went here with my friend for some dinner. This place is super cool and the service was great, but don't come here if you are looking for amazing food. Come...",523
taqueria-el-sazon-batavia,Taqueria El Sazon,https://www.yelp.com/biz/taqueria-el-sazon-batavia,4.0,"[Category(name='Mexican', alias='mexican')]",['8 N Island Ave'],US,Batavia,IL,60510,63,False,Pretty much the best Mexican food in Batavia I come here at least once a week for lunch with coworkers the chicken torta is amazing and there prices are...,523
a-toda-madre-glen-ellyn-2,A Toda Madre,https://www.yelp.com/biz/a-toda-madre-glen-ellyn-2,4.0,"[Category(name='Mexican', alias='mexican')]",['499 N Main St'],US,Glen Ellyn,IL,60137,200,True,"We had dinner at A Toda Madre with a friend on a Friday night and it was an enjoyable meal.

Décor: The first thing I noticed was the curtain covering the...",523
dominicks-villa-rosa-pizzeria-schaumburg-2,Dominick's Villa Rosa Pizzeria,https://www.yelp.com/biz/dominicks-villa-rosa-pizzeria-schaumburg-2,4.0,"[Category(name='Pizza', alias='pizza')]",['1861 W Golf Rd'],US,Schaumburg,IL,60194,34,True,Loved the thin crust pizza.  Haven't tried anything else yet.  We will be back.  Our new favorite in schaumburg area.  Great cheese and sauce!,524
big-anges-eatery-arlington-heights,Big Ange's Eatery,https://www.yelp.com/biz/big-anges-eatery-arlington-heights,4.0,"[Category(name='Hot Dogs', alias='hotdog'), Category(name='Desserts', alias='desserts'), Category(name='Sandwiches', alias='sandwiches')]",['640 W Northwest Hwy'],US,Arlington Heights,IL,60004,63,True,"This is the best Chicago-style QSR in all the land, especially now that Portillo's is a chain. There is no close second place, and I love how they stick to...",525
patellis-west-chicago,Patelli's,https://www.yelp.com/biz/patellis-west-chicago,4.5,"[Category(name='Burgers', alias='burgers'), Category(name='Salad', alias='salad'), Category(name='Seafood', alias='seafood')]",['285 E Roosevelt Rd'],US,West Chicago,IL,60185,6,True,"My husband and I split the best gyros plate I've had in a long time , our kids had a cheese burger and chicken fingers both you could tell weren't frozen....",527
los-fernandez-restaurant-hoffman-estates,Los Fernandez Restaurant,https://www.yelp.com/biz/los-fernandez-restaurant-hoffman-estates,3.0,"[Category(name='Mexican', alias='mexican')]",['2557 W Golf Rd'],US,Hoffman Estates,IL,60169,58,True,Great atmosphere and food! I had so much fun listening to Karaoke while eating. Chips and the three salsas were superb... The only thing to complain about...,528
