business_id,business_name,business_url,business_rating,business_categories,business_locationaddress,business_country,business_city,business_statecode,business_zipcode,business_reviewcount,is_claimed,snippet_text,offset
nuova-italia-st-charles,Nuova Italia,https://www.yelp.com/biz/nuova-italia-st-charles,4.0,"[Category(name='Italian', alias='italian')]",['18 N 4th St'],US,St. Charles,IL,60174,56,True,"4.5 stars. A next to perfect review from me. 

Arrived here for a banquet. This place used to be an old church. Nicely done. Beautiful. Our table was set...",224
lilys-hoffman-estates,Lily's,https://www.yelp.com/biz/lilys-hoffman-estates,4.0,"[Category(name='Mexican', alias='mexican')]",['1624 W Algonquin Rd'],US,Hoffman Estates,IL,60192,57,False,On our way home from Barrington we stopped here for a casual dinner and it was due to the YELP reviews. Chips and salsa were great! I ordered the fish tacos...,226
tracks-cary,Tracks,https://www.yelp.com/biz/tracks-cary,4.5,"[Category(name='Burgers', alias='burgers'), Category(name='American (Traditional)', alias='tradamerican'), Category(name='Sports Bars', alias='sportsbars')]",['108 W Main St'],US,Cary,IL,60013,219,True,"Best burgers and fries around.  Period. Go here, and go often.  That's my advice.  
Fish fry, chicken, it's all good.  
It's basically a bar, so the...",226
crave-café-bloomingdale-2,Crave Café,https://www.yelp.com/biz/crave-caf%C3%A9-bloomingdale-2,4.0,"[Category(name='Comfort Food', alias='comfortfood'), Category(name='Sandwiches', alias='sandwiches'), Category(name='Coffee & Tea', alias='coffee')]",['162 E Lake St'],US,Bloomingdale,IL,60108,53,True,"I love visiting small businesses. The food is always delicious and the service is wonderful. I love that we can sit outside with our dog too.  

I've had...",227
capones-pizzeria-bloomingdale,Capone's Pizzeria,https://www.yelp.com/biz/capones-pizzeria-bloomingdale,4.5,"[Category(name='Pizza', alias='pizza'), Category(name='Italian', alias='italian')]",['360 W Schick Rd'],US,Bloomingdale,IL,60108,53,True,"Date of my visit: 5-August-2016
Time of my visit: around lunch time

This was my first visit at this establishment.  It's not very big for sit ins...",228
taco-bell-elgin-2,Taco Bell,https://www.yelp.com/biz/taco-bell-elgin-2,4.0,"[Category(name='Tex-Mex', alias='tex-mex'), Category(name='Fast Food', alias='hotdogs'), Category(name='Mexican', alias='mexican')]",['1010 Summit Street'],US,Elgin,IL,60120,4,True,"Best Taco Bell I have ever been too. Food is nearly always prepared correctly and staff is almost always on point, friendly, punctual and cool as well! This...",230
portillos-hot-dogs-st-charles,Portillo's Hot Dogs,https://www.yelp.com/biz/portillos-hot-dogs-st-charles,4.0,"[Category(name='Hot Dogs', alias='hotdog'), Category(name='Salad', alias='salad'), Category(name='Burgers', alias='burgers')]",['3895 E Main Street'],US,St. Charles,IL,60174,77,True,"Best. Beef. Ever. 

You really can't go wrong with anything on the menu - it's all super fresh. 

Go there now.  You won't regret it.",231
doughocracy-geneva,Doughocracy,https://www.yelp.com/biz/doughocracy-geneva,4.5,"[Category(name='Pizza', alias='pizza')]",['407 S. Third St'],US,Geneva,IL,60134,62,True,"My mom was born and raised in Mola di Bari Italy, my dad's family is from Italy, & I lived in Bologna (Northern Italy).

THIS IS a wonderful representation...",232
go-goo-ma-korean-hoffman-estates,Go Goo Ma Korean,https://www.yelp.com/biz/go-goo-ma-korean-hoffman-estates,4.0,"[Category(name='Korean', alias='korean')]",['1606 West Algonquin Rd'],US,Hoffman Estates,IL,60192,24,False,"We've been coming here for over 12 years, food is always excellent.  They make home-style Korean food.  Self-service, so no tip required.  

Also, if you...",233
tandoori-indian-grill-elk-grove-village-2,Tandoori Indian Grill,https://www.yelp.com/biz/tandoori-indian-grill-elk-grove-village-2,4.5,"[Category(name='Indian', alias='indpak'), Category(name='Fast Food', alias='hotdogs')]",['627 Meacham Rd'],US,Elk Grove Village,IL,60007,28,True,"First off I would like to start by saying the food is excellent the bread was amazing and the sauce was delightful. 

I feel the price was more than fair...",234
l-eiffel-bistrot-and-creperie-south-barrington-4,L'Eiffel Bistrot and Creperie,https://www.yelp.com/biz/l-eiffel-bistrot-and-creperie-south-barrington-4,3.5,"[Category(name='French', alias='french'), Category(name='Creperies', alias='creperies')]",['100 W Higgins Rd'],US,South Barrington,IL,60010,242,True,"Tried this restaurant last Friday, admittedly I had a Groupon.    We found the food to be very good.  I had the Hanger Steak with Burgundy Sauce.  I ordered...",235
shakou-saint-charles-2,Shakou,https://www.yelp.com/biz/shakou-saint-charles-2,3.5,"[Category(name='Sushi Bars', alias='sushi'), Category(name='Asian Fusion', alias='asianfusion')]",['312 W Main St'],US,Saint Charles,IL,60174,77,True,"I do not usually patronize St. Charles establishments because St. Charles is just filled with bars and that's not my cup of tea. However, I was in the mood...",236
buttermilk-geneva,Buttermilk,https://www.yelp.com/biz/buttermilk-geneva,3.5,"[Category(name='Coffee & Tea', alias='coffee'), Category(name='Breakfast & Brunch', alias='breakfast_brunch')]",['7 W State St'],US,Geneva,IL,60134,294,True,"The vibe here: ""More is more.""
I've been here a quite a few times with mixed impressions, not my go-to but a solid option. 

(+) This place is trendy...",237
smittys-on-the-corner-saint-charles,Smitty's On The Corner,https://www.yelp.com/biz/smittys-on-the-corner-saint-charles,4.5,"[Category(name='Delis', alias='delis'), Category(name='Sandwiches', alias='sandwiches')]",['15 E Main St'],US,Saint Charles,IL,60174,53,True,Wow! Been in town for 4 years and never walked in. My new favorite sandwich place. Get the #9 you will not be disappointed.,239
the-jalapeno-grille-st-charles,The Jalapeno Grille,https://www.yelp.com/biz/the-jalapeno-grille-st-charles,4.0,"[Category(name='Mexican', alias='mexican')]",['602 Geneva Rd'],US,St. Charles,IL,60174,120,True,"It was damn hot that day but even hotter inside the restaurant. With that being said- the staples; tacos and tostadas were good- damn good. 
Put them up...",239
dannys-pizza-elgin-2,Danny's Pizza,https://www.yelp.com/biz/dannys-pizza-elgin-2,3.0,"[Category(name='Pizza', alias='pizza')]",['231 Douglas Ave'],US,Elgin,IL,60120,14,False,"we went there after my grandaughter's dance recital 

there were 9 of us ,service was excellent,food came out promptly for being very busy.

the pizza was...",240
coronado-mexican-kitchen-south-elgin,Coronado Mexican Kitchen,https://www.yelp.com/biz/coronado-mexican-kitchen-south-elgin,3.0,"[Category(name='Mexican', alias='mexican')]",['455 Redington Dr'],US,South Elgin,IL,60177,90,True,"Love, love, love this place! My husband and I go here at least once a week. We normally get table side guacamole, Sangria special on Sunday, and two combos....",241
wendys-elgin-3,Wendy's,https://www.yelp.com/biz/wendys-elgin-3,2.0,"[Category(name='Fast Food', alias='hotdogs'), Category(name='Burgers', alias='burgers')]",['1001 Dundee Ave'],US,Elgin,IL,60120,5,False,This venue was recently updated. The food is pretty good for fast food and it is very clean. There's a small sitting area with a fireplace as well.,243
urban-counter-saint-charles,Urban Counter,https://www.yelp.com/biz/urban-counter-saint-charles,4.0,"[Category(name='Sandwiches', alias='sandwiches'), Category(name='Breakfast & Brunch', alias='breakfast_brunch'), Category(name='Burgers', alias='burgers')]",['1820 Bricher Rd'],US,Saint Charles,IL,60174,12,False,"Happy with this location too!  Burgers, grilled chicken, and sweet potato fries are my favorites.  They also serve a few beers on tap.  My go to burger is...",243
los-burritos-tapatios-restaurant-streamwood,Los Burritos Tapatios Restaurant,https://www.yelp.com/biz/los-burritos-tapatios-restaurant-streamwood,4.0,"[Category(name='Mexican', alias='mexican')]",['1592 Buttitta Dr'],US,Streamwood,IL,60107,137,False,"Only giving this place a 5 star because of how convenient it is. When all bars are closed and you need some sober food, Los B's is the place to go. Open...",243
st-charles-place-st-charles-2,St Charles Place,https://www.yelp.com/biz/st-charles-place-st-charles-2,3.5,"[Category(name='Steakhouses', alias='steak'), Category(name='American (Traditional)', alias='tradamerican')]",['2550 E Main St'],US,St. Charles,IL,60174,147,True,"I have been here 2 times now and I really really enjoy it. 
St Charles Place is your classic simi formal steakhouse. It has a candle lit atmosphere and...",243
morettis-ristorante-and-pizzeria-hoffman-estates,Moretti's Ristorante & Pizzeria,https://www.yelp.com/biz/morettis-ristorante-and-pizzeria-hoffman-estates,3.5,"[Category(name='Pizza', alias='pizza'), Category(name='Italian', alias='italian')]",['2475 W Higgins Rd'],US,Hoffman Estates,IL,60169,84,True,Been to this Moretti's a couple of times. Good hamburgers and strong drinks. Food is delicious. My absolute favorite is the short rib ravioli. The portion...,244
family-house-schaumburg,Family House,https://www.yelp.com/biz/family-house-schaumburg,4.0,"[Category(name='Cantonese', alias='cantonese'), Category(name='Szechuan', alias='szechuan')]",['35 W Schaumburg Rd'],US,Schaumburg,IL,60194,45,True,"We were hungry while playing PokemonGo (nerds unite!) at the park, so we placed an order over the phone for some egg rolls and Salt&Pepper Cuttlefish while...",244
pita-house-restaurant-schaumburg-3,Pita House Restaurant,https://www.yelp.com/biz/pita-house-restaurant-schaumburg-3,4.0,"[Category(name='Middle Eastern', alias='mideastern'), Category(name='Mediterranean', alias='mediterranean')]",['365 S Roselle Rd'],US,Schaumburg,IL,60193,274,True,Always get the lamb entree. Its so tastey. The sauces that come with really compliment the lamb. The red sauce is really spicy. The portion is really big...,245
minami-schaumburg,Minami,https://www.yelp.com/biz/minami-schaumburg,4.5,"[Category(name='Japanese', alias='japanese'), Category(name='Sushi Bars', alias='sushi')]",['175 W Golf Rd'],US,Schaumburg,IL,60195,46,True,Minami has the best service and the best sushi. My favorite rolls are the summer roll hell roll and volcano roll. Thier crab rangoons are amazing and I've...,248
nosh-geneva,Nosh,https://www.yelp.com/biz/nosh-geneva,4.0,"[Category(name='American (New)', alias='newamerican'), Category(name='Breakfast & Brunch', alias='breakfast_brunch')]",['211 James St'],US,Geneva,IL,60134,244,True,"I had breakfast at Nosh with a friend on Sunday morning around 9:00 a.m.  Parking and getting a table was simple, but by 10:00 a.m. there was a short wait...",248
bisi-african-restaurant-schaumburg,Bisi African Restaurant,https://www.yelp.com/biz/bisi-african-restaurant-schaumburg,4.5,"[Category(name='African', alias='african')]","['853 S Roselle', 'Behind Littman Lighting']",US,Schaumburg,IL,60193,210,True,"Customer Service is Bar None!!!! The owner's husband was attentive,  patient, and took the time to inform us of the meal and drink options.   We think of...",249
el-molcajete-geneva,El Molcajete,https://www.yelp.com/biz/el-molcajete-geneva,4.0,"[Category(name='Mexican', alias='mexican')]",['113 W State St'],US,Geneva,IL,60134,240,False,"Well I honestly can't say this is my favorite Mexican restaurant in the Fox Valley because I think Puebla Modern Mexican in St Charles is just as good, but...",250
taqueria-los-juanes-schaumburg,Taqueria Los Juanes,https://www.yelp.com/biz/taqueria-los-juanes-schaumburg,4.0,"[Category(name='Mexican', alias='mexican')]",['914 Bode Rd'],US,Schaumburg,IL,60194,73,True,"Great little Mexican place -- authentic food, friendly service and a relaxed atmosphere.

This has become my local go-to for good Mexican food.  The shrimp...",252
egg-basket-pancake-house-streamwood,Egg Basket Pancake House,https://www.yelp.com/biz/egg-basket-pancake-house-streamwood,3.5,"[Category(name='Breakfast & Brunch', alias='breakfast_brunch')]",['880 S Barrington Rd'],US,Streamwood,IL,60107,57,False,"I went here last weekend for brunch and it was delicious! I had an omelette frittata with whole wheat pancakes, and I don't have one negative thing to say...",252
amore-mio-hoffman-estates,Amore Mio,https://www.yelp.com/biz/amore-mio-hoffman-estates,4.0,"[Category(name='Italian', alias='italian')]",['1457 Palatine Rd'],US,Hoffman Estates,IL,60192,75,True,"Small, and delightful. The ambiance is much lovelier than the strip mall location would lead you to believe. Curtains between the tables add...",254
woow-algonquin,Woow,https://www.yelp.com/biz/woow-algonquin,3.5,"[Category(name='Japanese', alias='japanese'), Category(name='Chinese', alias='chinese'), Category(name='Thai', alias='thai')]",['780 S Randall Rd'],US,Algonquin,IL,60102,151,False,"Went here with the man and the little monster. 

The clear soup was surprisingly slightly spicy, and I dug it! I was also a fan of the miso. 

Absolutely...",255
mcdonalds-elgin-2,McDonald's,https://www.yelp.com/biz/mcdonalds-elgin-2,2.0,"[Category(name='Fast Food', alias='hotdogs'), Category(name='Burgers', alias='burgers')]",['1165 N McLean Blvd'],US,Elgin,IL,60123,4,False,"Do I get that worked up over a cup of water? Yes. Yes I do.

The service here is okay. No one is particularly friendly, but they aren't completely...",256
chopsticks-carpentersville,Chopsticks,https://www.yelp.com/biz/chopsticks-carpentersville,3.5,"[Category(name='Chinese', alias='chinese')]",['2307 N Randall Rd'],US,Carpentersville,IL,60110,33,True,"I often work in different areas in the NW Suburbs. My favorite lunch is wonton soup. I have probably had it from 15 different places. 
I was pleasantly...",257
north-of-the-border-carpentersville,North of the Border,https://www.yelp.com/biz/north-of-the-border-carpentersville,4.0,"[Category(name='Mexican', alias='mexican')]",['322 W Main St'],US,Carpentersville,IL,60110,52,False,Came here last night with my girlfriend not knowing what to expect. We were seated right away and waitress took care of us right away! I was very impressed...,258
fioras-geneva,Fiora's,https://www.yelp.com/biz/fioras-geneva,4.0,"[Category(name='American (Traditional)', alias='tradamerican')]",['317 S 3rd St'],US,Geneva,IL,60134,77,True,"This is an update to my previous review.

I am happy to say that Ann, one of Fiora's owners, contacted me immediately upon seeing my review on Yelp and...",259
taste-of-himalayas-saint-charles,Taste of Himalayas,https://www.yelp.com/biz/taste-of-himalayas-saint-charles,4.0,"[Category(name='Indian', alias='indpak'), Category(name='Himalayan/Nepalese', alias='himalayan')]",['110 N 3rd St'],US,Saint Charles,IL,60174,170,True,This is really a gem of a restaurant. The food is always tasty. They do rotate the buffet menu periodically. I like to sit down with a large Khukuri beer...,259
fireside-ale-house-streamwood,Fireside Ale House,https://www.yelp.com/biz/fireside-ale-house-streamwood,3.0,"[Category(name='Pubs', alias='pubs'), Category(name='American (Traditional)', alias='tradamerican')]",['50 N Barrington Rd'],US,Streamwood,IL,60107,143,True,So we had started out at another restaurant that was so disappointing we left before we even finished our drinks. This place turned our night around. I will...,259
royal-hummus-and-falafel-roselle,Royal Hummus & Falafel,https://www.yelp.com/biz/royal-hummus-and-falafel-roselle,4.0,"[Category(name='Falafel', alias='falafel'), Category(name='Middle Eastern', alias='mideastern')]",['1230 W Lake St'],US,Roselle,IL,60172,55,True,"Went in for a quick bite and came out more than satisfied. Great portions, awesome service and the food is made fresh to order! We had the spicy falafel and...",260
gnarly-knots-pretzel-co-winfield,Gnarly Knots Pretzel Co.,https://www.yelp.com/biz/gnarly-knots-pretzel-co-winfield,4.5,"[Category(name='Pretzels', alias='pretzels'), Category(name='Soup', alias='soup')]",['27W570 High Lake Rd'],US,Winfield,IL,60190,157,True,"I cannot believe this gem has been in Winfield for 3 years, I definitely have to make up for lost time. Where to start? Everything was amazing! I got a cup...",262
early-light-cafe-geneva,Early Light Cafe,https://www.yelp.com/biz/early-light-cafe-geneva,5.0,"[Category(name='Cafes', alias='cafes'), Category(name='Coffee & Tea', alias='coffee'), Category(name='Gluten-Free', alias='gluten_free')]",['11 E State St'],US,Geneva,IL,60134,25,True,I am always on the lookout for a unique dining experience. This Saturday morning my wife and I were riding our bikes along the river in Geneva and we came...,263
la-hacienda-de-roselle-roselle,La Hacienda de Roselle,https://www.yelp.com/biz/la-hacienda-de-roselle-roselle,4.0,"[Category(name='Mexican', alias='mexican')]",['35 W Irving Park Rd'],US,Roselle,IL,60172,241,True,"This was an awesome find

We are originally  from.California, spoiled with good carnes, frijoles..etc. 25 years in Chicago land always in quest of another...",264
ciao-baby-barrington,Ciao Baby,https://www.yelp.com/biz/ciao-baby-barrington,4.0,"[Category(name='Italian', alias='italian')]",['232 E Main St'],US,Barrington,IL,60010,120,True,"Great little restaurant. We went to this restaurant to meet family. We were all very impressed with the quality of food served,
exceptionally good. The...",265
1913-restaurant-and-wine-bar-roselle-2,1913 Restaurant And Wine Bar,https://www.yelp.com/biz/1913-restaurant-and-wine-bar-roselle-2,4.0,"[Category(name='Wine Bars', alias='wine_bars'), Category(name='American (New)', alias='newamerican')]",['123 Main St'],US,Roselle,IL,60172,119,True,"I am so happy to have a place like this in Roselle. The food and drink and ambiance here is wonderful. 

To start, I really like cocktails, and I'm not sure...",266
koreana-schaumburg,Koreana,https://www.yelp.com/biz/koreana-schaumburg,4.0,"[Category(name='Korean', alias='korean')]",['1123 N Salem Dr'],US,Schaumburg,IL,60194,157,True,I'd say that this place is one of the better Korean restaurants in the Chicagoland area. Every meal comes with side order dishes including probably the best...,267
francescas-by-the-river-st-charles-2,Francesca's by the River,https://www.yelp.com/biz/francescas-by-the-river-st-charles-2,4.0,"[Category(name='Italian', alias='italian')]",['200 S 2nd St'],US,St. Charles,IL,60174,138,True,"Great service... great food
We were there catching up with some old friends... so we may have lingered longer than normal, but we never felt rushed.",268
zazas-trattoria-saint-charles,ZaZa's Trattoria,https://www.yelp.com/biz/zazas-trattoria-saint-charles,3.5,"[Category(name='Italian', alias='italian'), Category(name='Steakhouses', alias='steak')]",['5 S 1st St'],US,Saint Charles,IL,60174,166,True,"We come about twice per month.  Staff is great.  Appetizers are my favorite.  We like the fish dishes as well.  As much as the food, we find the atmosphere...",270
the-original-nanas-hot-dogs-streamwood,The Original Nana's Hot Dogs,https://www.yelp.com/biz/the-original-nanas-hot-dogs-streamwood,3.5,"[Category(name='Hot Dogs', alias='hotdog'), Category(name='Pizza', alias='pizza'), Category(name='Fast Food', alias='hotdogs')]",['1102 E Irving Park Rd'],US,Streamwood,IL,60107,128,True,"Haaaaaaay!!!!  

If you don't have time to drive to Gene's and Jude's, you could totally go to Nana's and hammer that craving out. Sure, its not the exact...",270
chouns-restaurant-wheaton-2,Choun's Restaurant,https://www.yelp.com/biz/chouns-restaurant-wheaton-2,4.5,"[Category(name='American (Traditional)', alias='tradamerican'), Category(name='Thai', alias='thai'), Category(name='Asian Fusion', alias='asianfusion')]",['226 W. Front Street'],US,Wheaton,IL,60187,13,True,"Fresh and flavorful dishes, with attentive and professional staff. My husband, who owns Art & Glass Studio on Main Street, recommended we try this place for...",270
alexanders-cafe-saint-charles,Alexanders Cafe,https://www.yelp.com/biz/alexanders-cafe-saint-charles,4.5,"[Category(name='Breakfast & Brunch', alias='breakfast_brunch'), Category(name='American (Traditional)', alias='tradamerican'), Category(name='Sandwiches', alias='sandwiches')]",['1650 W Main St'],US,Saint Charles,IL,60174,34,True,"Omg the lemon berry Pancakes were they best I've ever had!!
Also Monte Cristo Benny was huge improvement over the one I had last week at Nosh in Geneva!...",271
the-onion-pub-and-brewery-lake-barrington,The Onion Pub & Brewery,https://www.yelp.com/biz/the-onion-pub-and-brewery-lake-barrington,3.5,"[Category(name='Breweries', alias='breweries'), Category(name='American (Traditional)', alias='tradamerican')]",['22221 N Pepper Rd'],US,Lake Barrington,IL,60010,213,True,"So, I'm shopping around for wedding venues - my review pertains to big events at the Onion Pub. I just visited to see the place and try the beers. Having...",273
shakou-barrington-2,Shakou,https://www.yelp.com/biz/shakou-barrington-2,3.5,"[Category(name='Sushi Bars', alias='sushi'), Category(name='Asian Fusion', alias='asianfusion')]",['121 W Main St'],US,Barrington,IL,60010,93,True,"I love this place! Clean, bright, classy. Prices are high. But the fish is fresh, the rolls are innovative, and the flavor combos are superb. 

My favorite:...",273
hache-moderne-brasserie-geneva,Hache Moderne Brasserie,https://www.yelp.com/biz/hache-moderne-brasserie-geneva,3.5,"[Category(name='Brasseries', alias='brasseries'), Category(name='French', alias='french'), Category(name='Farmers Market', alias='farmersmarket')]",['524 W State St'],US,Geneva,IL,60134,77,True,I stopped in here a couple nights ago on a Friday night and the place was humming. Most tables were full and the bar had five or six at it. My initial...,275
art-and-almas-century-inn-burlington,Art & Alma's Century Inn,https://www.yelp.com/biz/art-and-almas-century-inn-burlington,4.0,"[Category(name='American (Traditional)', alias='tradamerican'), Category(name='Steakhouses', alias='steak')]",['125 Main St'],US,Burlington,IL,60109,51,True,"This is a nice place to go for a great dinner.  They have daily specials, but make sure you get there early. The specials sell out fast.  Weekends are...",275
algonquin-sub-shop-algonquin,Algonquin Sub Shop,https://www.yelp.com/biz/algonquin-sub-shop-algonquin,4.5,"[Category(name='American (Traditional)', alias='tradamerican'), Category(name='Sandwiches', alias='sandwiches')]",['105 Filip St'],US,Algonquin,IL,60102,216,True,"Best sandwiches we've had in Illinois.  We go here often and it's always good.  Their French fries are great!  
They always have a nice daily selection of...",276
mod-pizza-bloomingdale,MOD Pizza,https://www.yelp.com/biz/mod-pizza-bloomingdale,4.5,"[Category(name='Pizza', alias='pizza')]",['370 W Army Trail Rd'],US,Bloomingdale,IL,60108,62,True,"Every choice I made here was a delicious one!!

I was hungry after a long day but wanted to get something to go. Not a fast food fan I checked out a few...",277
grill-chasers-schaumburg,Grill Chasers,https://www.yelp.com/biz/grill-chasers-schaumburg,4.5,"[Category(name='Food Trucks', alias='foodtrucks'), Category(name='Barbeque', alias='bbq')]",['627 Estes Ave'],US,Schaumburg,IL,60193,32,True,My coworker and I got grill chasers tonight in all plac s -- but winnetka! Added the flavor the town was missing. We had the pleasure of meeting Jamie and...,278
portos-peri-peri-schaumburg-3,Porto's Peri Peri,https://www.yelp.com/biz/portos-peri-peri-schaumburg-3,3.5,"[Category(name='Portuguese', alias='portuguese'), Category(name='Halal', alias='halal'), Category(name='Chicken Shop', alias='chickenshop')]",['927 S Roselle Rd'],US,Schaumburg,IL,60193,75,True,The long awaited trip to Porto's Peri Peri. I have heard several of my cousins in Europe talk about this infamous Peri Peri..so I finally made the trip with...,279
wildfire-schaumburg,Wildfire,https://www.yelp.com/biz/wildfire-schaumburg,4.0,"[Category(name='American (Traditional)', alias='tradamerican'), Category(name='Steakhouses', alias='steak'), Category(name='Bars', alias='bars')]",['1250 E Higgins Rd'],US,Schaumburg,IL,60173,485,True,This is a good restaurant for lunch or dinner in the area of many to chose from.  The seafood is top notch and the steak diners also enjoyed their meal....,279
riverview-restaurant-and-tavern-algonquin,Riverview Restaurant and Tavern,https://www.yelp.com/biz/riverview-restaurant-and-tavern-algonquin,3.5,"[Category(name='Pizza', alias='pizza'), Category(name='Sandwiches', alias='sandwiches'), Category(name='Bars', alias='bars')]",['1320 S Main St'],US,Algonquin,IL,60102,78,True,"Before I get into the food, I have to say, everyone I've dealt with at Riverview has been exceptionally friendly and polite, from hostess to the people...",280
panchos-taqueria-and-catering-schaumburg,Panchos Taqueria And Catering,https://www.yelp.com/biz/panchos-taqueria-and-catering-schaumburg,4.5,"[Category(name='Mexican', alias='mexican')]",['909 W Wise Rd'],US,Schaumburg,IL,60193,60,True,"I want to swim in a pool of their salsa and have a float made of tortilla chips. 

We ordered from here for the first time tonight and are so thrilled with...",282
puebla-modern-mexican-st-charles,Puebla Modern Mexican,https://www.yelp.com/biz/puebla-modern-mexican-st-charles,3.5,"[Category(name='Mexican', alias='mexican')]",['51 S First St'],US,St. Charles,IL,60174,146,False,"Having watched Puebla tweak the experience within their large location has been interesting to watch. 

I feel the food, service and over all feeling really...",283
jurin-japanese-restaurant-south-elgin,JuRin Japanese Restaurant,https://www.yelp.com/biz/jurin-japanese-restaurant-south-elgin,4.0,"[Category(name='Japanese', alias='japanese'), Category(name='Sushi Bars', alias='sushi')]",['588 Randall Rd'],US,South Elgin,IL,60177,138,False,The food is great and it has fantastic prices my only problem is I am American and white and sometimes (only sometimes) I get the feeling that I'm not...,284
