business_id,business_name,business_url,business_rating,business_categories,business_locationaddress,business_country,business_city,business_statecode,business_zipcode,business_reviewcount,is_claimed,snippet_text,offset
taco-patio-hanover-park,Taco Patio,https://www.yelp.com/biz/taco-patio-hanover-park,3.5,"[Category(name='Mexican', alias='mexican'), Category(name='Fast Food', alias='hotdogs')]",['1321 Irving Park Rd'],US,Hanover Park,IL,60133,44,False,Great Whole in the Wall restaurant!!! The food is DELICIOUS and huge portions!  Highly recommend it!!,715
mothers-pancake-house-and-restaurant-st-charles,Mother's Pancake House & Restaurant,https://www.yelp.com/biz/mothers-pancake-house-and-restaurant-st-charles,3.5,"[Category(name='Breakfast & Brunch', alias='breakfast_brunch'), Category(name='Gluten-Free', alias='gluten_free'), Category(name='Desserts', alias='desserts')]",['3755 E Main St'],US,St. Charles,IL,60174,58,True,"Spotted the place on a rainy Saturday morning and didn't regret it at all.
Great food ! Great serving ! Great ambiance. I am coming here again.
If you are...",717
giordanos-schaumburg,Giordano's,https://www.yelp.com/biz/giordanos-schaumburg,3.5,"[Category(name='Pizza', alias='pizza'), Category(name='Salad', alias='salad'), Category(name='Italian', alias='italian')]",['930 N Meacham Rd'],US,Schaumburg,IL,60173,44,True,"Can't go to Chicago area and not eat deep dish pizza!!
My wife and I walked into this Giordano's restaurant on a Friday night at 7:30pm, fully expecting to...",717
kostas-gyros-algonquin,Kosta's Gyros,https://www.yelp.com/biz/kostas-gyros-algonquin,3.5,"[Category(name='Fast Food', alias='hotdogs'), Category(name='Greek', alias='greek'), Category(name='Mediterranean', alias='mediterranean')]",['4053 W Algonquin Rd'],US,Algonquin,IL,60102,69,False,Took my in-laws from out of town here yesterday to get a gyros.  Even though there was ten of us and it was 15 mins before closing they were welcoming....,718
ditkas-arlington-heights,Ditka's,https://www.yelp.com/biz/ditkas-arlington-heights,3.5,"[Category(name='American (New)', alias='newamerican'), Category(name='Steakhouses', alias='steak'), Category(name='Sandwiches', alias='sandwiches')]",['2000 W Euclid Ave'],US,Arlington Heights,IL,60005,70,True,I liked this place. It's a nicer sportsy steakhouse but the prices really aren't bad. They were under staffed so the service wasn't the best but...,719
omega-restaurant-schaumburg,Omega Restaurant,https://www.yelp.com/biz/omega-restaurant-schaumburg,3.0,"[Category(name='American (Traditional)', alias='tradamerican'), Category(name='Breakfast & Brunch', alias='breakfast_brunch')]",['1823 W Wise Rd'],US,Schaumburg,IL,60193,99,True,"So far the best restaurant serving delicious, fresh breakfast.. Huge menu with exciting things to try. 
Unlike other breakfast joints this restaurant never...",720
craving-gyros-lake-zurich,Craving Gyros,https://www.yelp.com/biz/craving-gyros-lake-zurich,4.5,"[Category(name='Hot Dogs', alias='hotdog'), Category(name='Fast Food', alias='hotdogs')]",['2 E Main St'],US,Lake Zurich,IL,60047,52,True,"Went in a Saturday about 2:30 and the place was empty. My gyro and fry were both great! The tzatziki sauce was excellent. 
The floors were dirty and the...",721
sanguche-naperville,SanguChe,https://www.yelp.com/biz/sanguche-naperville,4.5,"[Category(name='Peruvian', alias='peruvian'), Category(name='Sandwiches', alias='sandwiches'), Category(name='Diners', alias='diners')]","['535 Fairway Dr', 'Ste 115']",US,Naperville,IL,60563,181,False,"The Chicarron is legit, like one of the tastiest sandwiches (definitely top 3) I've had, awesome.  The fried rice was very good as well.  Kids had the ""hot...",723
billys-hot-dogs-beef-and-sandwiches-palatine,"Billy's Hot Dogs, Beef & Sandwiches",https://www.yelp.com/biz/billys-hot-dogs-beef-and-sandwiches-palatine,4.0,"[Category(name='Burgers', alias='burgers'), Category(name='American (Traditional)', alias='tradamerican'), Category(name='Hot Dogs', alias='hotdog')]",['52 W Illinois Ave'],US,Palatine,IL,60067,56,False,"Billy's is a great spot for a delicious panini or hot dog. Their Italian Panini is so yummy. Perfect amount and balance of Italian meats, and the roasted...",723
shophouse-southeast-asian-kitchen-schaumburg,ShopHouse Southeast Asian Kitchen,https://www.yelp.com/biz/shophouse-southeast-asian-kitchen-schaumburg,3.0,"[Category(name='Thai', alias='thai'), Category(name='Asian Fusion', alias='asianfusion'), Category(name='Vietnamese', alias='vietnamese')]",['1022 N Meacham Rd'],US,Schaumburg,IL,60173,107,True,Delicious! I'd heard of this southeast Asian concept chipotle a few years ago when it was in the works. Didn't realize that there was one so close to me -...,724
lulus-pizzeria-glen-ellyn,Lulu's Pizzeria,https://www.yelp.com/biz/lulus-pizzeria-glen-ellyn,4.5,"[Category(name='Pizza', alias='pizza'), Category(name='Burgers', alias='burgers')]",['552 Crescent Blvd'],US,Glen Ellyn,IL,60137,15,True,"Damn bruh get the gyro. It's fire. She said ""just like they make it in Chicago"" and I'm all like ""haha okayyy"" because I didn't hear her at first and was on...",726
buona-restaurant-and-catering-hoffman-estates,Buona Restaurant & Catering,https://www.yelp.com/biz/buona-restaurant-and-catering-hoffman-estates,3.5,"[Category(name='Pizza', alias='pizza'), Category(name='Italian', alias='italian'), Category(name='Sandwiches', alias='sandwiches')]",['2352 W Higgins Rd'],US,Hoffman Estates,IL,60169,64,True,"Nice place enjoy the food and the staff., they have a nice rewards program you get points for purchases and they offer bonus points regularly, I go for the...",728
pops-pizza-and-sports-bar-roselle,Pop's Pizza & Sports Bar,https://www.yelp.com/biz/pops-pizza-and-sports-bar-roselle,3.0,"[Category(name='Pizza', alias='pizza'), Category(name='Sports Bars', alias='sportsbars'), Category(name='Italian', alias='italian')]",['817 E Nerge Rd'],US,Roselle,IL,60172,110,True,We have had dinners at Pop's over the past several years and most have been very good.  The service and timeliness of the service is good. I would recommend...,728
portillos-hot-dogs-and-barnellis-salad-bowl-crystal-lake,Portillo's Hot Dogs & Barnelli's Salad Bowl,https://www.yelp.com/biz/portillos-hot-dogs-and-barnellis-salad-bowl-crystal-lake,4.0,"[Category(name='Hot Dogs', alias='hotdog'), Category(name='Salad', alias='salad'), Category(name='Burgers', alias='burgers')]",['855 Cog Circle'],US,Crystal Lake,IL,60014,135,True,"Can't ever go wrong with Portillos. Never had a problem with this location either.

I've been going to Portillos for years and have pretty much tried all my...",729
chungkiwa-restaurant-mount-prospect,Chungkiwa Restaurant,https://www.yelp.com/biz/chungkiwa-restaurant-mount-prospect,4.5,"[Category(name='Korean', alias='korean')]",['1658 W Algonquin Rd'],US,Mount Prospect,IL,60056,124,True,"Highly recommended!!!
Great quality,  great service, great taste!
AND lovely gift~
Came for many times with different friends. Everyone said it is the Best...",729
bangkok-thai-and-sushi-restaurant-algonquin,@BANGKOK Thai & Sushi Restaurant,https://www.yelp.com/biz/bangkok-thai-and-sushi-restaurant-algonquin,3.5,"[Category(name='Sushi Bars', alias='sushi'), Category(name='Thai', alias='thai')]",['4077 W Algonquin Rd'],US,Algonquin,IL,60102,86,True,"New owners and a new menu as of Oct 1ish. I just had the BEST Spring Rolls with shrimp anywhere. You know the ones: Cold, rice paper wrapped around...",731
rookies-all-american-pub-and-grill-hoffman-estates,Rookies All-American Pub & Grill,https://www.yelp.com/biz/rookies-all-american-pub-and-grill-hoffman-estates,3.0,"[Category(name='American (Traditional)', alias='tradamerican'), Category(name='Sports Bars', alias='sportsbars')]",['4607 W Higgins Rd'],US,Hoffman Estates,IL,60010,84,True,"Can I just say, the manager is very gorgeous and so polite.
We'll definitely be coming back in.
$1 Burgers!",733
taste-of-thai-hoffman-estates,Taste of Thai,https://www.yelp.com/biz/taste-of-thai-hoffman-estates,3.5,"[Category(name='Thai', alias='thai')]",['1029-31 W Golf Rd'],US,Hoffman Estates,IL,60169,116,True,The spring roll appetizer was beautifully presented. It was good but we have had better. The soft shell crab tempura was magnificent. The large order came...,734
gilberts-kitchen-west-dundee,Gilbert's Kitchen,https://www.yelp.com/biz/gilberts-kitchen-west-dundee,3.0,"[Category(name='Chinese', alias='chinese')]",['709 S 8th St'],US,West Dundee,IL,60118,50,False,"Have been going here for years and although the owners changed, the food is still good and leaves my family wanting more. Keep it up Gilbert's!",734
elms-restaurant-batavia,Elms Restaurant,https://www.yelp.com/biz/elms-restaurant-batavia,4.5,"[Category(name='Restaurants', alias='restaurants')]",['912 Main St'],US,Batavia,IL,60510,10,False,"This little mom and pop place has been around since i was a kid, its got great soft serve ice cream and the people are so nice. great homemade food and the...",734
coopers-corner-winfield,Cooper's Corner,https://www.yelp.com/biz/coopers-corner-winfield,3.0,"[Category(name='Restaurants', alias='restaurants')]",['27W150 Roosevelt Rd'],US,Winfield,IL,60190,61,True,Showed up on a random wednesday.  Was surprised with $1 tacos and cover free live swing and big band music.  Had an exceptional time.,734
stoney-river-steakhouse-and-grill-deer-park,Stoney River Steakhouse and Grill,https://www.yelp.com/biz/stoney-river-steakhouse-and-grill-deer-park,4.0,"[Category(name='Steakhouses', alias='steak'), Category(name='Seafood', alias='seafood')]",['20504 N Rand Rd'],US,Deer Park,IL,60010,170,True,"So far this is the best steakhouse I have found in Chicago.

The table bread is great, little balls of awesome! However, the shape of the bread makes it a...",735
mowa-arlington-heights,Mowa,https://www.yelp.com/biz/mowa-arlington-heights,4.5,"[Category(name='Bars', alias='bars'), Category(name='Korean', alias='korean'), Category(name='Asian Fusion', alias='asianfusion')]",['4216 N Arlington Heights Rd'],US,Arlington Heights,IL,60004,10,False,"It might be one of the best Korean fried chicken. 

Half/half fried chicken
The breading was good. It kinda reminds you chicken tender crispy and seasoning...",737
emmetts-brewing-co-palatine,Emmett's Brewing Co,https://www.yelp.com/biz/emmetts-brewing-co-palatine,3.0,"[Category(name='Bars', alias='bars'), Category(name='American (Traditional)', alias='tradamerican'), Category(name='Breweries', alias='breweries')]",['110 N Brockway St'],US,Palatine,IL,60067,229,True,"I loved this spot in downtown palatine! Great food, drinks, and service. I am so fascinated by breweries, so it was fun eating at one. Their flight deal is...",738
dragon-buffet-west-dundee,Dragon Buffet,https://www.yelp.com/biz/dragon-buffet-west-dundee,2.0,"[Category(name='Buffets', alias='buffets'), Category(name='Chinese', alias='chinese')]",['1438 Spring Hill Mall'],US,West Dundee,IL,60118,18,False,Food is delicious! Staff is friendly and cheerful. The restaurant is HUGE and very clean. Parking is close and has a large capacity (it's next to Barnes and...,738
main-street-pub-glen-ellyn,Main Street Pub,https://www.yelp.com/biz/main-street-pub-glen-ellyn,4.0,"[Category(name='Burgers', alias='burgers'), Category(name='Pubs', alias='pubs')]",['466 N Main St'],US,Glen Ellyn,IL,60137,49,True,Glad this place is here in my neighborhood! I have gone to the other location in Naperville and this one is just as good. I love the burgers and I don't...,738
mago-grill-and-cantina-arlington-heights-2,Mago Grill & Cantina,https://www.yelp.com/biz/mago-grill-and-cantina-arlington-heights-2,4.0,"[Category(name='Mexican', alias='mexican'), Category(name='Latin American', alias='latin'), Category(name='Bars', alias='bars')]","['115 W Campbell St', 'Metropolis Performing Arts Centre Building']",US,Arlington Heights,IL,60005,445,True,"I went to Mago some time back, and wasn't totally blown away. Perfectly serviceable food, but no standouts and pretty expensive.

Honestly, I forget what I...",739
texas-roadhouse-crystal-lake,Texas Roadhouse,https://www.yelp.com/biz/texas-roadhouse-crystal-lake,3.0,"[Category(name='American (Traditional)', alias='tradamerican'), Category(name='Barbeque', alias='bbq'), Category(name='Steakhouses', alias='steak')]",['835 Cog Cir'],US,Crystal Lake,IL,60014,102,True,"IMHO, the best of the casual Steak chain restaurants.

It's Father's day, so I got to pick the place for dinner.  I had fond memories of Texas Roadhouse...",739
biaggis-ristorante-italiano-deer-park,Biaggi's Ristorante Italiano,https://www.yelp.com/biz/biaggis-ristorante-italiano-deer-park,3.5,"[Category(name='Italian', alias='italian')]",['20560 N Rand Rd'],US,Deer Park,IL,60010,156,False,"Great menu, food was good both times we visited. I love the fact that there is no cork fee if you bring your own wine that is not on the list. First time we...",740
red-robin-gourmet-burgers-hoffman-estates,Red Robin Gourmet Burgers,https://www.yelp.com/biz/red-robin-gourmet-burgers-hoffman-estates,3.0,"[Category(name='Burgers', alias='burgers'), Category(name='American (Traditional)', alias='tradamerican')]",['2742 Sutton Road'],US,Hoffman Estates,IL,60192,56,True,"I always order the same thing, the dgb on a gf bun with sweet potato fries. Ahhhhhh such a treat! When i said i had some food allergies on my first visit,...",741
original-dog-tracks-barrington-2,Original Dog Tracks,https://www.yelp.com/biz/original-dog-tracks-barrington-2,4.0,"[Category(name='Fast Food', alias='hotdogs'), Category(name='Hot Dogs', alias='hotdog')]",['100 Lageschulte St'],US,Barrington,IL,60010,7,False,good but greasy. pizza puffs are very greasy to eat. but burgers are pretty good.,742
punch-bowl-social-schaumburg,Punch Bowl Social,https://www.yelp.com/biz/punch-bowl-social-schaumburg,3.5,"[Category(name='Gastropubs', alias='gastropubs'), Category(name='American (New)', alias='newamerican'), Category(name='Bowling', alias='bowling')]",['1100 American Ln'],US,Schaumburg,IL,60173,151,True,"What a fun place!  Clare, our server was so friendly and attentive.   The menu is full of new takes on old classics and they all WORK!  The appetizers...",744
osteria-trulli-arlington-heights,Osteria Trulli,https://www.yelp.com/biz/osteria-trulli-arlington-heights,4.0,"[Category(name='Italian', alias='italian')]",['1510 E Hintz Rd'],US,Arlington Heights,IL,60004,37,False,"An absolutely incredible Fava and truffle risotto. 
Lots of burratta.  The pizza looked incredible. 
Noisy and great.  Great bracciole.",748
pho-an-heights-arlington-heights,Pho An Heights,https://www.yelp.com/biz/pho-an-heights-arlington-heights,4.0,"[Category(name='Vietnamese', alias='vietnamese'), Category(name='Desserts', alias='desserts'), Category(name='Chicken Wings', alias='chicken_wings')]",['6 S Dunton Ave'],US,Arlington Heights,IL,60005,41,False,"This place is really nice!!  I love the modern decor, extremely clean and very inviting.  They paid attention to little details like water carafe on the...",748
chatter-box-of-long-grove-long-grove-2,Chatter Box Of Long Grove,https://www.yelp.com/biz/chatter-box-of-long-grove-long-grove-2,4.0,"[Category(name='Bars', alias='bars'), Category(name='American (New)', alias='newamerican')]",['330 Old McHenry Rd'],US,Long Grove,IL,60047,98,True,"Taco Tuesday 
You need to go to Chatterbox for their taco special. 
Way too good. I need to stop here regularly on Tuesdays from now on.",751
dianas-red-hots-carol-stream,Diana's Red Hots,https://www.yelp.com/biz/dianas-red-hots-carol-stream,4.5,"[Category(name='Burgers', alias='burgers'), Category(name='Sandwiches', alias='sandwiches'), Category(name='Hot Dogs', alias='hotdog')]",['185 S Schmale Rd'],US,Carol Stream,IL,60188,27,False,"and again the guys at dianas red hots through down with the beat breakfast ever. 
these guys dont even sell breakfast but went out of there way to make what...",752
georgias-restaurant-algonquin-2,Georgia's Restaurant,https://www.yelp.com/biz/georgias-restaurant-algonquin-2,3.0,"[Category(name='American (Traditional)', alias='tradamerican')]",['1470 S Randall Rd'],US,Algonquin,IL,60102,74,True,"Outstanding customer service! They missed putting our name down and after 15min. I asked when we would be seated, and they apologized. They gave 50% off our...",752
buona-restaurant-and-catering-st-charles,Buona Restaurant & Catering,https://www.yelp.com/biz/buona-restaurant-and-catering-st-charles,4.0,"[Category(name='Italian', alias='italian'), Category(name='Pizza', alias='pizza'), Category(name='Sandwiches', alias='sandwiches')]",['2425 W. Main St'],US,St Charles,IL,60175,34,True,"The decor is very cool at this location. I think I've overlooked Buona for too long. One bad experience years ago, finally gave them another shot, was NOT...",753
pita-and-kabobz-schaumburg,Pita & Kabobz,https://www.yelp.com/biz/pita-and-kabobz-schaumburg,3.0,"[Category(name='Indian', alias='indpak'), Category(name='Afghan', alias='afghani'), Category(name='Pakistani', alias='pakistani')]",['1125 N Salem Dr'],US,Schaumburg,IL,60173,86,True,"Delicious food.
Biryani, Kabob, Chicken and vegetarian food is just mouth watering.
Reasonable price.",754
las-cazuelitas-crystal-lake-2,Las Cazuelitas,https://www.yelp.com/biz/las-cazuelitas-crystal-lake-2,3.5,"[Category(name='Mexican', alias='mexican'), Category(name='Seafood', alias='seafood')]",['21 Crystal Lake Plz'],US,Crystal Lake,IL,60014,58,True,"Love this place!! Live music, service for a big partying party of 19, food and drinks on point!!",755
islas-marias-hanover-park,Islas Marias,https://www.yelp.com/biz/islas-marias-hanover-park,3.5,"[Category(name='Seafood', alias='seafood')]",['6602 Barrington Rd'],US,Hanover Park,IL,60133,12,False,Had to finally try this restaurant and didn't fail us. Had the shrimp ceviche in generous amounts and shrimp empanada. The hubby got the carne asada and...,756
paradise-biryani-pointe-schaumburg-3,Paradise Biryani Pointe,https://www.yelp.com/biz/paradise-biryani-pointe-schaumburg-3,2.5,"[Category(name='Indian', alias='indpak'), Category(name='Pakistani', alias='pakistani')]",['927 W Golf Rd'],US,Schaumburg,IL,60194,77,True,"The name suggests Biryani to be yummy.. But dont go with high expectations. I tried veg biryani, but its not that great. Its mild on spices, and doesn't...",757
sergios-cantina-geneva,Sergio's Cantina,https://www.yelp.com/biz/sergios-cantina-geneva,3.0,"[Category(name='Mexican', alias='mexican')]",['30 W State St'],US,Geneva,IL,60134,182,True,Came here on a whim and I have to say it was a total win! We sat at the bar and order just a house margarita. I ended up with the biggest house margarita...,759
hickory-roasters-rolling-meadows,Hickory Roasters,https://www.yelp.com/biz/hickory-roasters-rolling-meadows,4.0,"[Category(name='Barbeque', alias='bbq')]",['5440 New Wilke Rd'],US,Rolling Meadows,IL,60008,70,False,"Family owned....like Boston Market, but not a chain. Really good chicken and sides!
Count on fresh and good! 
Not fancy, stop in how you are!",759
ashoka-glendale-heights,Ashoka,https://www.yelp.com/biz/ashoka-glendale-heights,4.0,"[Category(name='Indian', alias='indpak')]",['252 E Army Trail Rd'],US,Glendale Heights,IL,60139,43,True,Went here tonight on a stranger's recommendation.  Very impressed by the food.  Naan was super soft and fluffy. They spice the food a lot and my friend...,760
randalls-pancake-house-and-restaurant-south-elgin,Randall's Pancake House & Restaurant,https://www.yelp.com/biz/randalls-pancake-house-and-restaurant-south-elgin,3.5,"[Category(name='Breakfast & Brunch', alias='breakfast_brunch')]",['305 Randall Road'],US,South Elgin,IL,60177,87,False,"Great breakfast diner. Even though it was totally packed the wait wasn't bad at all ( which is great when you have little monsters with you)

Food is always...",760
hunan-beijing-hoffman-estates,Hunan Beijing,https://www.yelp.com/biz/hunan-beijing-hoffman-estates,3.5,"[Category(name='Chinese', alias='chinese')]",['3051 N Barrington Rd'],US,Hoffman Estates,IL,60192,82,False,"I had the Triple Delight. Wanted spicy and couldn't decide between beef, chicken or shrimp-this dish is hot and includes all 3. Perfectly seasoned,...",760
manor-restaurant-and-pancake-house-east-dundee,Manor Restaurant & Pancake House,https://www.yelp.com/biz/manor-restaurant-and-pancake-house-east-dundee,3.0,"[Category(name='Breakfast & Brunch', alias='breakfast_brunch'), Category(name='American (Traditional)', alias='tradamerican')]",['425 E Main St'],US,East Dundee,IL,60118,74,False,"This place is down the road from where I golf on Tuesdays, so it's been my morning ritual before my round of golf.  This review encompasses the last 4...",760
lou-malnatis-pizzeria-elk-grove-village,Lou Malnati's Pizzeria,https://www.yelp.com/biz/lou-malnatis-pizzeria-elk-grove-village,4.0,"[Category(name='Pizza', alias='pizza'), Category(name='Italian', alias='italian')]",['1050 E Higgins Rd'],US,Elk Grove Village,IL,60007,294,True,I had a business trip that brought me to Chicago and we decided to stop through here for lunch. This lunch made my day!! The food was incredibly delicious....,761
jersey-mikes-subs-schaumburg-5,Jersey Mike's Subs,https://www.yelp.com/biz/jersey-mikes-subs-schaumburg-5,3.5,"[Category(name='Sandwiches', alias='sandwiches'), Category(name='Delis', alias='delis'), Category(name='Fast Food', alias='hotdogs')]",['2568 W. Schaumburg Rd.'],US,Schaumburg,IL,60194,85,True,So much better and filling than any other sand which place. It's worth the money every time I go. The people there are always nice and welcoming and happy...,762
pizzeria-antica-bloomingdale,Pizzeria Antica,https://www.yelp.com/biz/pizzeria-antica-bloomingdale,4.0,"[Category(name='Pizza', alias='pizza')]",['119 W Lake St'],US,Bloomingdale,IL,60108,61,True,Delicious margarita pizza and ponz. Nice quality ingredients and not over doing it with sauce and cheese. Very impressed and I am picky about the quality of...,763
thumka-indian-bar-and-grill-hoffman-estates,Thumka Indian Bar & Grill,https://www.yelp.com/biz/thumka-indian-bar-and-grill-hoffman-estates,3.5,"[Category(name='Indian', alias='indpak')]",['2336 W Higgins Rd'],US,Hoffman Estates,IL,60169,101,True,"You won't get service with a smile, but the service is good for an Indian restaurant  (you know what I mean).

The food is great and the spread is one of...",764
kyoto-japanese-restaurant-crystal-lake,Kyoto Japanese Restaurant,https://www.yelp.com/biz/kyoto-japanese-restaurant-crystal-lake,4.0,"[Category(name='Japanese', alias='japanese')]",['5690 Northwest Hwy'],US,Crystal Lake,IL,60014,138,False,This is one of my favorite restaurants anywhere.  I don't give five stars as that would be reserved for that caliber of restaurant.  Habachi is good...,764
sir-nicks-pizza-bartlett,SIR Nick's Pizza,https://www.yelp.com/biz/sir-nicks-pizza-bartlett,3.5,"[Category(name='Pizza', alias='pizza')]",['105 E Lake St'],US,Bartlett,IL,60103,22,True,"One of the best thin pizzas in the area!  The ingredients are fresh and tasty. I like to finish my pizza off at home, so I request it not cut. They do...",766
mels-diner-saint-charles,Mels Diner,https://www.yelp.com/biz/mels-diner-saint-charles,3.5,"[Category(name='Diners', alias='diners'), Category(name='Mexican', alias='mexican')]",['40W160 Campton Crossings Dr'],US,Saint Charles,IL,60175,15,False,Came in for breakfast after avoiding long waits at other St Charles options. Been a wile since we were here and new owners have upgraded the quality of...,766
rosatis-pizza-of-streamwood-streamwood,Rosati's Pizza of Streamwood,https://www.yelp.com/biz/rosatis-pizza-of-streamwood-streamwood,4.0,"[Category(name='Pizza', alias='pizza'), Category(name='Italian', alias='italian')]",['27 S Sutton Rd'],US,Streamwood,IL,60107,31,True,"This pizza was DELICIOUS and placing an order was fast and easy. There weren't any problems picking it up, and it was nice and hot once I got home.",767
sozai-banzai-arlington-heights,Sozai Banzai,https://www.yelp.com/biz/sozai-banzai-arlington-heights,4.5,"[Category(name='Ramen', alias='ramen')]",['1089 E Golf Rd'],US,Arlington Heights,IL,60005,83,True,"My boyfriend and I are always craving ramen during the evening, but instead of going to our go-to spot Santouka in Mitsuwa, we decided to try somewhere new....",770
macianos-pizza-and-pastaria-winfield,Maciano's Pizza & Pastaria,https://www.yelp.com/biz/macianos-pizza-and-pastaria-winfield,3.5,"[Category(name='Pizza', alias='pizza'), Category(name='Italian', alias='italian')]",['26W220 Geneva Rd'],US,Winfield,IL,60190,72,True,"We ordered take-out from Maciano's Pizza & Pastaria and enjoyed the meal very much.

This was a quick pizza dinner with friends and they recommended pizza...",771
the-cellar-bistro-wheaton,The Cellar Bistro,https://www.yelp.com/biz/the-cellar-bistro-wheaton,3.5,"[Category(name='American (New)', alias='newamerican'), Category(name='Salad', alias='salad'), Category(name='Seafood', alias='seafood')]",['132 N Hale St'],US,Wheaton,IL,60187,123,True,Probably 3.5 stars. I was there for a private party. They were very accommodating and let us bring in our own champagne and desserts. The place was perfect...,772
crosstown-pub-and-grill-batavia-batavia-4,Crosstown Pub & Grill Batavia,https://www.yelp.com/biz/crosstown-pub-and-grill-batavia-batavia-4,3.0,"[Category(name='Chicken Wings', alias='chicken_wings'), Category(name='American (New)', alias='newamerican'), Category(name='Pubs', alias='pubs')]",['1890 Mill St'],US,Batavia,IL,60510,125,True,"We stopped in to watch the Packer game since they weren't on local TV. Stephanie was our waitress and she was awesome. 

Their beer lust us extensive with...",775
