business_id,business_name,business_url,business_rating,business_categories,business_locationaddress,business_country,business_city,business_statecode,business_zipcode,business_reviewcount,is_claimed,snippet_text,offset
brunch-café-roselle,Brunch Café,https://www.yelp.com/biz/brunch-caf%C3%A9-roselle,4.5,"[Category(name='Breakfast & Brunch', alias='breakfast_brunch'), Category(name='Burgers', alias='burgers'), Category(name='Sandwiches', alias='sandwiches')]",['1500 W Lake St'],US,Roselle,IL,60172,387,True,"I've been a fan of McHenry's Brunch Cafe for years, and am so excited to learn there is one nearby in Roselle! 

The food is great, the atmosphere is...",222
v-thai-roselle,V - Thai,https://www.yelp.com/biz/v-thai-roselle,4.0,"[Category(name='Thai', alias='thai')]",['982 Lake St'],US,Roselle,IL,60172,54,False,I've been waiting to try this place after seeing all the great reviews!  It did not disappoint!  Yellow Chicken Curry was absolutely delicious.  My friend...,223
nikko-sushi-arlington-heights,Nikko Sushi,https://www.yelp.com/biz/nikko-sushi-arlington-heights,4.5,"[Category(name='Sushi Bars', alias='sushi'), Category(name='Japanese', alias='japanese'), Category(name='Korean', alias='korean')]",['282 E Algonquin Rd'],US,Arlington Heights,IL,60005,389,False,"This place is delicious! They offer sushi combo's with great presentation and flavors. I really like the summer roll and the justyna. 

It is a little...",224
subway-schaumburg-19,Subway,https://www.yelp.com/biz/subway-schaumburg-19,2.0,"[Category(name='Sandwiches', alias='sandwiches'), Category(name='Fast Food', alias='hotdogs')]",['1400 N Roselle Rd'],US,Schaumburg,IL,60195,4,False,"I find it fitting that as of this review, the picture that represents this Subway location is that of a toilet bowl, which accurately describes the quality...",225
el-rodeo-tacos-streamwood,El Rodeo Tacos,https://www.yelp.com/biz/el-rodeo-tacos-streamwood,4.0,"[Category(name='Mexican', alias='mexican')]",['688 S Barrington Rd'],US,Streamwood,IL,60107,74,True,"One of the best authentic Mexican spots around. All employees are friendly, prices are reasonable, and the food is excellent. Inside doesn't look all that...",226
mi-casa-bloomingdale,Mi Casa,https://www.yelp.com/biz/mi-casa-bloomingdale,5.0,"[Category(name='Mexican', alias='mexican')]","['148 S Bloomingdale Rd', 'Ste 104']",US,Bloomingdale,IL,60108,11,False,"I got a chicken torta meal, with no beans. When I requested it, they just gave me more rice, which is really good. :O  It was delicious!  But be aware that...",227
bombay-chopsticks-hoffman-estates-3,Bombay Chopsticks,https://www.yelp.com/biz/bombay-chopsticks-hoffman-estates-3,3.5,"[Category(name='Indian', alias='indpak'), Category(name='Chinese', alias='chinese'), Category(name='Asian Fusion', alias='asianfusion')]",['721 W Golf Rd'],US,Hoffman Estates,IL,60169,317,True,"Great place.  I originally visited this place when it first opened, did not like it at all.  Went back last month and the food is amazing.  The waiter Kumar...",227
antonio-ristorante-itasca,Antonio Ristorante,https://www.yelp.com/biz/antonio-ristorante-itasca,4.5,"[Category(name='Italian', alias='italian')]",['280 N Rohlwing Rd'],US,Itasca,IL,60143,32,False,"Man, oh, man.

Antonio Ristorante makes some great food. My family comes here quite often - and raves about it to me over the phone - so I made a point to...",228
franks-chicago-shrimp-hoffman-estates,Franks Chicago Shrimp,https://www.yelp.com/biz/franks-chicago-shrimp-hoffman-estates,4.0,"[Category(name='American (New)', alias='newamerican')]",['3071 N Barrington Rd'],US,Hoffman Estates,IL,60192,62,True,"I was in town for work, and was looking for a place the locals recommend. i was not disappointed. Heck, I even tried frog legs for the first time. This...",230
portillos-hot-dogs-rolling-meadows,Portillo's Hot Dogs,https://www.yelp.com/biz/portillos-hot-dogs-rolling-meadows,4.0,"[Category(name='Hot Dogs', alias='hotdog'), Category(name='Salad', alias='salad'), Category(name='Burgers', alias='burgers')]",['1900  Golf Rd'],US,Rolling Meadows,IL,60008,115,True,I love a Chicago Dog so when I was in town for business and mentioned this I was quickly taken to Portillo's for lunch and I am so glad!  I  put in an order...,230
la-charanga-rolling-meadows,La Charanga,https://www.yelp.com/biz/la-charanga-rolling-meadows,4.0,"[Category(name='Mexican', alias='mexican')]",['4003 W Algonquin Rd'],US,Rolling Meadows,IL,60008,34,True,"Just very good authentic Mexican food. 
The food is delicious, the price is fair and the server, Raul took very good care of us. 

I have been a regular...",232
umacamon-japanese-kitchen-rolling-meadows,Umacamon Japanese Kitchen,https://www.yelp.com/biz/umacamon-japanese-kitchen-rolling-meadows,4.0,"[Category(name='Sushi Bars', alias='sushi'), Category(name='Ramen', alias='ramen')]",['1673 W Algonquin Rd'],US,Rolling Meadows,IL,60008,55,True,"Great surprise here.  Wasn't expecting much.  It may not matter to anyone else, but I am hyped to say that the kitchen is run by Japanese proprietors.  You...",233
brandys-home-of-the-gyros-hanover-park,Brandy's - Home of the Gyros,https://www.yelp.com/biz/brandys-home-of-the-gyros-hanover-park,4.0,"[Category(name='Greek', alias='greek'), Category(name='American (Traditional)', alias='tradamerican'), Category(name='Burgers', alias='burgers')]",['1921 W Irving Park Rd'],US,Hanover Park,IL,60107,63,False,"Had the rib tips and greek potatoes.  While the rib tips are ten dollars, they give you enough to make three normal portions so you really get a lot of...",234
roccovinos-italian-restaurant-elk-grove-village,RoccoVino's Italian Restaurant,https://www.yelp.com/biz/roccovinos-italian-restaurant-elk-grove-village,4.0,"[Category(name='Italian', alias='italian')]",['1085 Nerge Rd'],US,Elk Grove Village,IL,60007,40,True,Time to update my review and Rocco Vino's remains a 5-star favorite for the same reasons I outlined in 2014.  The baked clams are still big and delicious...,235
teddys-diner-elk-grove-village,Teddy's Diner,https://www.yelp.com/biz/teddys-diner-elk-grove-village,4.0,"[Category(name='Breakfast & Brunch', alias='breakfast_brunch'), Category(name='Creperies', alias='creperies')]",['1065 Rohlwing Rd'],US,Elk Grove Village,IL,60007,97,True,"Always stop here when in town. Affordable prices and consistent quality always make this a must if you are into diner food.
Last visit I had BLT club, which...",236
lilys-hoffman-estates,Lily's,https://www.yelp.com/biz/lilys-hoffman-estates,4.0,"[Category(name='Mexican', alias='mexican')]",['1624 W Algonquin Rd'],US,Hoffman Estates,IL,60192,57,False,On our way home from Barrington we stopped here for a casual dinner and it was due to the YELP reviews. Chips and salsa were great! I ordered the fish tacos...,237
wendys-schaumburg-2,Wendy's,https://www.yelp.com/biz/wendys-schaumburg-2,4.0,"[Category(name='Fast Food', alias='hotdogs'), Category(name='Burgers', alias='burgers')]",['1750 E Higgins Rd'],US,Schaumburg,IL,60173,5,False,"Drive thru service here is very fast ! 
Eat in another story the line takes forever during lunch hours",238
tapalpa-mexican-restaurant-elk-grove-village,Tapalpa Mexican Restaurant,https://www.yelp.com/biz/tapalpa-mexican-restaurant-elk-grove-village,3.5,"[Category(name='Mexican', alias='mexican')]",['770 S Arlington Heights Rd'],US,Elk Grove Village,IL,60007,117,True,"I've been going to Tapalpa for about a year now and though I get the same meal each visit, I love the food and service more and more every time. 
In all...",239
bulldog-ale-house-roselle,Bulldog Ale House,https://www.yelp.com/biz/bulldog-ale-house-roselle,3.0,"[Category(name='Burgers', alias='burgers'), Category(name='Fast Food', alias='hotdogs'), Category(name='Sports Bars', alias='sportsbars')]",['394 Irving Park Rd'],US,Roselle,IL,60172,199,True,"Definitely improved since they opened.  Back then the bar stools were very uncomfortable  and there were some scary dudes in there each time. 

They did...",241
go-goo-ma-korean-hoffman-estates,Go Goo Ma Korean,https://www.yelp.com/biz/go-goo-ma-korean-hoffman-estates,4.0,"[Category(name='Korean', alias='korean')]",['1606 West Algonquin Rd'],US,Hoffman Estates,IL,60192,24,False,"We've been coming here for over 12 years, food is always excellent.  They make home-style Korean food.  Self-service, so no tip required.  

Also, if you...",242
qulinarnia-mount-prospect,Qulinarnia,https://www.yelp.com/biz/qulinarnia-mount-prospect,4.5,"[Category(name='Polish', alias='polish')]",['1730 W Golf Rd'],US,Mount Prospect,IL,60056,104,True,"In one word: ""FABULOUS!"" This is a very special ethnic Polish restaurant with a cook who has very spectacularly hacked the Polish cuisine with some...",243
pita-bbq-streamwood,Pita BBQ,https://www.yelp.com/biz/pita-bbq-streamwood,4.5,"[Category(name='Barbeque', alias='bbq'), Category(name='Mediterranean', alias='mediterranean'), Category(name='Middle Eastern', alias='mideastern')]",['19 S Sutton Rd'],US,Streamwood,IL,60107,179,True,This place is wonderful! The food is awesome and the staff is friendly. Whenever I have a craving for good food I beg my husband to get the beef shawarma...,245
deli-time-schaumburg,Deli Time,https://www.yelp.com/biz/deli-time-schaumburg,3.0,"[Category(name='Delis', alias='delis')]",['1501 E Woodfield Rd'],US,Schaumburg,IL,60173,7,False,"I was in the area and decided to check this place out. As usual with corporate places where there's a large building leasing out to different companies,...",247
faizaans-tasty-burgers-hanover-park,Faizaan's Tasty Burgers,https://www.yelp.com/biz/faizaans-tasty-burgers-hanover-park,3.5,"[Category(name='Burgers', alias='burgers'), Category(name='Halal', alias='halal')]",['7219 Orchard Ln'],US,Hanover Park,IL,60133,84,True,"This place has the most delicious zabiha burgers in chicago, two of my favorites: texas chicken and ANGRY BULL's EYE are the best! MANGO SHAKES ARE TO DIE...",247
chopstick-rolling-meadows,Chopstick,https://www.yelp.com/biz/chopstick-rolling-meadows,4.0,"[Category(name='Szechuan', alias='szechuan'), Category(name='Cantonese', alias='cantonese'), Category(name='Seafood', alias='seafood')]",['1930 W Central Rd'],US,Rolling Meadows,IL,60008,46,True,"10/10 Absolutely impressed! 

Every time I order I usually have it delivered service since sometimes not in the mood to cook when I come from work plus...",247
marias-mexican-bar-and-grill-roselle,Maria's Mexican Bar & Grill,https://www.yelp.com/biz/marias-mexican-bar-and-grill-roselle,3.5,"[Category(name='Mexican', alias='mexican'), Category(name='Bars', alias='bars'), Category(name='Vegetarian', alias='vegetarian')]",['861 E Nerge Rd'],US,Roselle,IL,60172,67,True,"My wife and I enjoyed a very nice dinner at Maria's. It was our first visit and the service and food were excellent, I had a house Margarita which was very...",248
artistic-cuisine-palatine,Artistic Cuisine,https://www.yelp.com/biz/artistic-cuisine-palatine,4.0,"[Category(name='Latin American', alias='latin'), Category(name='Argentine', alias='argentine'), Category(name='Italian', alias='italian')]",['16 S Bothwell St'],US,Palatine,IL,60067,188,True,Fun outdoor venue in summer - the espresso was quite good! An odd mix of high-end Italian food and artistic pizzas on the menu. Staff has always been...,249
morettis-ristorante-and-pizzeria-hoffman-estates,Moretti's Ristorante & Pizzeria,https://www.yelp.com/biz/morettis-ristorante-and-pizzeria-hoffman-estates,3.5,"[Category(name='Pizza', alias='pizza'), Category(name='Italian', alias='italian')]",['2475 W Higgins Rd'],US,Hoffman Estates,IL,60169,84,True,Been to this Moretti's a couple of times. Good hamburgers and strong drinks. Food is delicious. My absolute favorite is the short rib ravioli. The portion...,250
royal-hummus-and-falafel-roselle,Royal Hummus & Falafel,https://www.yelp.com/biz/royal-hummus-and-falafel-roselle,4.0,"[Category(name='Falafel', alias='falafel'), Category(name='Middle Eastern', alias='mideastern')]",['1230 W Lake St'],US,Roselle,IL,60172,55,True,"Went in for a quick bite and came out more than satisfied. Great portions, awesome service and the food is made fresh to order! We had the spicy falafel and...",251
el-patron-taqueria-and-grill-hanover-park,"El Patron, Taqueria and Grill",https://www.yelp.com/biz/el-patron-taqueria-and-grill-hanover-park,4.5,"[Category(name='Mexican', alias='mexican')]",['6772 Barrington Rd'],US,Hanover Park,IL,60133,26,True,"This place is seriously really good.

Great prices. Nice people. 

Tacos and Burritos are amazing. They grill the tortilla and its perfect.",252
sakura-woodfield-rolling-meadows,Sakura Woodfield,https://www.yelp.com/biz/sakura-woodfield-rolling-meadows,4.0,"[Category(name='Japanese', alias='japanese'), Category(name='Sushi Bars', alias='sushi')]",['4011 Algonquin Rd'],US,Rolling Meadows,IL,60008,109,False,"This place is a hidden gem. 
Tempura was good and a large portion, rolls were really fresh and tasted awesome. 

From the outside its easy to miss it, the...",253
ramen-misoya-mount-prospect,Ramen Misoya,https://www.yelp.com/biz/ramen-misoya-mount-prospect,4.0,"[Category(name='Ramen', alias='ramen')]",['1584 S Busse Rd'],US,Mount Prospect,IL,60056,543,True,"Can't say how much I love this place.
Went here with the love of my life, on a date, when I went to go visit him. Now the only type of ramen I've ever had...",254
italian-pizza-kitchen-roselle,Italian Pizza Kitchen,https://www.yelp.com/biz/italian-pizza-kitchen-roselle,4.0,"[Category(name='Italian', alias='italian'), Category(name='Pizza', alias='pizza'), Category(name='Sandwiches', alias='sandwiches')]",['11 Monaco Dr'],US,Roselle,IL,60172,104,True,"They really do need a bigger restaurant! Can't wait until the new location is finished.
The people behind the counter are ALWAYS nice!!!! That goes such a...",255
fireside-ale-house-streamwood,Fireside Ale House,https://www.yelp.com/biz/fireside-ale-house-streamwood,3.0,"[Category(name='Pubs', alias='pubs'), Category(name='American (Traditional)', alias='tradamerican')]",['50 N Barrington Rd'],US,Streamwood,IL,60107,143,True,So we had started out at another restaurant that was so disappointing we left before we even finished our drinks. This place turned our night around. I will...,257
felicias-meat-market-and-deli-elk-grove-village,Felicia's Meat Market & Deli,https://www.yelp.com/biz/felicias-meat-market-and-deli-elk-grove-village,4.0,"[Category(name='Meat Shops', alias='meats'), Category(name='Sandwiches', alias='sandwiches')]",['664 Meacham Rd'],US,Elk Grove Village,IL,60007,42,True,So this is probably one of the greatest finds of the Northwest suburbs. I absolutely love delicatessens. This is one of the very few Italian ones remaining...,258
los-burritos-tapatios-restaurant-streamwood,Los Burritos Tapatios Restaurant,https://www.yelp.com/biz/los-burritos-tapatios-restaurant-streamwood,4.0,"[Category(name='Mexican', alias='mexican')]",['1592 Buttitta Dr'],US,Streamwood,IL,60107,137,False,"Only giving this place a 5 star because of how convenient it is. When all bars are closed and you need some sober food, Los B's is the place to go. Open...",259
toscana-restaurant-and-lounge-arlington-heights,Toscana Restaurant & Lounge,https://www.yelp.com/biz/toscana-restaurant-and-lounge-arlington-heights,4.0,"[Category(name='Italian', alias='italian')]",['1859 W Central Rd'],US,Arlington Heights,IL,60005,110,True,The reviews are right! A hidden Italian gem in the suburbs. Toscana seems like a true Italian family owned restaurant with some homemade authentic cooking....,259
hickory-roasters-rolling-meadows,Hickory Roasters,https://www.yelp.com/biz/hickory-roasters-rolling-meadows,4.0,"[Category(name='Barbeque', alias='bbq')]",['5440 New Wilke Rd'],US,Rolling Meadows,IL,60008,70,False,"Family owned....like Boston Market, but not a chain. Really good chicken and sides!
Count on fresh and good! 
Not fancy, stop in how you are!",261
yupin-thai-kitchen-mount-prospect,Yupin Thai Kitchen,https://www.yelp.com/biz/yupin-thai-kitchen-mount-prospect,4.5,"[Category(name='Thai', alias='thai')]",['1652 W Algonquin Rd'],US,Mount Prospect,IL,60056,110,True,So far this would be my new favorite spot when Thai food cravings arises. I made an impromptu stop on a Thursday around 1:30pm and the small restaurant had...,262
egg-basket-pancake-house-streamwood,Egg Basket Pancake House,https://www.yelp.com/biz/egg-basket-pancake-house-streamwood,3.5,"[Category(name='Breakfast & Brunch', alias='breakfast_brunch')]",['880 S Barrington Rd'],US,Streamwood,IL,60107,57,False,"I went here last weekend for brunch and it was delicious! I had an omelette frittata with whole wheat pancakes, and I don't have one negative thing to say...",263
ej-pierogi-elk-grove-village,EJ Pierogi,https://www.yelp.com/biz/ej-pierogi-elk-grove-village,4.5,"[Category(name='Polish', alias='polish'), Category(name='Diners', alias='diners')]",['1700 Oakton St'],US,Elk Grove Village,IL,60007,83,False,Seriously the best pierogi in Chicago. The cheddar and cheese ones make me salivate just thinking about them. Good kielbasa too. I eat here at least once a...,264
mi-general-hoffman-estates,Mi General,https://www.yelp.com/biz/mi-general-hoffman-estates,3.5,"[Category(name='Mexican', alias='mexican')]",['4 Golf Ctr'],US,Hoffman Estates,IL,60169,36,True,I stopped few times at this place - the salsas are amazing. We were served with very fresh and authentic Mexican food. The tacos are to die for. Also I had...,266
gus-diner-rolling-meadows,Gus' Diner,https://www.yelp.com/biz/gus-diner-rolling-meadows,4.0,"[Category(name='Diners', alias='diners'), Category(name='Breakfast & Brunch', alias='breakfast_brunch'), Category(name='Sandwiches', alias='sandwiches')]",['2160 Plum Grove Rd'],US,Rolling Meadows,IL,60008,122,False,"This is an update to my original post because I love this place so much.

I just came here after not being here in two years because I moved out of state. I...",266
carlos-and-carlos-arlington-heights,Carlos & Carlos,https://www.yelp.com/biz/carlos-and-carlos-arlington-heights,4.0,"[Category(name='Italian', alias='italian')]",['27 W Campbell St'],US,Arlington Heights,IL,60005,224,True,"If Olive Garden is your go to Italian food, don't come here then. I feel like the bad reviews were from those type of people. 

We love this place so much!...",267
tokyo-grill-roselle,Tokyo Grill,https://www.yelp.com/biz/tokyo-grill-roselle,4.0,"[Category(name='Japanese', alias='japanese')]",['920 Lake St'],US,Roselle,IL,60172,52,True,Food at Tokyo Grill is opposite the first glance cheesy fast food Curb appeal.  Their sushi menu is extensive and absolutely delicious.  We had a party of...,268
brianas-restaurant-and-pancake-house-palatine,Briana's Restaurant & Pancake House,https://www.yelp.com/biz/brianas-restaurant-and-pancake-house-palatine,4.0,"[Category(name='American (New)', alias='newamerican'), Category(name='Breakfast & Brunch', alias='breakfast_brunch')]",['154 W Northwest Hwy'],US,Palatine,IL,60067,53,False,First visit here. I thought Brianna's was a very good value with great service. Stopped by for breakfast and even though there was a 5 to 10 minute wait....,270
bulldog-ale-house-rolling-meadows,Bulldog Ale House,https://www.yelp.com/biz/bulldog-ale-house-rolling-meadows,3.0,"[Category(name='American (Traditional)', alias='tradamerican'), Category(name='Sports Bars', alias='sportsbars')]",['1480 Golf Rd'],US,Rolling Meadows,IL,60008,76,True,Husband and I came for dinner on 10/6/2016. This was our first time in Bulldog Ale House. We have wanted to try it since we saw it being constructed a few...,270
lou-malnatis-pizzeria-elk-grove-village,Lou Malnati's Pizzeria,https://www.yelp.com/biz/lou-malnatis-pizzeria-elk-grove-village,4.0,"[Category(name='Pizza', alias='pizza'), Category(name='Italian', alias='italian')]",['1050 E Higgins Rd'],US,Elk Grove Village,IL,60007,294,True,I had a business trip that brought me to Chicago and we decided to stop through here for lunch. This lunch made my day!! The food was incredibly delicious....,271
burger-baron-arlington-heights,Burger Baron,https://www.yelp.com/biz/burger-baron-arlington-heights,4.0,"[Category(name='Burgers', alias='burgers')]",['132 E Golf Rd'],US,Arlington Heights,IL,60005,106,False,Came here yesterday for the first time with my friend. Low key place good for kids or a fast bite. I got myself a Beef and sausage combo with fries and a...,272
coopers-hawk-winery-and-restaurants-south-barrington-2,Cooper's Hawk Winery & Restaurants,https://www.yelp.com/biz/coopers-hawk-winery-and-restaurants-south-barrington-2,4.0,"[Category(name='American (New)', alias='newamerican'), Category(name='Wineries', alias='wineries')]",['100 W Higgins Rd'],US,South Barrington,IL,60010,400,True,Recently went here for an anniversary. AMAZING food and service. On The Boarder Egg Rolls were the highlight of my day. Bottle of wine was top notch. My one...,273
chungkiwa-restaurant-mount-prospect,Chungkiwa Restaurant,https://www.yelp.com/biz/chungkiwa-restaurant-mount-prospect,4.5,"[Category(name='Korean', alias='korean')]",['1658 W Algonquin Rd'],US,Mount Prospect,IL,60056,124,True,"Highly recommended!!!
Great quality,  great service, great taste!
AND lovely gift~
Came for many times with different friends. Everyone said it is the Best...",274
dairy-queen-schaumburg,Dairy Queen,https://www.yelp.com/biz/dairy-queen-schaumburg,4.0,"[Category(name='Ice Cream & Frozen Yogurt', alias='icecream'), Category(name='Fast Food', alias='hotdogs')]",['520 S Roselle Rd'],US,Schaumburg,IL,60193,9,False,"You have to love a business that employees local students/kids rather than... well you know what. 

Anyway, this place has always been great for ice cream,...",275
capones-pizzeria-bloomingdale,Capone's Pizzeria,https://www.yelp.com/biz/capones-pizzeria-bloomingdale,4.5,"[Category(name='Pizza', alias='pizza'), Category(name='Italian', alias='italian')]",['360 W Schick Rd'],US,Bloomingdale,IL,60108,53,True,"Date of my visit: 5-August-2016
Time of my visit: around lunch time

This was my first visit at this establishment.  It's not very big for sit ins...",276
johnnies-beef-arlington-heights,Johnnie's Beef,https://www.yelp.com/biz/johnnies-beef-arlington-heights,4.0,"[Category(name='Sandwiches', alias='sandwiches'), Category(name='Hot Dogs', alias='hotdog'), Category(name='Shaved Ice', alias='shavedice')]",['1935 S Arlington Heights Rd'],US,Arlington Heights,IL,60005,330,True,I was highly skeptical of this place looking at the photos. I mean of all food porn on the internet Johnnie's beef sandwiches have to be among the least...,277
sozai-banzai-arlington-heights,Sozai Banzai,https://www.yelp.com/biz/sozai-banzai-arlington-heights,4.5,"[Category(name='Ramen', alias='ramen')]",['1089 E Golf Rd'],US,Arlington Heights,IL,60005,83,True,"My boyfriend and I are always craving ramen during the evening, but instead of going to our go-to spot Santouka in Mitsuwa, we decided to try somewhere new....",278
colombians-taste-itasca,Colombian's Taste,https://www.yelp.com/biz/colombians-taste-itasca,4.5,"[Category(name='Spanish', alias='spanish'), Category(name='Colombian', alias='colombian')]",['5N105 Il Rt 53'],US,Itasca,IL,60143,62,True,"My wife is Colombian and we are always looking for restaurants that serve Colombian cuisine.  This one is fantastic.  I have been here at least 10 times,...",279
subway-schaumburg-3,Subway,https://www.yelp.com/biz/subway-schaumburg-3,1.5,"[Category(name='Sandwiches', alias='sandwiches'), Category(name='Fast Food', alias='hotdogs')]",['824 W Golf Rd'],US,Schaumburg,IL,60194,4,False,I eat here a couple of times a month because it has a very convenient location. Seems like every other Subway.,280
buenos-dias-burritos-itasca,Buenos Dias Burritos,https://www.yelp.com/biz/buenos-dias-burritos-itasca,4.0,"[Category(name='Mexican', alias='mexican')]",['919 W Irving Park Rd'],US,Itasca,IL,60143,72,False,Super nice people. Very fair prices. I must say that I've only had the chicken for the last 7 years. They use some kind of spice on the meat that is very...,281
rack-house-kitchen-and-tavern-arlington-heights-2,Rack House Kitchen & Tavern,https://www.yelp.com/biz/rack-house-kitchen-and-tavern-arlington-heights-2,3.5,"[Category(name='Sports Bars', alias='sportsbars'), Category(name='American (New)', alias='newamerican'), Category(name='Barbeque', alias='bbq')]",['222 E Algonquin Rd'],US,Arlington Heights,IL,60005,194,True,"Well, knock me over and call me dusty, a place to eat in the Chicago burbs that doesn't totally suck. Staying overnight before flying out of o'hare, we were...",282
tony-spavones-bloomingdale-2,Tony Spavone's,https://www.yelp.com/biz/tony-spavones-bloomingdale-2,4.0,"[Category(name='Italian', alias='italian'), Category(name='Wine Bars', alias='wine_bars')]",['266 W Lake St'],US,Bloomingdale,IL,60108,84,True,"Very friendly , very entertaining staff !!!  You will smile while you are at this restaurant - you can't help it.  Very old school and charming. Decor is...",283
tensuke-market-and-sushi-cafe-elk-grove-village-3,Tensuke Market & Sushi Cafe,https://www.yelp.com/biz/tensuke-market-and-sushi-cafe-elk-grove-village-3,4.5,"[Category(name='Japanese', alias='japanese'), Category(name='Sushi Bars', alias='sushi')]",['3 S Arlington Heights Rd'],US,Elk Grove Village,IL,60007,305,True,"We came here recently for the Tuna cutting and it was really packed. Especially the food court. 

I didnt get a chance to shop around, but we watched the...",284
rios-addison-2,Rio's,https://www.yelp.com/biz/rios-addison-2,4.0,"[Category(name='Latin American', alias='latin')]",['1600 W Lake St'],US,Addison,IL,60101,144,True,"My friends came in from out of town, so we got together for dinner and we decided to try this place out. 

We waited for our friends to arrive and were...",285
