business_id,business_name,business_url,business_rating,business_categories,business_locationaddress,business_country,business_city,business_statecode,business_zipcode,business_reviewcount,is_claimed,snippet_text,offset
wingstop-roselle,Wingstop,https://www.yelp.com/biz/wingstop-roselle,3.5,"[Category(name='Chicken Wings', alias='chicken_wings')]",['1306 W Lake St'],US,Roselle,IL,60172,33,True,Stopped in on Friday 10/21/2016. at 2:30pm. Women taking my carryout order was very friendly. She told me the order would take 18 minutes. I ordered the 30...,713
hoys-chinese-restaurant-bensenville,Hoy's Chinese Restaurant,https://www.yelp.com/biz/hoys-chinese-restaurant-bensenville,4.0,"[Category(name='Chinese', alias='chinese')]",['455 W Irving Park Rd'],US,Bensenville,IL,60106,92,False,"A M A Z I N G.... 

Wonderful service, very authentic and tasty food that comes in claim jumper sized portions. All for a steal price! We are beyond happy!",714
mr-cs-hot-dogs-and-more-elgin,Mr C's Hot Dogs and More,https://www.yelp.com/biz/mr-cs-hot-dogs-and-more-elgin,4.0,"[Category(name='Hot Dogs', alias='hotdog')]",['1350 E Chicago St'],US,Elgin,IL,60120,69,True,Amazing food... and fast delivery... I work at ps fuels and I just want to say thank you all for being so amazing thankful and fast...,715
oba-contemporary-japanese-des-plaines,Oba Contemporary Japanese,https://www.yelp.com/biz/oba-contemporary-japanese-des-plaines,4.5,"[Category(name='Japanese', alias='japanese')]",['1285 Elmhurst Rd'],US,Des Plaines,IL,60018,78,True,"The sushi that my wife and I eat here is better than any sushi that we have eaten anywhere. It is fresh, delicious, and they have a way of breaking the norm...",716
sun-shui-restaurant-arlington-heights,Sun Shui Restaurant,https://www.yelp.com/biz/sun-shui-restaurant-arlington-heights,4.0,"[Category(name='Chinese', alias='chinese'), Category(name='Sushi Bars', alias='sushi')]",['155 W Rand Rd'],US,Arlington Heights,IL,60004,204,False,"Fresh sushi and unique menu selection. Upscale ambiance. Great service. 

I especially love the China dragon roll. Not too heavy and lighter on the sauce...",716
tjs-tasty-pie-pizzeria-arlington-heights,Tj's Tasty Pie Pizzeria,https://www.yelp.com/biz/tjs-tasty-pie-pizzeria-arlington-heights,4.5,"[Category(name='Pizza', alias='pizza')]","['1401 E Palatine Rd', 'Ste A']",US,Arlington Heights,IL,60004,32,True,Try the Luke's Special and I promise you won't be disappointed!,720
famous-daves-addison,Famous Dave's,https://www.yelp.com/biz/famous-daves-addison,3.5,"[Category(name='Barbeque', alias='bbq')]",['1631 W Lake St'],US,Addison,IL,60101,81,True,"As far as BBQ comes, I am no connoisseur. This is review is coming from the average twenty something palette.

When we came in on a Tuesday night before...",721
bellamore-cafe-itasca,Bell'Amore Cafe,https://www.yelp.com/biz/bellamore-cafe-itasca,2.0,"[Category(name='American (Traditional)', alias='tradamerican')]",['933 E Irving Park Rd'],US,Itasca,IL,60143,22,True,"I went for lunch with a friend on Thursday.

I had the Reuben, which they advertise as a specialty.  The sandwich was on a homemade marble rye which was...",722
scoobys-red-hots-arlington-heights,Scooby's Red Hots,https://www.yelp.com/biz/scoobys-red-hots-arlington-heights,3.0,"[Category(name='Hot Dogs', alias='hotdog'), Category(name='Fast Food', alias='hotdogs')]",['1039 South Arlington Heights Road'],US,Arlington Heights,IL,60005,27,False,Had a grill chicken pita which was really good.  Fresh cut fries.  Generous helping of French fries.  Nice friendly people.  Clean restaurant and clean...,723
americas-bar-and-grill-hoffman-estates,America's Bar & Grill,https://www.yelp.com/biz/americas-bar-and-grill-hoffman-estates,3.0,"[Category(name='Dance Clubs', alias='danceclubs'), Category(name='Sports Bars', alias='sportsbars'), Category(name='American (Traditional)', alias='tradamerican')]",['2308 W Higgins Rd'],US,Hoffman Estates,IL,60169,66,True,"Monday, 9/26/16.  I wish I was there to see Joe Walsh tonight.  Three full hours!  Wow!  I'm listening on www.560theanswer.com.  Sounds like everyone is...",723
petes-a-pie-elk-grove-village,Pete's-A-Pie,https://www.yelp.com/biz/petes-a-pie-elk-grove-village,4.0,"[Category(name='Pizza', alias='pizza')]",['578 E Devon Ave'],US,Elk Grove Village,IL,60007,18,True,"My grandmother had watched my kids for me for a few hours and when I came to pick them up, she asked me if I could drive her to this place to get a pizza...",723
giacomos-ristorante-italiano-des-plaines,Giacomo's Ristorante Italiano,https://www.yelp.com/biz/giacomos-ristorante-italiano-des-plaines,4.0,"[Category(name='Italian', alias='italian')]",['740 N Wolf Rd'],US,Des Plaines,IL,60016,175,False,"Ate here once for lunch, 2x for dinner, and we held 2 post-funeral luncheons here.

+ At all 5 occasions, the food has been very good
+ Reasonable price
+...",724
sushi-to-go-palatine,Sushi To Go,https://www.yelp.com/biz/sushi-to-go-palatine,4.0,"[Category(name='Sushi Bars', alias='sushi')]",['220 N Smith St'],US,Palatine,IL,60067,44,False,"Sushi To Go is in my top 3 places to grab food from in the area. It's carry out only, has the sushi quality of a sit down restaurant for half the price, and...",726
hong-kong-lite-palatine,Hong Kong Lite,https://www.yelp.com/biz/hong-kong-lite-palatine,4.0,"[Category(name='Chinese', alias='chinese'), Category(name='Soup', alias='soup'), Category(name='Seafood', alias='seafood')]",['529 E Dundee Rd'],US,Palatine,IL,60074,69,False,"Ok so where do I begin. Well, let's start off with the menu.  Really well laid out, nice variety and very easy to order.  When I arrived at the location,...",728
katies-kitchen-des-plaines,Katie's Kitchen,https://www.yelp.com/biz/katies-kitchen-des-plaines,4.0,"[Category(name='Breakfast & Brunch', alias='breakfast_brunch'), Category(name='American (Traditional)', alias='tradamerican')]",['623 N Wolf Rd'],US,Des Plaines,IL,60016,224,True,"This restaurant is close to my work and I always wanted to try it. I came in on a Thursday morning and the place was empty. I walked in to find no hostess,...",729
eros-restaurant-and-ice-cream-parlour-arlington-heights,Eros Restaurant & Ice Cream Parlour,https://www.yelp.com/biz/eros-restaurant-and-ice-cream-parlour-arlington-heights,4.0,"[Category(name='Greek', alias='greek'), Category(name='Ice Cream & Frozen Yogurt', alias='icecream'), Category(name='Diners', alias='diners')]",['18 S Dryden Pl'],US,Arlington Heights,IL,60004,36,True,"This place was very good. Nothing special as far as other breakfast places, but if you're looking to eat a delicious meal at quick service and good prices,...",729
taj-mahal-restaurant-bloomingdale-2,Taj Mahal Restaurant,https://www.yelp.com/biz/taj-mahal-restaurant-bloomingdale-2,3.5,"[Category(name='Indian', alias='indpak'), Category(name='Bars', alias='bars')]","['398 W Army Trail Rd', 'Ste 116']",US,Bloomingdale,IL,60108,55,True,"Date of my visit: 22-August-2016
Time of my visit: Lunch

It has been awhile, since I've to an Indian joint.  I  have decided, I would like to do a lunch...",730
moonsun-sushi-japanese-and-chinese-restaurant-glendale-heights,MoonSun Sushi Japanese & Chinese Restaurant,https://www.yelp.com/biz/moonsun-sushi-japanese-and-chinese-restaurant-glendale-heights,3.0,"[Category(name='Sushi Bars', alias='sushi'), Category(name='Szechuan', alias='szechuan')]",['324 E Army Til Rd'],US,Glendale Heights,IL,60139,116,True,I really love to order the rolls. The Las Vegas Roll & Crazy Roll. Edemame on the side. The Yelp 24 order/delivery is the best! They deliver well packaged...,731
jins-chop-suey-roselle,Jin's Chop Suey,https://www.yelp.com/biz/jins-chop-suey-roselle,4.0,"[Category(name='Chinese', alias='chinese')]",['644 Lake St'],US,Roselle,IL,60172,15,False,"Only started ordering from Jin's late 2015, so I have no idea what their food/service was like prior to that. But the food has always been prepared well,...",732
lolas-pizza-palace-arlington-heights,Lola's Pizza Palace,https://www.yelp.com/biz/lolas-pizza-palace-arlington-heights,4.0,"[Category(name='Pizza', alias='pizza'), Category(name='Hot Dogs', alias='hotdog'), Category(name='Salad', alias='salad')]",['1279 N Rand Rd'],US,Arlington Heights,IL,60004,68,True,Lola's Pizza Palace is probably one of the best values you'll find in dining in this area of Arlington Heights. The food itself is in the 2.5 to 3.0 star...,733
the-improv-comedy-club-schaumburg,The Improv Comedy Club,https://www.yelp.com/biz/the-improv-comedy-club-schaumburg,4.0,"[Category(name='Performing Arts', alias='theater'), Category(name='Comedy Clubs', alias='comedyclubs')]",['5 Woodfield Rd'],US,Schaumburg,IL,60173,208,True,"Ive been here 3 different times now, and no matter the headliners, have found this place to be a great place for a night with friends. The comedians are...",733
mandarin-bistro-bloomingdale,Mandarin Bistro,https://www.yelp.com/biz/mandarin-bistro-bloomingdale,3.5,"[Category(name='Chinese', alias='chinese')]",['156 E Lake St'],US,Bloomingdale,IL,60108,66,True,"Started ordering from here about a month ago and man, is their food tasty. 
We've had crab rangoon, steamed and fried potstickers (prefer the steamed),...",734
parrilla-azteca-hanover-park,Parrilla Azteca,https://www.yelp.com/biz/parrilla-azteca-hanover-park,3.5,"[Category(name='Mexican', alias='mexican')]",['2390 Walnut Ave'],US,Hanover Park,IL,60133,3,False,"Great food good service could not ask for more
Nice friendly staff steak cook just as I asked
Small place but well worth the stop",735
kems-restaurant-itasca,Kem's Restaurant,https://www.yelp.com/biz/kems-restaurant-itasca,3.5,"[Category(name='American (Traditional)', alias='tradamerican')]",['860 W Irving Park Rd'],US,Itasca,IL,60143,4,False,"The food here is amazing. My husband and I shared a burger with fries, and the Monterey chicken meal. The Ceasar dressing is made in house; and the best...",738
pure-juice-café-arlington-heights-2,Pure Juice Café,https://www.yelp.com/biz/pure-juice-caf%C3%A9-arlington-heights-2,4.5,"[Category(name='Live/Raw Food', alias='raw_food'), Category(name='Juice Bars & Smoothies', alias='juicebars'), Category(name='Gluten-Free', alias='gluten_free')]",['24 S Evergreen Ave'],US,Arlington Heights,IL,60005,78,True,"If you love healthy eating, this is your place.  I dare you to try an ACAI bowl.  It's delicious, nutritious and packed with anti-oxidants.  They offer raw...",739
kampai-japanese-steak-house-mount-prospect,Kampai Japanese Steak House,https://www.yelp.com/biz/kampai-japanese-steak-house-mount-prospect,3.5,"[Category(name='Sushi Bars', alias='sushi'), Category(name='Teppanyaki', alias='teppanyaki')]",['2330 S Elmhurst Rd'],US,Mount Prospect,IL,60056,223,True,"I love this place. the food is amazing. i wish they'd give an ingredient list , though.  They are very nice to accommodate special diets when they can....",740
tortas-frontera-chicago-4,Tortas Frontera,https://www.yelp.com/biz/tortas-frontera-chicago-4,4.0,"[Category(name='Mexican', alias='mexican')]","['Terminal 3 Concourse K Gate K4', ""10000 W O'Hare Ave""]",US,Chicago,IL,60666,801,True,"Wow, great airport food!
I was in Chicago for a day and when I was leaving the airport in the morning, I saw a long line. I came back to the airport later...",743
palm-court-arlington-heights,Palm Court,https://www.yelp.com/biz/palm-court-arlington-heights,4.0,"[Category(name='Seafood', alias='seafood'), Category(name='Steakhouses', alias='steak'), Category(name='American (Traditional)', alias='tradamerican')]",['1912 N Arlington Heights Rd'],US,Arlington Heights,IL,60004,95,True,"My Mom first took me to Palm Court for lunch in 1977.
Always a great venue for special occasions. I hosted my sister's baby shower here in 1993 and spent...",743
mr-wok-carol-stream,Mr. Wok,https://www.yelp.com/biz/mr-wok-carol-stream,3.0,"[Category(name='Chinese', alias='chinese')]",['238 W Army Trl'],US,Carol Stream,IL,60188,46,True,Try fried rice you will not regret it...i feel like it was home style food...they also have some of the best crab ragoon ..i would say best chinese in carol...,744
mr-beef-and-pizza-mount-prospect,Mr Beef and Pizza,https://www.yelp.com/biz/mr-beef-and-pizza-mount-prospect,3.5,"[Category(name='Pizza', alias='pizza'), Category(name='Sandwiches', alias='sandwiches'), Category(name='Italian', alias='italian')]",['1796 S Elmhurst Rd'],US,Mount Prospect,IL,60056,65,True,"I am very surprised with the pizza here.  I'm sorry thin crusts lovers, I typically don't like thin crust.  I want to feel like I'm eating pizza.  I want to...",745
potbelly-sandwich-shop-south-barrington,Potbelly Sandwich Shop,https://www.yelp.com/biz/potbelly-sandwich-shop-south-barrington,4.5,"[Category(name='Sandwiches', alias='sandwiches'), Category(name='Salad', alias='salad')]","['100 W Higgins Rd', 'Ste M-20']",US,South Barrington,IL,60010,22,True,I come to this Potbelly's whenever I'm in the area.  The service is always top notch here and I've never had a problem.  The place is clean and the food is...,745
mariscos-el-amigo-hanover-park,Mariscos El Amigo,https://www.yelp.com/biz/mariscos-el-amigo-hanover-park,3.5,"[Category(name='Mexican', alias='mexican')]",['2184 W Lake St'],US,Hanover Park,IL,60133,16,False,Absolutely exceded my expectations.  I would only ding them because the kitchen is a little slow but the rest of the service was great.  Their mole was...,746
truco-taqueria-and-margarita-bar-mount-prospect,Truco Taqueria & Margarita Bar,https://www.yelp.com/biz/truco-taqueria-and-margarita-bar-mount-prospect,3.5,"[Category(name='Mexican', alias='mexican'), Category(name='Gastropubs', alias='gastropubs')]",['211 Randhurst Village Dr'],US,Mount Prospect,IL,60056,133,True,"My Fiancé and I happened to stumble upon this gem of a place while shopping at Randhurst. 

We stopped in not knowing anything about it. Wow! We were in for...",747
donatis-pizza-rolling-meadows,Donati's Pizza,https://www.yelp.com/biz/donatis-pizza-rolling-meadows,3.0,"[Category(name='Pizza', alias='pizza')]",['1925 S Plum Grove Rd'],US,Rolling Meadows,IL,60008,11,True,"The single serve Margharita pizza is awesome,  fresh crisp ingredients.
The buffalo boneless wings are okay.  Going back for thin crust and heard...",748
chowpatti-vegetarian-restaurant-arlington-heights,Chowpatti Vegetarian Restaurant,https://www.yelp.com/biz/chowpatti-vegetarian-restaurant-arlington-heights,3.0,"[Category(name='Vegetarian', alias='vegetarian'), Category(name='Indian', alias='indpak'), Category(name='Pakistani', alias='pakistani'), Category(name='Pizza', alias='pizza')]",['1035 S Arlington Heights Rd'],US,Arlington Heights,IL,60005,150,False,You get what you pay for.  This is the place to come when you need to nourish your body. The ingredients that are used are top of the line and very fresh....,749
dappers-west-family-restaurant-addison,Dapper's West Family Restaurant,https://www.yelp.com/biz/dappers-west-family-restaurant-addison,3.5,"[Category(name='American (Traditional)', alias='tradamerican'), Category(name='Breakfast & Brunch', alias='breakfast_brunch')]",['980 W Lake St'],US,Addison,IL,60101,131,False,"I can't believe I've never written a review to this place before. 

It's not my favorite place in town for breakfast. I like them more for lunch and dinner....",750
photos-hotdogs-palatine,Photo's Hotdogs,https://www.yelp.com/biz/photos-hotdogs-palatine,2.5,"[Category(name='Hot Dogs', alias='hotdog')]",['301 N Northwest Hwy'],US,Palatine,IL,60067,123,False,I came here for the first time right before Christmas. At the time they had a gift card special if you buy $200 you get a third hundred dollars free. So...,752
stellas-place-hoffman-estates,Stella's Place,https://www.yelp.com/biz/stellas-place-hoffman-estates,3.5,"[Category(name='Cafes', alias='cafes')]",['1171A N Barrington Rd'],US,Hoffman Estates,IL,60169,3,True,Awesome!!!!!!!!!! Very pleasant atmosphere and friendly hosts. Definitely my favorite gaming cafe. Hosts name Ada is nice and encouraging,754
korner-house-bar-and-grill-elk-grove-village,Korner House Bar & Grill,https://www.yelp.com/biz/korner-house-bar-and-grill-elk-grove-village,3.5,"[Category(name='Bars', alias='bars'), Category(name='American (Traditional)', alias='tradamerican')]",['2736 Old Higgins Rd'],US,Elk Grove Village,IL,60007,38,False,"Not once have I ever seen a biker or a single motorcycle here at this ''Biker Bar''
  The fact is I've always got my money's worth between the cold...",755
generoso-pizza-glendale-heights,Generoso Pizza,https://www.yelp.com/biz/generoso-pizza-glendale-heights,4.0,"[Category(name='Pizza', alias='pizza'), Category(name='Sandwiches', alias='sandwiches'), Category(name='Italian', alias='italian')]",['314 E Army Trail Rd'],US,Glendale Heights,IL,60139,37,True,"Love their pizza! We have always been Rosati's people for thin crust, and that is still very good, but we are Generoso converts for sure! 

The Italian beef...",756
stoney-river-steakhouse-and-grill-deer-park,Stoney River Steakhouse and Grill,https://www.yelp.com/biz/stoney-river-steakhouse-and-grill-deer-park,4.0,"[Category(name='Steakhouses', alias='steak'), Category(name='Seafood', alias='seafood')]",['20504 N Rand Rd'],US,Deer Park,IL,60010,170,True,"So far this is the best steakhouse I have found in Chicago.

The table bread is great, little balls of awesome! However, the shape of the bread makes it a...",757
portillos-hot-dogs-arlington-heights,Portillo's Hot Dogs,https://www.yelp.com/biz/portillos-hot-dogs-arlington-heights,4.0,"[Category(name='Hot Dogs', alias='hotdog'), Category(name='Salad', alias='salad'), Category(name='Burgers', alias='burgers')]",['806 W Dundee Rd'],US,Arlington Heights,IL,60004,229,True,"I love Portillos for their burgers and cheese fries. That is the reason why you should pay them a visit.

If you want to throw your money away, however,...",757
hibachi-grill-and-supreme-buffet-glendale-heights,Hibachi Grill & Supreme Buffet,https://www.yelp.com/biz/hibachi-grill-and-supreme-buffet-glendale-heights,3.0,"[Category(name='American (New)', alias='newamerican'), Category(name='Asian Fusion', alias='asianfusion')]",['240 Town Center Ln'],US,Glendale Heights,IL,60139,66,True,Solid buffet.  My gf took me there. I paid.  I was well fed. Good service. Huge variety of all Asian buffet greatest hits..  I'll be back,758
dondis-pizza-arlington-heights,Dondi's Pizza,https://www.yelp.com/biz/dondis-pizza-arlington-heights,4.0,"[Category(name='Pizza', alias='pizza')]",['1041 S Arlington Heights Rd'],US,Arlington Heights,IL,60005,49,False,"For medium priced pizza, this is great pizza! The flavor is not super strong, but not mild either. It is very good flavor though. A different taste from a...",759
honeyberry-cafe-arlington-heights,Honeyberry Cafe,https://www.yelp.com/biz/honeyberry-cafe-arlington-heights,3.0,"[Category(name='Breakfast & Brunch', alias='breakfast_brunch')]",['306 E Rand Rd'],US,Arlington Heights,IL,60004,152,True,Recently bought out by new management and I believe their menu is slightly changing. I have been here for both lunch and breakfast and have yet to leave...,760
mckennas-restaurant-and-lounge-rolling-meadows,McKenna's Restaurant and Lounge,https://www.yelp.com/biz/mckennas-restaurant-and-lounge-rolling-meadows,3.0,"[Category(name='American (Traditional)', alias='tradamerican'), Category(name='Lounges', alias='lounges')]","['Holiday Inn', '3405 Algonquin Rd']",US,Rolling Meadows,IL,60008,7,True,"McKenna's is a restaurant and lounge which is a part of Holiday Inn.  All meals ordered via room service, come from here.
Just driving by one day and...",761
indian-bistro-palatine,Indian Bistro,https://www.yelp.com/biz/indian-bistro-palatine,4.0,"[Category(name='Indian', alias='indpak')]",['732 E Dundee Rd'],US,Palatine,IL,60074,148,True,"Attention Indian food novices: did you know, the yogurt sauce is for desert, to take care of the lingering spiciness? Now you know! A Nepali coworker...",762
submarine-express-mount-prospect,Submarine Express,https://www.yelp.com/biz/submarine-express-mount-prospect,4.5,"[Category(name='Sandwiches', alias='sandwiches'), Category(name='Barbeque', alias='bbq')]",['2 W Northwest Hwy'],US,Mount Prospect,IL,60056,59,True,"A real honest to goodness sub with the right amounts of everything. Good golly it was perfect. Like in Plato's myth of the cave, this is the true sub that...",763
sams-club-streamwood,Sam's Club,https://www.yelp.com/biz/sams-club-streamwood,3.0,"[Category(name='Department Stores', alias='deptstores'), Category(name='Cafes', alias='cafes'), Category(name='Gas & Service Stations', alias='servicestations')]",['900 S Barrington Rd'],US,Streamwood,IL,60107,22,False,"Typical SAMs club; bulk items, competitive pricing and shoppers who don't know how to drive (or operate a shopping cart). The savings in bulk items is worth...",764
dolce-italian-caffe-and-bakery-arlington-heights,Dolce Italian Caffe & Bakery,https://www.yelp.com/biz/dolce-italian-caffe-and-bakery-arlington-heights,4.5,"[Category(name='Italian', alias='italian'), Category(name='Breakfast & Brunch', alias='breakfast_brunch'), Category(name='Bakeries', alias='bakeries')]",['4204 N Arlington Heights Rd'],US,Arlington Heights,IL,60004,93,False,"My hubby and I went here for lunch today.
What a pleasant surprise it was (Considering mall location in Arlington Heights etc.).
My hubby ordered ""the Dolce...",765
smashburger-arlington-heights-2,Smashburger,https://www.yelp.com/biz/smashburger-arlington-heights-2,3.5,"[Category(name='Burgers', alias='burgers')]",['115 W Rand Rd'],US,Arlington Heights,IL,60004,107,True,"Okay.  First of all, I have to admit that I had never heard of the ""smashburger"" concept until my current place of occupation.  I was required to watch a...",766
gails-carriage-inn-des-plaines-2,Gail's Carriage Inn,https://www.yelp.com/biz/gails-carriage-inn-des-plaines-2,4.0,"[Category(name='Breakfast & Brunch', alias='breakfast_brunch')]",['1145 Elmhurst Rd'],US,Des Plaines,IL,60016,115,True,"Great place for the apple pecan pancake, call it in before leaving home because it takes about 40 minutes to bake but is oh so good. You may have had this...",767
new-china-pearl-wood-dale,New China Pearl,https://www.yelp.com/biz/new-china-pearl-wood-dale,3.5,"[Category(name='Chinese', alias='chinese')]",['337 N Wood Dale Rd'],US,Wood Dale,IL,60191,38,False,When i first moved to wood dale back in 2011 i loved this place. The food was great and honestly tasted better then i imagined. feasible pricing and timely...,768
taqueria-mi-tierra-bensenville-2,Taqueria Mi Tierra,https://www.yelp.com/biz/taqueria-mi-tierra-bensenville-2,3.5,"[Category(name='Mexican', alias='mexican')]",['459 W Irving Park Rd'],US,Bensenville,IL,60106,37,True,"We stopped in and were very happy we did I had the short rib taco, the coconut crust tilapia taco both were excellent. My husband had the 1/2 chicken dinner...",771
uni-mart-one-stop-shopping-hoffman-estates,Uni-Mart One Stop Shopping,https://www.yelp.com/biz/uni-mart-one-stop-shopping-hoffman-estates,3.0,"[Category(name='Convenience Stores', alias='convenience'), Category(name='Filipino', alias='filipino')]",['1038  Golf Rd'],US,Hoffman Estates,IL,60194,31,False,"Uni-Mart Hoffman Estates is Great!
bring the whole family to hang out.
grab some MR. CHIPS
they have a TV.

tho no wifi, cant play pokemon go near it.",772
noodles-and-company-arlington-heights,Noodles & Company,https://www.yelp.com/biz/noodles-and-company-arlington-heights,3.0,"[Category(name='Noodles', alias='noodles')]",['66 S Arlington Heights Rd'],US,Arlington Heights,IL,60005,21,False,"As a huge Noodles fan, this location always hits the spot. 
This location is located in the heart of downtown Arlington Heights. 
It's always a great choice...",772
manpasand-indian-restaurant-arlington-heights,Manpasand Indian Restaurant,https://www.yelp.com/biz/manpasand-indian-restaurant-arlington-heights,3.0,"[Category(name='Indian', alias='indpak')]",['644 E Golf Rd'],US,Arlington Heights,IL,60005,45,True,"I've been to Manpasand many times and done take out. Once or twice I dined in. 

My dining experience was excellent. Im a vegetarian and the curries were...",773
biaggis-ristorante-italiano-deer-park,Biaggi's Ristorante Italiano,https://www.yelp.com/biz/biaggis-ristorante-italiano-deer-park,3.5,"[Category(name='Italian', alias='italian')]",['20560 N Rand Rd'],US,Deer Park,IL,60010,156,False,"Great menu, food was good both times we visited. I love the fact that there is no cork fee if you bring your own wine that is not on the list. First time we...",774
sir-nicks-pizza-bartlett,SIR Nick's Pizza,https://www.yelp.com/biz/sir-nicks-pizza-bartlett,3.5,"[Category(name='Pizza', alias='pizza')]",['105 E Lake St'],US,Bartlett,IL,60103,22,True,"One of the best thin pizzas in the area!  The ingredients are fresh and tasty. I like to finish my pizza off at home, so I request it not cut. They do...",774
taqueria-parilla-azteca-elgin,Taqueria Parilla Azteca,https://www.yelp.com/biz/taqueria-parilla-azteca-elgin,4.0,"[Category(name='Mexican', alias='mexican')]","['1350 Chicago St', 'Unit 29']",US,Elgin,IL,60120,10,False,Love this place! Recently moved to the area and it's our go-to for take out when we are in the mood for Mexican food.The ground beef tacos and quesadillas...,775
5th-avenue-sushi-arlington-heights,5th Avenue Sushi,https://www.yelp.com/biz/5th-avenue-sushi-arlington-heights,4.0,"[Category(name='Sushi Bars', alias='sushi')]",['138 E Rand Rd'],US,Arlington Heights,IL,60004,92,False,"Went again today and just wanted to make an update, the shrimp tempura roll and the sweet potato roll are amazing and the service is fantastic, definitely...",776
