business_id,business_name,business_url,business_rating,business_categories,business_locationaddress,business_country,business_city,business_statecode,business_zipcode,business_reviewcount,is_claimed,snippet_text,offset
izakaya-sankyu-japanese-restaurant-mount-prospect-2,Izakaya Sankyu Japanese Restaurant,https://www.yelp.com/biz/izakaya-sankyu-japanese-restaurant-mount-prospect-2,4.0,"[Category(name='Japanese', alias='japanese'), Category(name='Sushi Bars', alias='sushi')]",['1176 S Elmhurst Rd'],US,Mount Prospect,IL,60056,134,True,"Tried this place for dinner last night. Good food, good service, reasonable pricing. I like it!

Ambience was casual. This place had traditional music,...",468
tilted-kilt-pub-and-eatery-roselle-2,Tilted Kilt Pub & Eatery,https://www.yelp.com/biz/tilted-kilt-pub-and-eatery-roselle-2,3.0,"[Category(name='Sports Bars', alias='sportsbars'), Category(name='American (Traditional)', alias='tradamerican'), Category(name='Pubs', alias='pubs')]",['1360 Lake Street'],US,Roselle,IL,60172,89,True,Korra was gracious and always had a smile on her face. My beer was never empty and asked if there anything else she could get for me. I will definitely be...,470
claim-jumper-village-of-hoffman-estates,Claim Jumper,https://www.yelp.com/biz/claim-jumper-village-of-hoffman-estates,3.0,"[Category(name='American (Traditional)', alias='tradamerican'), Category(name='Steakhouses', alias='steak')]",['2610 New Sutton Rd'],US,Village of Hoffman Estates,IL,60192,230,True,"Good food, great service.

My only suggestion would be a smaller menu.  Too many choices.",471
e-o-food-and-drink-mount-prospect,E+O Food and Drink,https://www.yelp.com/biz/e-o-food-and-drink-mount-prospect,4.0,"[Category(name='American (New)', alias='newamerican'), Category(name='Tapas/Small Plates', alias='tapasmallplates')]",['125 Randhurst Village Dr'],US,Mount Prospect,IL,60056,457,True,"I absolutely love this place! I have been coming here since it opened, and have never had a bad experience. Today I came here with my family for my Moms...",472
hibachi-grill-and-buffet-elk-grove-village,Hibachi Grill & Buffet,https://www.yelp.com/biz/hibachi-grill-and-buffet-elk-grove-village,3.0,"[Category(name='Buffets', alias='buffets'), Category(name='Chinese', alias='chinese')]",['101 Busse Rd'],US,Elk Grove Village,IL,60007,134,True,Great delicious food for a good price! It's hard to find affordable buffets in the Chicagoland area. We come here at least 2x a month!,473
el-bistro-latino-des-plaines,El Bistro Latino,https://www.yelp.com/biz/el-bistro-latino-des-plaines,4.5,"[Category(name='Cuban', alias='cuban'), Category(name='Mexican', alias='mexican'), Category(name='Colombian', alias='colombian')]",['1261 E Algonquin Rd'],US,Des Plaines,IL,60016,80,True,"7:30 res at El Bistro a la Viernes... Showed up 10 min late by accident, sorry. Got seated in the lovely outdoor patio with my trusty Barefoot of Cabernet...",474
panda-express-schaumburg-2,Panda Express,https://www.yelp.com/biz/panda-express-schaumburg-2,2.5,"[Category(name='Chinese', alias='chinese'), Category(name='Fast Food', alias='hotdogs')]",['3 Woodfield Mall'],US,Schaumburg,IL,60173,13,True,"I used the app to order my food today and the food I ordered was ready right when I asked that it be and I didn't have to wait at all in the line, which was...",475
kfc-schaumburg,KFC,https://www.yelp.com/biz/kfc-schaumburg,1.5,"[Category(name='Fast Food', alias='hotdogs'), Category(name='Chicken Wings', alias='chicken_wings')]",['1160 South Roselle Rd'],US,Schaumburg,IL,60193,19,True,"After a bad experience at real time sports, I picked up some fried chicken from this location. The person that took my order was polite and courteous. I...",476
besa-mi-taco-itasca,Besa Mi Taco,https://www.yelp.com/biz/besa-mi-taco-itasca,3.0,"[Category(name='Mexican', alias='mexican')]",['1180 N Arlington Heights Rd'],US,Itasca,IL,60143,90,False,"I went here during off peak hours, and by reading other reviews I guess I'm glad I did!  I walked right up and ordered my food.  No wait, and the food took...",477
buona-restaurant-and-catering-hoffman-estates,Buona Restaurant & Catering,https://www.yelp.com/biz/buona-restaurant-and-catering-hoffman-estates,3.5,"[Category(name='Pizza', alias='pizza'), Category(name='Italian', alias='italian'), Category(name='Sandwiches', alias='sandwiches')]",['2352 W Higgins Rd'],US,Hoffman Estates,IL,60169,64,True,"Nice place enjoy the food and the staff., they have a nice rewards program you get points for purchases and they offer bonus points regularly, I go for the...",478
cool-mirchi-roselle,Cool Mirchi,https://www.yelp.com/biz/cool-mirchi-roselle,3.5,"[Category(name='Indian', alias='indpak'), Category(name='Pakistani', alias='pakistani')]",['814 E Nerge Rd'],US,Roselle,IL,60172,72,False,Not reviewing restaurant but the staff.  My grandma is in a nursing facility next door to this restaurant.  I drove from city to bring her lunch and while...,480
taco-patio-hanover-park,Taco Patio,https://www.yelp.com/biz/taco-patio-hanover-park,3.5,"[Category(name='Mexican', alias='mexican'), Category(name='Fast Food', alias='hotdogs')]",['1321 Irving Park Rd'],US,Hanover Park,IL,60133,44,False,Great Whole in the Wall restaurant!!! The food is DELICIOUS and huge portions!  Highly recommend it!!,481
l-eiffel-bistrot-and-creperie-south-barrington-4,L'Eiffel Bistrot and Creperie,https://www.yelp.com/biz/l-eiffel-bistrot-and-creperie-south-barrington-4,3.5,"[Category(name='French', alias='french'), Category(name='Creperies', alias='creperies')]",['100 W Higgins Rd'],US,South Barrington,IL,60010,242,True,"Tried this restaurant last Friday, admittedly I had a Groupon.    We found the food to be very good.  I had the Hanger Steak with Burgundy Sauce.  I ordered...",483
la-tasca-restaurant-arlington-heights,La Tasca Restaurant,https://www.yelp.com/biz/la-tasca-restaurant-arlington-heights,3.5,"[Category(name='Tapas Bars', alias='tapas'), Category(name='Spanish', alias='spanish')]",['25 W Davis St'],US,Arlington Heights,IL,60005,389,True,"I have to be honest with you - I do not love tapas restaurants. I've been to a lot of ""tapas"" restaurants that are hipster divebars that serve tiny plates...",484
savoury-restaurant-and-pancake-cafe-bartlett,Savoury Restaurant & Pancake Cafe,https://www.yelp.com/biz/savoury-restaurant-and-pancake-cafe-bartlett,3.5,"[Category(name='Greek', alias='greek'), Category(name='American (Traditional)', alias='tradamerican'), Category(name='Breakfast & Brunch', alias='breakfast_brunch')]",['782 W Bartlett Rd'],US,Bartlett,IL,60103,140,True,"Parking can be a bit tricky here as the parking lot is shared with quite a few other businesses, but today - for me - I parked right out front. 

The...",485
mina-restaurant-mount-prospect,Mina Restaurant,https://www.yelp.com/biz/mina-restaurant-mount-prospect,3.5,"[Category(name='Mediterranean', alias='mediterranean')]",['1724 W Golf Rd'],US,Mount Prospect,IL,60056,111,False,Love their shawarma plate with rice and their  eggplant appetizer!! Their hummus and filafel are good as well. They usually have Arabic music videos on...,486
deli-time-schaumburg-5,Deli Time,https://www.yelp.com/biz/deli-time-schaumburg-5,3.0,"[Category(name='Delis', alias='delis'), Category(name='Sandwiches', alias='sandwiches')]","['150 N Martingale Rd', 'Ste 60']",US,Schaumburg,IL,60173,1,False,"Hey!  It's Deli Time!

I work in this building in Schaumburg, so when I haven't packed my lunch, and have no time to grab a bite to eat outside the office,...",487
shiraz-on-the-water-bloomingdale,Shiraz on the Water,https://www.yelp.com/biz/shiraz-on-the-water-bloomingdale,3.0,"[Category(name='American (New)', alias='newamerican')]","['Hilton Chicago Indian Lakes Resort', '250 W Schick Rd']",US,Bloomingdale,IL,60108,36,True,"Really good steak. I would highly recommend getting the New York Strip $32. Great quality, cooked perfectly. The mashed potatoes and veggies were delicious....",488
subway-schaumburg-7,Subway,https://www.yelp.com/biz/subway-schaumburg-7,2.5,"[Category(name='Sandwiches', alias='sandwiches'), Category(name='Fast Food', alias='hotdogs')]",['742 E Schaumburg Rd'],US,Schaumburg,IL,60194,4,False,This is my favorite subway! They have the softest bread and freshest vegetables. I literally drive by 3 other subways just to come to this one. They always...,489
papa-johns-pizza-schaumburg-5,Papa John's Pizza,https://www.yelp.com/biz/papa-johns-pizza-schaumburg-5,2.0,"[Category(name='Pizza', alias='pizza')]",['2525 W Schaumburg Rd'],US,Schaumburg,IL,60194,15,False,"My review is in two parts, so here we go. This was on Valentine's Day 2015
When I first called, I spoke with a man that put me on hold to see if they could...",490
shulas-steak-house-itasca-2,Shula's Steak House,https://www.yelp.com/biz/shulas-steak-house-itasca-2,3.0,"[Category(name='Steakhouses', alias='steak'), Category(name='Seafood', alias='seafood'), Category(name='American (Traditional)', alias='tradamerican')]","['400 Park Blvd', 'Westin Chicago']",US,Itasca,IL,60143,64,True,I had a fairly good experience at Shula's. We went for my wife's birthday! I really liked both the food and the atmosphere of the restaurant. It is very...,490
prontos-glendale-heights-2,Pronto's,https://www.yelp.com/biz/prontos-glendale-heights-2,4.0,"[Category(name='Pizza', alias='pizza'), Category(name='Italian', alias='italian')]",['2260 Bloomingdale Rd'],US,Glendale Heights,IL,60139,77,True,Went here on a Tuesday night with my son.  Wasn't too busy. It was kind of loud but there were a couple of tables of people celebrating birthdays so it is...,490
vinis-palatine,Vini's,https://www.yelp.com/biz/vinis-palatine,4.0,"[Category(name='Pizza', alias='pizza'), Category(name='Burgers', alias='burgers')]",['743 W Palatine Rd'],US,Palatine,IL,60067,74,True,"Best crust I have ever tasted! That's all I've been able to eat, was the crust my savage wife and kids leave me. I get home from a long hard day of selling...",490
thumka-indian-bar-and-grill-hoffman-estates,Thumka Indian Bar & Grill,https://www.yelp.com/biz/thumka-indian-bar-and-grill-hoffman-estates,3.5,"[Category(name='Indian', alias='indpak')]",['2336 W Higgins Rd'],US,Hoffman Estates,IL,60169,101,True,"You won't get service with a smile, but the service is good for an Indian restaurant  (you know what I mean).

The food is great and the spread is one of...",490
olympus-gyros-mount-prospect-2,Olympus Gyros,https://www.yelp.com/biz/olympus-gyros-mount-prospect-2,4.5,"[Category(name='Greek', alias='greek')]",['412 W NW Hwy'],US,Mount Prospect,IL,60056,39,False,This is the best gyros around at very reasonable prices. The gyros platter is a great deal for $10 it can be enough for 2. The platter includes a generous...,491
bosna-grill-des-plaines,Bosna Grill,https://www.yelp.com/biz/bosna-grill-des-plaines,4.5,"[Category(name='Fast Food', alias='hotdogs')]",['644 W Algonquin Rd'],US,Des Plaines,IL,60018,33,False,"The lady who works there is a real sweetheart! They have a MUST TRY cevapi and pljeskavica! As i think of it,everything they make and serve is simply...",492
uptown-cafe-arlington-heights,Uptown Cafe,https://www.yelp.com/biz/uptown-cafe-arlington-heights,4.0,"[Category(name='Cafes', alias='cafes')]",['24 E Miner St'],US,Arlington Heights,IL,60004,44,True,"The Uptown Café is a great restaurant for breakfast and lunch. The soups are very good when you're eating lunch, and the eggs and skillets for breakfast are...",494
faustos-italian-kitchen-and-catering-arlington-heights,Fausto's Italian Kitchen and Catering,https://www.yelp.com/biz/faustos-italian-kitchen-and-catering-arlington-heights,4.0,"[Category(name='Bakeries', alias='bakeries'), Category(name='Italian', alias='italian'), Category(name='Pizza', alias='pizza')]",['16 S Evergreen Ave'],US,Arlington Heights,IL,60005,58,True,"Yummy! Small place, lots of homemade items to pick from, clean, and inexpensive. Today was my first visit, but will not be my last.",495
romanos-macaroni-grill-hoffman-estates,Romano's Macaroni Grill,https://www.yelp.com/biz/romanos-macaroni-grill-hoffman-estates,3.5,"[Category(name='Italian', alias='italian')]",['2575 W. Higgins'],US,Hoffman Estates,IL,60195,103,True,I've been to this place many times and the food is usually really good and decently priced.  The only reason this place is getting 4 stars is from my past...,495
kostenes-grill-elk-grove-village-2,Kostene's Grill,https://www.yelp.com/biz/kostenes-grill-elk-grove-village-2,3.5,"[Category(name='Hot Dogs', alias='hotdog'), Category(name='Burgers', alias='burgers'), Category(name='Greek', alias='greek')]",['600 E Devon Ave'],US,Elk Grove Village,IL,60007,21,True,"We will definitely be back to try this again and other items off the menu : ) 

Service is a little slow and seems they need more employees
They are very...",496
eagle-restaurant-des-plaines,Eagle Restaurant,https://www.yelp.com/biz/eagle-restaurant-des-plaines,4.0,"[Category(name='Breakfast & Brunch', alias='breakfast_brunch'), Category(name='American (Traditional)', alias='tradamerican')]",['851 W Oakton St'],US,Des Plaines,IL,60018,20,False,"Since I met my boyfriend he has delighted in introducing me to foods I have never had before, and there are a lot. This place is a gem!! I can't say enough...",497
osteria-trulli-arlington-heights,Osteria Trulli,https://www.yelp.com/biz/osteria-trulli-arlington-heights,4.0,"[Category(name='Italian', alias='italian')]",['1510 E Hintz Rd'],US,Arlington Heights,IL,60004,37,False,"An absolutely incredible Fava and truffle risotto. 
Lots of burratta.  The pizza looked incredible. 
Noisy and great.  Great bracciole.",498
rosatis-pizza-elk-grove-village-2,Rosati's Pizza,https://www.yelp.com/biz/rosatis-pizza-elk-grove-village-2,3.0,"[Category(name='Pizza', alias='pizza'), Category(name='Italian', alias='italian')]",['1069 Rohlwing Rd'],US,Elk Grove Village,IL,60007,46,True,"Ordered again via Yelp / Eat24.  Pizza came super fast, in about 30mins.  They were out of the 6 pack of orange soda I ordered but they called me within...",499
avenue-bg-elk-grove-village,Avenue BG,https://www.yelp.com/biz/avenue-bg-elk-grove-village,3.0,"[Category(name='Modern European', alias='modern_european')]",['1000 Higgins Rd'],US,Elk Grove Village,IL,60007,17,False,We were invited by a couple of our Bulgarian friends to have dinner with them at one of their favorite places and we met them here.  We almost didn't find...,502
white-castle-hoffman-estates-2,White Castle,https://www.yelp.com/biz/white-castle-hoffman-estates-2,3.5,"[Category(name='Burgers', alias='burgers'), Category(name='Fast Food', alias='hotdogs')]",['1100 W Golf Rd'],US,Hoffman Estates,IL,60194,32,True,"Ahhhh little gems from heaven. 
I grew up in Chicago, so I could have a slider anytime I wanted it.
Now I live 2500 miles away, with no White Castle as far...",503
seoul-kkakdugi-arlington-heights-2,Seoul Kkakdugi,https://www.yelp.com/biz/seoul-kkakdugi-arlington-heights-2,4.5,"[Category(name='Korean', alias='korean')]",['234 East Golf Rd'],US,Arlington Heights,IL,60005,6,False,"Best Sul Lung Tang in the Chicagoland.

Clean with good ambience for Korean restaurant. 

Service is very good also.

Will be eating here regularly to get...",503
gaynors-restaurant-and-pub-medinah,Gaynor's Restaurant & Pub,https://www.yelp.com/biz/gaynors-restaurant-and-pub-medinah,3.0,"[Category(name='Pubs', alias='pubs'), Category(name='American (Traditional)', alias='tradamerican')]",['6N744 Medinah Rd'],US,Medinah,IL,60157,19,False,"Dope ass dive bar.

Cheap vodka sodas.

Friendly bartenders.

Brings da rukus.",504
prairie-river-itasca,Prairie River,https://www.yelp.com/biz/prairie-river-itasca,3.5,"[Category(name='American (New)', alias='newamerican')]",['1401 Nordic Rd'],US,Itasca,IL,60143,12,True,"Wasn't sure about ordering the salmon since it was pricey at $29. I'm so glad I did, it was delicious and worth every penny! Service was also very good.",505
wok-n-fire-addison-2,Wok 'n Fire,https://www.yelp.com/biz/wok-n-fire-addison-2,3.0,"[Category(name='Asian Fusion', alias='asianfusion'), Category(name='Chinese', alias='chinese')]",['1576 Lake St'],US,Addison,IL,60101,141,True,"My pad si ew was probably the best I have ever had!! The chicken was seasoned and cooked to perfection, the broccolini was so good in place of regular...",506
jj-twigs-pizza-and-pub-palatine,JJ Twig's Pizza and Pub,https://www.yelp.com/biz/jj-twigs-pizza-and-pub-palatine,4.0,"[Category(name='Pizza', alias='pizza'), Category(name='Italian', alias='italian'), Category(name='Sandwiches', alias='sandwiches')]",['150 S NW Hwy'],US,Palatine,IL,60074,72,True,I ordered their veggie appetizer and it was very good as as well as the burger. The delivery was fast and it was excellent. It beat driving in the rain. I...,507
jcs-mexican-restaurant-bartlett,JC's Mexican Restaurant,https://www.yelp.com/biz/jcs-mexican-restaurant-bartlett,3.5,"[Category(name='Mexican', alias='mexican')]",['130 W Bartlett Ave'],US,Bartlett,IL,60103,110,True,"We here many times but writing review first time...

Very good food...they make fresh, specially for vegitarian choice. Red salsa is really HOT...green is...",508
jds-q-and-brew-arlington-heights,JD's Q & Brew,https://www.yelp.com/biz/jds-q-and-brew-arlington-heights,4.0,"[Category(name='Barbeque', alias='bbq')]",['286 W Rand Rd'],US,Arlington Heights,IL,60004,203,True,"My boyfriend and I decided to try this spot (his pick), and we were happy that we did! As soon as you walk in you are greeted with the aroma of meat smoking...",509
el-rodeo-grill-elk-grove-village,El Rodeo Grill,https://www.yelp.com/biz/el-rodeo-grill-elk-grove-village,3.0,"[Category(name='Mexican', alias='mexican')]",['1181 Biesterfield Rd'],US,Elk Grove Village,IL,60007,13,True,I'm giving this place an extra star because it's close to my house and I don't want it to close. I understand the reviews yeah 9 bucks for burrito is stiff...,510
vinis-pizza-and-catering-elk-grove-village,Vini's Pizza and Catering,https://www.yelp.com/biz/vinis-pizza-and-catering-elk-grove-village,3.5,"[Category(name='Pizza', alias='pizza'), Category(name='Sandwiches', alias='sandwiches')]",['39 S Arlington Hts Blvd'],US,Elk Grove Village,IL,60007,47,True,"Huge slices with drink $5.  Plenty of slice options during lunch, but seating can get crowded.  My only complaint is that the soda is watered down.

If you...",511
absolutely-chinese-restaurant-rolling-meadows,Absolutely Chinese Restaurant,https://www.yelp.com/biz/absolutely-chinese-restaurant-rolling-meadows,4.0,"[Category(name='Chinese', alias='chinese')]",['2140 Plum Grove Rd'],US,Rolling Meadows,IL,60008,56,False,"Came for the first time today.  Four stars is the average of a dish we ordered that was a solid 3 stars and one that was a 5.  

The 5 star dish was...",512
deli-time-schaumburg-3,Deli Time,https://www.yelp.com/biz/deli-time-schaumburg-3,2.5,"[Category(name='Delis', alias='delis'), Category(name='Sandwiches', alias='sandwiches')]",['10 N Martingale Rd Ste 195'],US,Schaumburg,IL,60173,2,False,"I like them...the food is usually good, but sometimes I think the flavor is.. the same or maybe alittle salty.

We have had catering by them and it was good...",512
all-ways-catering-and-deli-elk-grove-village,All Ways Catering & Deli,https://www.yelp.com/biz/all-ways-catering-and-deli-elk-grove-village,4.5,"[Category(name='Delis', alias='delis')]",['110 Turner Ave'],US,Elk Grove Village,IL,60009,52,False,What a find! Thanks YELP. I love supporting the mom and pop joints. I wish this was closer to home bc it's a great place for lunch. If you want homemade...,512
armands-pizzeria-arlington-heights,Armand's Pizzeria,https://www.yelp.com/biz/armands-pizzeria-arlington-heights,3.0,"[Category(name='Pizza', alias='pizza')]",['70 N Vail Ave'],US,Arlington Heights,IL,60005,99,True,"One of my favorite places to grab a bite to eat in Action Heights. Service is fast and friendly; Frequently (but not obnoxiously) checking that you're good,...",513
sweet-baby-rays-barbecue-wood-dale,Sweet Baby Ray's Barbecue,https://www.yelp.com/biz/sweet-baby-rays-barbecue-wood-dale,3.5,"[Category(name='Southern', alias='southern'), Category(name='Barbeque', alias='bbq')]",['249 E Irving Park Rd'],US,Wood Dale,IL,60191,106,True,Came with my husband and a couple friends at about 7:45 on a Wednesday evening.  It looked pretty closed up already and I was surprised to learn they close...,513
bbq-tonight-hoffman-estates,BBQ Tonight,https://www.yelp.com/biz/bbq-tonight-hoffman-estates,3.0,"[Category(name='Pakistani', alias='pakistani'), Category(name='Indian', alias='indpak'), Category(name='Barbeque', alias='bbq')]",['1061 W Golf Rd'],US,Hoffman Estates,IL,60169,76,False,"Excellent goat biriyani and the paratta roll is simply awesome. Tandoori was jus ""OK"". 
 Apart from food, washroom is worst!!! worst of all.!!!!...",516
new-hong-kong-restaurant-streamwood,New Hong Kong Restaurant,https://www.yelp.com/biz/new-hong-kong-restaurant-streamwood,4.0,"[Category(name='Chinese', alias='chinese')]",['5042 Valley Ln'],US,Streamwood,IL,60107,36,False,I've been going here for 22 years.  It's the BEST.  The food is amazing and the portions are HUGE.  Don't miss out on this deliciousness!,517
babcocks-grove-house-lombard,Babcock's Grove House,https://www.yelp.com/biz/babcocks-grove-house-lombard,4.5,"[Category(name='American (New)', alias='newamerican'), Category(name='Beer Bar', alias='beerbar'), Category(name='Wine Bars', alias='wine_bars')]",['101 W St Charles Rd'],US,Lombard,IL,60148,84,True,Let me start off my saying I'm sadly unfamiliar with the city of Lombard and all the businesses within it but if it's anything like Babcock's Grove House...,518
bomba-grill-east-dundee,BOMBA Grill,https://www.yelp.com/biz/bomba-grill-east-dundee,5.0,"[Category(name='American (New)', alias='newamerican'), Category(name='Burgers', alias='burgers'), Category(name='Sandwiches', alias='sandwiches')]",['116 Penny Ave'],US,East Dundee,IL,60118,42,False,"Bombas the Bomb!

Solid 5 stars! What a great find! So far very consistent...had sandwiches there three times and the chicken breast they use is huge! We...",520
buona-restaurant-and-catering-itasca,Buona Restaurant & Catering,https://www.yelp.com/biz/buona-restaurant-and-catering-itasca,3.0,"[Category(name='Italian', alias='italian'), Category(name='Pizza', alias='pizza'), Category(name='Sandwiches', alias='sandwiches')]",['1170 N Arlington Heights Rd'],US,Itasca,IL,60143,46,True,I stopped in for a quick lunch with my coworker.  We split a chicken salad sandwich and a chopped salad.  The service was friendly and quick and the...,521
noodles-and-company-rolling-meadows,Noodles & Company,https://www.yelp.com/biz/noodles-and-company-rolling-meadows,4.0,"[Category(name='Noodles', alias='noodles')]",['1327 Golf Rd'],US,Rolling Meadows,IL,60008,17,False,"I met a friend for lunch today and decided to try out this place and I am thrilled that we did. 


We are soup and salad and both were delicious, served...",522
asian-bistro-arlington-heights,Asian Bistro,https://www.yelp.com/biz/asian-bistro-arlington-heights,4.0,"[Category(name='Chinese', alias='chinese'), Category(name='Vietnamese', alias='vietnamese')]",['65 W Golf Rd'],US,Arlington Heights,IL,60005,109,True,"Went for lunch with a coworker, as we're both big fans of Sichuan cooking.

The lunch menu arrives on plates family style, so you can share.

We ordered the...",523
v-and-v-paesano-pizzeria-bartlett,V & V Paesano Pizzeria,https://www.yelp.com/biz/v-and-v-paesano-pizzeria-bartlett,4.0,"[Category(name='Pizza', alias='pizza'), Category(name='Italian', alias='italian')]",['374 S Main St'],US,Bartlett,IL,60103,108,True,This is the only good pizza place around. We've only been in the area for 3 months and when i tell you we have tried every pizza place that delivers to our...,525
deli-time-schaumburg-4,Deli Time,https://www.yelp.com/biz/deli-time-schaumburg-4,3.0,"[Category(name='Delis', alias='delis')]",['20 N Martingale Rd'],US,Schaumburg,IL,60173,1,False,"This is a small lunch-time and breakfast cafe/cafeteria in the basement of 20 N. Martingale. The food isn't great, but some of the things that are pretty...",525
smokin-pit-bbq-bartlett,Smokin' Pit BBQ,https://www.yelp.com/biz/smokin-pit-bbq-bartlett,3.5,"[Category(name='Barbeque', alias='bbq')]",['892 S IL Rt 59'],US,Bartlett,IL,60103,118,True,"Service:
Everyone is very helpful, it's hard not to feel like home.

Cleanliness:
Restaurant is very clean, and feels like a good BBQ joint...",526
bowl-and-barbecue-des-plaines,Bowl & Barbecue,https://www.yelp.com/biz/bowl-and-barbecue-des-plaines,4.0,"[Category(name='Korean', alias='korean')]",['1277 Elmhurst Rd'],US,Des Plaines,IL,60018,25,True,"4.75/5

I always go for their GamJa Tang, and booooy do they deliver. Every time I go, each table has at least one person eating it: now that itself should...",526
2-toots-train-whistle-grill-bartlett-2,2 Toots Train Whistle Grill,https://www.yelp.com/biz/2-toots-train-whistle-grill-bartlett-2,3.5,"[Category(name='Diners', alias='diners'), Category(name='Burgers', alias='burgers'), Category(name='American (Traditional)', alias='tradamerican')]",['203 S Main St'],US,Bartlett,IL,60103,89,True,"Brought our nephews here when they visited for the weekend and they had a blast! He loved watching the train deliver the food. We enjoyed a cheeseburger,...",526
jls-pizza-and-sports-bar-palatine,JL's Pizza & Sports Bar,https://www.yelp.com/biz/jls-pizza-and-sports-bar-palatine,3.5,"[Category(name='Pizza', alias='pizza'), Category(name='Sports Bars', alias='sportsbars'), Category(name='Chicken Wings', alias='chicken_wings')]",['19 N Bothwell St'],US,Palatine,IL,60067,26,True,Let me start with the beautiful ambiance as u walk in the door... after sayin hi to the polite bouncers' you step into a parallel dimension with the unique...,527
