tsukasa-of-tokyo-kildeer-2,John H.,T66UG8mnZLyBOdB6oqvu0g,"McHenry, IL",0,1,0,7,340,agr-u4g0vUjFSuqMhNCKhg,5.0,2016-06-23,"I&#39;ve seen the show enough times and now only come back for the food. It&#39;s great that you can sit in the front and choose not to sit at a table with a grill and a chef, if you don&#39;t want to. 

Best Japanese food in the area!"
tsukasa-of-tokyo-kildeer-2,Jackie M.,ZgVW5D4FB-aI6nx-oNxWow,"Chicago, IL",1,1,1,130,37,sR3P8wpkKhieQuIu1dOo4g,4.0,2016-07-19,"Hibachi lunch show!

Come for the artistry, the flames, the smiles and the goofiness that is somehow the Japanese/American hibachi.

Big and roomy, there are plenty of cooking tables to be seated at. Been here twice, once as a large party of 12 and another a party of 4. We had our personal chef blast flames and play with our food. 

If you&#39;re just hungry and want terriyaki chicken, there are other places to go to that&#39;ll be better priced and with more food options. Tsukasa veers on the entertainment side and is a fun and easy time to spend on a celebratory meal."
tsukasa-of-tokyo-kildeer-2,Christine T.,ttYPB7LZgD6A7b98hOiJ0g,"Arlington Heights, IL",1,1,1,177,9,NEkpz4guOj97o1TD1NqPxw,4.0,2016-07-08,"This is my favorite hibachi restaurant! I&#39;ve tried a few around the area, but this definitely tops all. 

I&#39;ve been here for both lunch and dinner on different occasions, but I ALWAYS order the Golden Shrimp- yum! 

Lunch: They have an awesome lunch deal. When we arrived, we were actually seated in our own table rather than being seated with another party-- which is a plus for me (I don&#39;t know why). As mentioned, I always order the golden shrimp so I got that while my boyfriend got the chicken. Both came with fried rice as well as a soup or salad and were about $13 each from what I remember. 

The soup is immediately served once we get our orders in. The soup is a warm, savory, yet light. It&#39;s has mushrooms as well has fried onions-- really tasty! The chef was great- we had great conversation and definitely cooked everything to perfection. 

Golden Shrimp is always satisfying. The egg yolk sauce is much lighter than other places, and, in my opinion, the best I&#39;ve ever had! 

Dinner: I had dinner here with my sister awhile back. Like lunchtime, they seated us in our own table instead of seating us with other people (yay for me!). Food is great as always and I love how the room didn&#39;t get foggy/smelly even though there were so many chefs cooking at the same time. 

I definitely recommend-- the food and atmosphere are both great!"
tsukasa-of-tokyo-kildeer-2,Paul P.,3ZMJ_7BLzG2wAtS_CnET5Q,"Long Grove, IL",0,1,0,0,10,wqCvcJ6Qfn_gjjJpNqz6gA,5.0,2016-11-05,Great sushi great Japanese food. Never disappointed. Spiced tuna is fantastic. I go there frequently
tsukasa-of-tokyo-kildeer-2,Nadia S.,g7Lf3PRSQRqaqwILjvj1Ng,"Palatine, IL",0,1,0,0,45,Br9XMk6KNJlUXzWY7Gz3tQ,5.0,2016-10-01,"Just love this place. There&#39;s no words to describe how good their product is. Just come in and try it, or order to go, the owner will still meet you with the smile, call you by your name and thank for choosing them. My wish for Tsukasa- keep found what you are doing! I&#39;ve converted many friends by now to come to your place! Thank you for great sushi you make, and I don&#39;t mean the cooked kind the many like, I mean the true Japanese stile."
tsukasa-of-tokyo-kildeer-2,Sarah D.,n91XppP7M-XRRaJBMzgqmA,"Palatine, IL",1,1,0,39,549,G-xo63Xn7MCGiXLKH3TCmg,4.0,2016-05-03,"I have been here twice. The food is fantastic! We have always been seated quickly as well whether we had a reservation or not. Great for groups and  kids. 
The only reason I give only 4 instead of 5 stars is because the first time I went the &#34;show&#34; part was so much fun, the chef had great energy and kept us laughing the whole way though. This last time i went the chef seems bored and even annoyed we were there and he had to cook for us.. That was disappointing to say the least since we all know you&#39;re paying for that &#34;show&#34; aspect as well at these kinds of restaurants."
tsukasa-of-tokyo-kildeer-2,Jennifer L.,MhHtPfvJXweF4xwK7Hm5yA,"Buffalo Grove, IL",1,1,1,103,7,ry7dNMDPIO4DLG0ZN9QdvA,5.0,2016-03-29,"I swear my reviews are disappearing.. I know i&#39;ve reviewed this Tsukasa before. Anywho... 

I&#39;ve been here like 4 times. I actually tend to like the filet here better than the Vernon Hills location. I&#39;ve gotten bad (chewy/gristly) filet a couple times at VH, and the filet here always seems to be so buttery soft. They&#39;d probably tell me they use the same meat distributor for both locations, and who knows?! that may be true. Maybe it&#39;s a mental thing at this point. 

Anywho. Why have I said any who twice in one review? A little excessive. This location is quite a bit smaller than VH, but i like the inside better. It&#39;s got a bit more of an ambiance to it. 

The fried rice is to die for. Sometimes i&#39;ll get an extra side order to take home with me, since i never finish my filet. That way i can make it into two meals! :) 

Chefs always do a nice job. Waitresses are improving. They used to be horrible, but they are definitely improving. 

If you love Hibachi, definitely try Tsukasa. I can&#39;t speak to the sushi because I don&#39;t do seafood. It ends up being a smidge expensive. I think i usually drop around $60/person, keeping in mind i order filet/fried rice and a soda. That does not include any alcoholic beverages. 

Def worth the stop!"
tsukasa-of-tokyo-kildeer-2,Saeed R.,eCpomZfzz1mZ7Ald3Qw0uA,"Buffalo Grove, IL",0,1,0,4,122,tgyF1eyfyUsgrV5BGagyKw,1.0,2016-10-01,"This place has great food but horrific service, especially at the hibachi table. We went there in the summer on a Friday night and were seated promptly(party of six). When our server started taking our order she was downright rude. We were almost getting yelled at for requesting a veggie miso soup because the current one has a chicken broth. We wanted to split our hibachi and she gave us the worst look ever repeatedly asking us if we didn&#39;t want to order anything else?? She then told us it would be an extra charge for splitting and we were fine with that. I ended up ordering sushi(spicy tuna/shrimp tempura) and it was pretty good. However, the service was unacceptable. This is not a place I&#39;d recommend if you&#39;re looking for a good hibachi experience."
tsukasa-of-tokyo-kildeer-2,Seleen T.,ORw0P3Q5YtwRngzFIYLKeQ,"Arlington Heights, IL",1,1,1,151,317,PlGrcStdsleLclABniGBMw,5.0,2015-11-10,"My sister and I went here to try Tsukasa out because of the reviews. 

The place looked very modern and very clean. Also it wasn&#39;t as smoky as other hibachi restaurants in the area. The service was very fast and we were pleased that we were able to get our own table. We came on a Wednesday at around 8pm. 

Our server was very energetic and asked to make sure that he got our order correctly. I would def go here from now on than the other hibachi place that i usually go to. It&#39;s more expensive, but it includes more food. The combination plates include soup, salad, and appetizer, and dessert. 

I got the entree of Steak which came with soup and salad. Then I also ordered a side of golden sauce which was really good. It was as filling as I thought. 

My sister got the combination plate of Golden Shrimp and salmon. She enjoyed her meal as well and we both had a good experience."
tsukasa-of-tokyo-kildeer-2,Clara S.,CfKT4Pr7QYIUlcq4fnKfgg,"Chicago, IL",1,1,0,218,29,sujU7zJjUZBlnxLoJ9cpDA,4.0,2015-08-04,"This is a review for the sushi, though I&#39;ve had the cook-in-front-of-you teppanyaki style before, and Tsukasa nails it! This time however we were definitely feeling sushi.

Red dragon: Mmmm very generous on the spicy tuna that tops this roll. Perfect amount of spiciness so that it wasn&#39;t overbearing on the raw fish taste.

911 roll: this is a sushi no no. There must have been some kind of chili paste mixed with spicy tuna to make this more spicy- which made it taste awful. The extra spiciness was too Americanized for my taste, not natural for sushi at all.

Fried rice: always perfect. Their fried rice is to die for, especially with a little added teriyaki sauce on the side. For $3.50 you get a very generously packed bowl of this heaven-sent, fried goodness.

Service is friendly but slow. This was my first time at this location, and it is definitely a lot less busy and big than the original in Vernon hills, but still Tsukasa nonetheless. A must for teppanyaki if you are in the area, and the sushi isn&#39;t bad either!"
tsukasa-of-tokyo-kildeer-2,Basel T.,arscupJYH4IAhiunSlPjZA,"Kildeer, IL",0,1,1,16,2,nQPY0_ldGeuft2h0j1rGtA,5.0,2016-02-27,"For someone who eats out as much as I do, it takes a lot for me to get impressed. Well, Tsukasa of Tokyo has earned my five stars award. They are truly the best of the best in the Chicagoland area. The quality of their food and their customer service are absolutely second to none. When you go, you must try their Yellow Ferrari Roll and JJ role. Since we started dining there at their grand opening few years back, we go there at least twice a month. Always consistent, and never disappointing. 
Guaranteed to be your best dining experience ever."
tsukasa-of-tokyo-kildeer-2,Alex A.,tuwUPZ0bKS_R4Rrw2hA30A,"Palatine, IL",0,1,1,0,8,eYHh-UMjitAaeq_tYFapag,5.0,2015-08-30,"Their restaurant is divided into a sushi section and a hibachi teppanyaki section. Wife and I sat in the sushi section, at the sushi bar because the window seats were too chilly from the A/C. As far as the food, this was the best sushi we have ever had, hands down.

We ordered the Yellow Ferrari roll, Rainbow roll, Spicy Tako Tempura roll, and a salmon skin roll. They were all delicious, beautiful, and carefully made. We did what we always do - put a little wasabi and soy sauce in the little tray for dipping, but we discovered that the rolls actually taste better if you don&#39;t add anything at all. I have never been somewhere where that is true. The sushi chefs really know what they are doing, friendly too but not intrusively so.

We saw one roll being prepared behind the sushi bar with a blow torch, and we got excited because we like those kinds of rolls. It turned out to be for us - the Yellow Ferrari. And it did not taste like fuel at all, like at some other sushi places. Really tasty, start to finish.

We took leftovers home, about one roll combined. Next time, we will get the Spicy Tako, Rainbow, and a few pieces of nigiri - yellowtail, bass, salmon. We are definitely coming back."
tsukasa-of-tokyo-kildeer-2,Chris B.,whc_AevypkSda6hUa0zilA,"Palatine, IL",0,1,1,0,338,rwi-fU2U0xmy0cxHh7GbiA,5.0,2016-08-31,Best Hibachi around!!  If you like teriyaki sauce there is no better one in the world.  I recommend this place to everyone
tsukasa-of-tokyo-kildeer-2,Louise M.,UrOofvcBl0gAbKPAEaj83A,"Minneapolis, MN",0,1,0,215,5,pSylYd-JEujzlitgNT1sYg,5.0,2015-07-29,"I gave it five stars for sentimental reason but this place is truly good and by far better than most hibachi restaurants, including Benihana.

It&#39;s my ex&#39;s fave place and we used to go here for special occasions the 11+years we were together. We&#39;re good friends and we still go here once in a great while when I&#39;m in town. Funny, cuz every anniversary or new year&#39;s eve, we came here for dinner and about 20 minutes after, while we were in the car, about to go to the next thing on the plan, he had to use the bathroom and we ended up going home. Yup, it gave him the shitz each time but we still went there all the time.

Don&#39;t you love my review? Tee hee. It&#39;s better than the review on the lion killer dentist. I thought my ex&#39;s shit story is just as vile. I hope they would start tons of threads on it. Nuh, never mind. I changed my mind.

This place is great though. They moved to a bigger location as they were busting at the seam in the original location we used to frequent years ago. The place was tiny and they always had Bears players eating dinner there and they looked massive in there.

The special part is they have this combo dinner and it&#39;s a great value. You could mix and match your proteins like filet and chicken, shrimp and steak, salmon and shrimp, etc. Plus, if you go with the combo, you get to choose an appetizer like shrimp tempura or California roll. You also get soup and salad and ice cream. It&#39;s not cheap but it&#39;s shit ton of food!

Their filet is tender, and the egg yolk shrimps.. Omgaaa. That thing will clog your arteries I&#39;m sure but it felt like it was worth it until if something bad would happen to you aka heart attack. I dunno.. It was so creamy, hot, and yummy, which my ex is no longer any of those things to me. However, the egg yolk shrimps are still good through the years! 

One thing I don&#39;t like is their use of teriyaki sauce in the fried rice. I don&#39;t care for it but they gladly made me my rice with just soy sauce. The show that the chef put was also cool and not obnoxious at all. It was just enough entertainment.

We had a great meal tonight and we had a lot of fun. My sister thought it was as good as how she remembered it. My niece was enjoying the fire and the choo choo onion train. All were the same as usual and I&#39;m sure he got the shit again. Good thing this time we were in separate cars."
tsukasa-of-tokyo-kildeer-2,Jessica D.,Aw_IAVKjc0bQLt8o_l_afA,"Wauconda, IL",0,1,0,2,59,xO89QyHHk_G-BIZa6BV8hQ,1.0,2015-08-14,"Will not be going back! We have been multiple times before and the bottom line is they have seriously been going downhill. We went for my sons 9 th birthday and they barely acknowledged him. The chef was rude, rushed, and food was just ok.
The kicker is they WILL NOT  sing happy birthday unless you pay an extra $6 for a pineapple and a picture!! With the prices being as high as they are I was shocked! Every restaurant I&#39;ve ever been to sings happy birthday free of charge?!?!
Don&#39;t waste for money!"
tsukasa-of-tokyo-kildeer-2,Debi H.,wzUKDt1xDg2fbTnlJVU7fQ,"Wauconda, IL",0,1,1,10,28,tO2X45tZ-vQC90Lp_Si-GQ,4.0,2015-09-07,Love the food and ambience here! Our chef was very engaging and made our special guest from Brazil smile! Get the birthday package when celebrating that special day!
tsukasa-of-tokyo-kildeer-2,Jackie M.,TkONXDTYKyu3XRDJMhoMGw,"Rolling Meadows, IL",0,1,0,92,21,AxdGpGSAjadXag0bG6cKgA,5.0,2016-03-04,"Food was fabulous, the entertainment was awesome!  Fun for all ages... Nice atmosphere, very kind and attentive wait staff, from the manager to the bus boys.  We will definitely go back!  Although a little on the pricey side, so more for special occasions."
tsukasa-of-tokyo-kildeer-2,SigP220 S.,7XxAgwp2UzTL7C3InVAoPQ,"Lake Zurich, IL",0,1,0,0,1149,ro_ir6ju0WZM1NpF9YlitA,5.0,2016-05-08,"Can not say much other then pay $$$$ Eat BIG. Love it very much. The food is GREAT. You smell like grease when you leave from all the cooktops but hay wash your coat. LOVE the Fried Rice, Steak Golden Shrimp ohh man I&#39;m getting hungry."
tsukasa-of-tokyo-kildeer-2,Danielle S.,UuIr2WKA0gZRyRvWIlAduQ,"Schaumburg, IL",1,1,1,198,36,6Q1O21wEQRIIA6z2w1aQkA,3.0,2014-10-20,"Sushi is my favorite! I could eat it all the time. 

Came here for dinner the other night. The wait for the hibachi was about a half an hour, but there wasn&#39;t a wait to sit at the other tables. You don&#39;t have to sit at the hibachi tables to order it, fyi. I was told to pick my own seat (I think the host was overwhelmed). Later I was asked by another person if I had checked in at the front (since I was seating myself). Out waitress was nice and had no problem splitting the bill. Beside the odd host situation, the service was good.

My friend got the hibachi, and I ordered sushi. They don&#39;t have a huge list of maki rolls, but enough to give you a selection. The rolls were good, but not the best I have had. They were a little warmer than what I would have liked, and they fell apart easily. Still, they tasted good and it wasn&#39;t bad enough to complain. I just have had better at other places."
tsukasa-of-tokyo-kildeer-2,Larisa M.,sTgvOeqiHP0AwlHJe6IPng,"Buffalo Grove, IL",0,1,0,2,6,GHD_Z1WYt7-LtRIMOFr4yQ,5.0,2015-12-16,"The food here is delicious. Expect to spend over $100 for dinner for a family of four if you&#39;re getting hibachi, sushi an drinks, but it doesn&#39;t get better than this. 
 
The sushi salad is a must, the Filet Mignon melts in your mouth and the scallops are delicious any way you order them. Our hibachi chef was fun and friendly. We were a large crowd - 6 adults and 6 kids, but everyone was super nice and accommodating."
tsukasa-of-tokyo-kildeer-2,l. r.,Xc3dIDvxnSnU7XCT_Qp7dQ,"Chicago, IL",0,1,0,0,60,TlenwAlZqR96gLSqynuFug,1.0,2015-10-10,"Went in Tsukasa with high hopes based on the positive reviews on yelp. Service was awful from the moment we walked in. Waitress was very rude. Her greeting was &#34;you guys wanna sit here or there?&#34; and that was all while she left the menus on the table. 

We ordered 3 appetizers and 2 entrees for 2 people. The asparagus wrapped with beef was was hard to chew; the meat obviously overcooked. The GIANT CHUNKS ( not slices ) of tuna sashimi was ridiculous. The chicken teriyaki was also grossly overcooked and was just tough pieces of chicken mixed with mushrooms and a weird sauce, thrown on top of rice. 

Our waitress didn&#39;t stop by our table to check on us. FORGOT our order and we had to ask her a few times to check on our food. Very rude wait staff. She also never cleaned our table off. We sat throughout the whole meal with a pile of used dishes of the table. 

Considering the price range, I expected food and service to be above-average. Both were worse than a truck stop diner. If you&#39;re looking for AUTHENTIC Japanese food that isn&#39;t overpriced and a much more pleasant dining experience, I highly recommend Sakura in Rolling Meadows or Tensuke Market in Arlington Heights. 

Just as a reference point, hubby and I have tasted sushi and Japanese cuisine in general, in different parts of the world (including Japan) and in the US. My husband is a Culinary Institute of Art graduate and has food and beverage management experience in 5 star hotels and resorts."
tsukasa-of-tokyo-kildeer-2,Melissa K.,vQOy9SiRSYYt51J5UrPBSQ,"Wauconda, IL",1,1,0,40,52,NpCBnQhli9x1oKdVCgMF1Q,5.0,2014-08-03,"I can&#39;t stop going back,  Tsukasa seriously is the best! I love the pink dragon, yellow Ferrari and the mexi maki rolls , I always have to get the fried rice. They have amazing beef asparagus rolls and seared scallops I would recommend anyone come I&#39;ve been going here &amp; to the Vernon hills location for over 15 years and never once been disappointed Tsukasa is the best!"
tsukasa-of-tokyo-kildeer-2,Michelle A.,mKzrtKbqdq_Nf-VbfaQFyQ,"Bartlett, IL",0,1,0,3,14,G6jIr2uT9VW--dPNuU6WxQ,5.0,2015-08-01,"Pink dragon, eel cucumber, two masago pieces, squid salad (seriously a must have!!!) and a caterpillar roll for two was perfect and reasonably priced!!! Highly recommend everything we had. Wish they had mochi to finish, boo hoo!"
tsukasa-of-tokyo-kildeer-2,Karen G.,8h8vGSUdG_IllnSw8pnORg,"Chicago, IL",0,1,0,0,352,ExCdc1ftq9hLP_kUKIS9VA,1.0,2015-11-10,"We will never go back!  We returned one roll based on tough seaweed and the other orders were below standard.  The venue was lack lustre and the service was just ok.  We have just moved from the city and exposed to amazing sushi - we have never experienced terrible sushi like this.   For our first experience in the Burbs - we were hightly dissapointed.  

Karen"
tsukasa-of-tokyo-kildeer-2,Rebecca R.,LKzls_vBD97-tsMu0MV26g,"London, United Kingdom",1,1,1,99,146,Z76sfK7xcgw0VRMrOYk74A,5.0,2014-04-23,"Happy Birthday Dad!

My family and I had a great time here for my Dad&#39;s 60th birthday. We had 6 including a baby and we were welcomed with a smile and the smiles from everyone that we talked to never stopped. They were great. The food was fun, show was entertaining, and they sang and took a picture of the family for the birthday boy. I would recommend this place to anyone for a special occasion or just a fun relaxing night out. Dinner and a show!"
tsukasa-of-tokyo-kildeer-2,Tanya A.,mS9SKLAISGxYFlg2Qruepw,"Buffalo Grove, IL",1,1,0,25,33,2YTjhXfdZ4N8fjWepYKZ1A,4.0,2013-02-11,"If you follow my reviews you&#39;ll see I am a huge fan of sushi. Tsukasa has one of the best sushi menus out there. All their specialty rolls are very different form other restaurants. Always served fresh and melts in your mouth. 

If you don&#39;t like sushi and you want great habachi, they will be your one stop shop! Always prepared fresh right in front of you, and the chefs are always excited to be there. They put on a show for you with the &#34;train&#34; made out of onion, or the &#34;beating heart&#34; made out of fried rice. 

Very accommodating for large groups, family dinners, or even for date night. Great food and good service. 

Food is always consistent no matter which chef you have. 

Some of my favorites would include the following...
Yellow Ferrari
Urlachor 
Tarantula 
Tsukasa roll
Pink dragon
Red dragon
White dragon
Teriyaki chicken
Udon soup
One of the BEST fried rice dishes in Chicago!"
tsukasa-of-tokyo-kildeer-2,Samantha P.,ULw2lEskcbgQ0l9A5GFu2w,"Barrington, IL",0,1,0,1,249,dMRebm2vLGnO9t0d6BR32g,4.0,2015-05-27,"Great quality filet! We had a great experience. Our chef was great! I will say, I have been to other hibachi grills that have been a bit more energetic and entertaining."
tsukasa-of-tokyo-kildeer-2,Rick H.,I1I_I6jg8mK5joTGvZ7idA,"Beaverton, OR",0,1,1,143,159,zr2A6jZ8ZvoP7A5bgObteg,5.0,2014-06-20,"In my somewhat considerable experience with the Hibachi concept across the US, I can tell you without much hyperbole that Tsukasa is the best I have ever been in. 

When I visited the first time, Shochu (essentially Japanese Vodka,) was on the drinks menu. The manager (owner?) asked if it was my first time having Scohu, to which I replied in the affirmative. He insisted that I had a taste before he&#39;d serve me a full drink, just to make sure I enjoyed it. 

I also got a waiter, who was still in his first week. He straight up apologized to me when he first came to the table, telling me it was his first week and to please be patient with him. The problem was that if he hadn&#39;t told me that, I would not have known it was his first week!

The chef was absolutely wonderful. He didn&#39;t do any of the trope &#34;funny&#34; chef moves that certain other places do, he just made the food quickly and efficiently. He also modified the food as he was cooking when I told him I was lactose intolerant. And the servers didn&#39;t complain and make me wait forever for other customers to show up like other Hibachi places would. 

It&#39;s little things like this that put Tsukasa above other Hibachi places in my experience. This is five star customer service all the way. 

Add in the good, nay great food and we have a winner. Steaks are of good quality meat. Seafood is fairly fresh. Drinks are strong, yet the balance of ingredients is perfect. 

My biggest regret is that for the foreseeable future I have no reason to come back to the Kildeer area so that I can partake of Tsukasa again."
tsukasa-of-tokyo-kildeer-2,Alli W.,oeD7dFjxSOwLR8QV23ER8A,"Lake Zurich, IL",1,1,1,95,163,jlqyozrHs-B0ECY1FXnpkg,4.0,2014-07-07,We went here for the first time and sat in the sushi bar area. Can&#39;t wait to go back and try the hibachi next time! The sushi was great - we tried the Yellow Ferrari and Cubbie Comfort which were both fantastic and large portions. We also had the Philadelphia and Spicy Tuna and determined that we definitely had ordered too much food for two people! Can&#39;t wait to come back and try this place again. My only wish was that our waitress would have been around more towards the end when we were looking for our check but the manager stepped in to help out which was great.
tsukasa-of-tokyo-kildeer-2,Maxine W.,LySrgOhB-NQ_xj7pbnYbYQ,"Arlington Heights, IL",1,1,1,130,28,Poc-k4NYs_PIMDEi_uyd6w,5.0,2013-04-19,"Ohhh Tsukasa. I love you. If only I had a bottomless wallet and a flawless metabolism, I&#39;d eat you every day.
This was my first visit to the Deer Park location and let me say, I didn&#39;t know it was possible to get better than Vernon Hills. But Deer Park takes the cake. It all comes down to food temperature. The tempura, the miso, and I dont know how, but even the food straight off the flat top was hotter than in VH. Crazy! 
And might I add, I am a boom-boom-fatty when it comes to the golden sauce and I always order extra for my fried rice. Our chef did something that made me turn to my sister and just about faint. He layered the sauce into the rice so I didnt have to go digging around to get the perfect bite. Every bite was the perfect bite. Heart attack heaven."
tsukasa-of-tokyo-kildeer-2,Randa U.,PBi7mXgSc97uUjHIvK63Cw,"Rolling Meadows, IL",0,1,0,102,591,NhAK4lWBeOegd-r7Vjx58Q,5.0,2015-06-11,"The rolls are great! They have small rolls for those with small appetites and large Bears Themed rolls for those that are linebackers! The sushi chefs, Nick and Ken are our favorite! They have a hibachi grill, but I only go for the sushi.  The managers are friendly and customer service is awesome! The size of the fish are as thick as steaks.  You can&#39;t get better than this place!"
