tsukasa-of-tokyo-kildeer-2,Lynn B.,2B8JsE5ojZ08AMSkAFiq-A,"Barrington, IL",0,1,0,30,4,GSjpZORmGi43KR-Qx4jPWA,3.0,2012-12-16,"From the outside, Tsukasa looks like its small place (especially since it&#39;s in a strip mall with Bed, Bath and Beyond, World Market, Ulta and Old Navy), but its actually quite bigger extending back to their teppenyaki side of the restaurant. We just came in for the sushi. The staff is polite and prompt. Decor is nicely done. We ordered the Bear, Krazy, a salmon and tuna roll and Shomai.  They were just ok, nothing exceptional ...but the Wasabi Shomai tasted like its from a frozen box. It&#39;s a little expensive compared to the other sushi places around. They do charge $2.50 for green tea."
tsukasa-of-tokyo-kildeer-2,Kelley J.,MnxjkxDQsqlRDCQsCGwEgw,"Wauconda, IL",0,1,0,0,30,Pwlg8-PHTHLWogxTXEDBOQ,2.0,2014-03-06,"The sushi is fantastic, but the service is awful.  Pushy and rude.  Our server waited at my table for me to sign my credit card slip at 1:50 because she said her shift ended at 2.  Too bad, because all of the food was great."
tsukasa-of-tokyo-kildeer-2,Suzie D.,8ZF4-mcKdVFknam9DNo8VA,"Chicago, IL",0,1,0,8,17,GzR2NVT56EkJMF1tYLcd9A,4.0,2013-02-14,"Simply incredible. Went there on superbowl night with a few people and we sat at the bar. You cannot spend under 30 bucks per person there...it just aint gonna happen. But for a suburban sushi spot, i&#39;d say this is a chart topper. Awesome staff and beautiful &#34;sheek&#34; decor. The spicy tuna rolls were off the charts. Saki was great, the JJ rolls, wow. If you go to this place, you must try the JJ roll . It&#39;s their signature roll. I&#39;ll definitely return sometime."
tsukasa-of-tokyo-kildeer-2,Seth W.,Qm391C_WKTDv1Yy3t04CgQ,"Grayslake, IL",0,1,0,0,59,OnuIR026i0iF_V8TcwA32Q,4.0,2013-01-31,We enjoy going with our friends.  The kids seemed engaged with the preparation of the meal.
tsukasa-of-tokyo-kildeer-2,Vicki K.,l4GqNZUePBkqi3WRR7yF3Q,"Lake Zurich, IL",0,1,1,4,35,HZboQXaL7qsVKhFcaeh4YA,4.0,2011-10-05,"One of the best sushi places in the area.  First time, I just got takeout and it was okay.......second time, my husband and I went and we thoroughly enjoyed the sushi and my favorite was the Tarantula....then we went again, and now my new favorite is the Ferrari!  Love love love it!

I haven&#39;t, and probably won&#39;t, try the tabletop cooking steakhouse portion of the restaurant, just not my thing, but the dining room is large and inviting."
tsukasa-of-tokyo-kildeer-2,Will S.,qI81Pa9421Vt1KhgYkSd-Q,"Palatine, IL",0,1,0,1,47,W2exJb7C-ZE6VNMwxFvRRw,5.0,2012-07-08,"I have been to just about every well-known and new neighborhood gem sushi restaurant in the Chicagoland area. Tsukasa has thee best sushi in Chicago. Whether at the Vernon Hills or Kildeer location, the sushi is top notch no comparison. Yellow Ferrari and White Dragon... just do it and thank me later!"
tsukasa-of-tokyo-kildeer-2,Tyler K.,nRMnrl1RkMj7PwgN6jdy_g,"Buffalo Grove, IL",0,1,1,1,2,UyEnbkuzDFa51LupVLut-A,5.0,2013-05-18,"Went here for my birthday......good food! Excellent service, good chef! Got a birthday picture that they took. I like this place!"
tsukasa-of-tokyo-kildeer-2,Bruce B.,ZlW4XIJSVwGI16m4s6jeUg,"Barrington, IL",0,1,0,0,9,MucuMhq4swDUc75AY1SX8Q,5.0,2011-12-08,Wonderful sushi and service at sushi side booth on a Thursday night.  Loved the TK roll and Yellow Ferrari roll especially but all was very good.
tsukasa-of-tokyo-kildeer-2,Geoffrey H.,GQCAAXTwMtfR_txSdM-2YQ,"Chicago, IL",0,1,1,47,13,Z-dn-n8Z_RPShlMqgtIDWQ,5.0,2012-03-23,The food is very good and they use the freshest ingredients.  A special thanks to Brian and John who roll out the red carpet everytime we go.
tsukasa-of-tokyo-kildeer-2,Marta M.,OrLTklol0BAIp--DnlzKww,"Elk Grove Village, IL",0,1,0,1,24,7KFXGXjJyyy58zq1hHMYBQ,5.0,2012-01-24,"Really good sushi in the area! Nice service. I like those separate booths when I come in with my family or friends, makes it very cozy. Bond Girl roll is fantastic. Sashimi is nice and fresh."
tsukasa-of-tokyo-kildeer-2,Jodi K.,zcZuCnutAUPkVZ56oI4IzQ,"Chicago, IL",0,1,0,0,8,g51NaObWvYN_PmJFVSSKEw,5.0,2013-02-19,"the food is so good!  the safe is so friendly and they make dinner fun.
i love the chicken, shrimp and steak here!"
tsukasa-of-tokyo-kildeer-2,AdriAnne B.,4ECS5sKC_L1Mwo075pIrFg,"Palatine, IL",0,1,0,13,88,DGO7tn6Xy9dWvghKJSmubw,5.0,2011-03-27,"My Favorite restaurant  by far.  I love everything about it.  The food  so fantastic, the best atmosphere  So great I really could go at least once a week but cant afford that so I go with every chance I get to go. So friendly and cozy I love it Can&#39;t wait to go back. Love it    I live close to Kildeer so I wish they did deliver. Maybe think about it"
tsukasa-of-tokyo-kildeer-2,David L.,YT5z8nrhKEjv1SkXdDCseA,"Los Angeles, CA",0,1,0,2,28,qZZQ34CSWqmNUaLmAlpI1Q,1.0,2011-04-11,"i guess this place opened up recently cause it was very clean and looks very new. for a weekend night it was not that busy so we got in with no reservations. plenty of parking as the strip mall is pretty dead at night. sushi was typical but nothing mind blowing; quality seemed fine but nothing special.

main reason we came was for the teppanyaki. the chef looked young and did not really season the food at out table well. 

hibachi scallops - asked for teriyaki which i was expecting a sweet flavor but it was pretty bland

filet mignon - asked for medium rare but came out more like medium to medium well. way too tough for my liking 

chicken teriyaki - again had to ask for more sauce to make it more flavorful since it was bland. 

for two people it was expensive for what it is; over $120 with a couple beers and tip."
tsukasa-of-tokyo-kildeer-2,Ken J.,1gfJN_gzvYEo4Cs35pHDzA,"Lake Zurich, IL",0,1,0,52,8,tQmiEsGFhHZRv1_3G2tAYg,4.0,2011-05-07,"I have always loved the Tsukasa in Vernon Hills from their days in the strip mall to the now expanded stand alone location. i was happy to see they opened a second location closer to me. My first thought was will it be the same? The answer is yes. Dinner is pricey compared to other places but so worth it. Fried rice is a must. My niece who doesn&#39;t like fried rice ate most of my sister&#39;s. I am pretty standard chicken and shrimp which are great. My brother in law got the fillet and it looked great, would recommend. My parents who have never been enjoyed it and will return. My niece&#39;s got a really cool Japanese cola which i am not sure what it was but they loved it. They have kids menu so great place to go with the family, and for special occasion&#39;s. For me it was my birthday and the food and chef was great. Always entertaining for the family. Their sauces are home made so if you like ginger and teriyaki please get both and try them. So those who wonder, it is same quality as Vernon Hills."
wendys-hoffman-estates-2,Karyn S.,Xoetf_bcE5U6o9IBzlJMWQ,"Barrington, IL",1,1,1,20,57,PUP5V-Wr_4a3z17T1j_QAw,3.0,2015-10-04,"I love Wendy&#39;s, and used to patronize this restaurant more when I worked in the area. I stopped back in a few weeks ago while craving food and in the area. My food was so-so, warm but not hot. My expectation is that you&#39;re going to know what Wendy&#39;s food is like, and I&#39;m just comparing it to other locations. 

The people were nice enough, but nothing about the customer service or the food stood out to me. I just felt, while driving away and snacking on my food, that I probably would have made a better choice if I had gone down the street and ordered from Portillos."
wendys-hoffman-estates-2,Tony M.,5z5JOlbFJq9jblwv0clKfA,"Schaumburg, IL",0,1,0,15,22,C_h6Rdg1hqXCWp3hJmWDTA,1.0,2016-10-18,"As others have said, this location is awful. They messed up my drive thru order and the food was mediocre at best.  I see why people are moving towards fast casual over fast food, the price is even comparable. Will not be back to this Wendy&#39;s location based on my experience today. 

D-"
wendys-hoffman-estates-2,Joy S.,gnr3a2BnufRtOAewiJKF9g,"Hoffman Estates, IL",0,1,0,0,1432,UNygpURAtv95NSp4E4AgMw,1.0,2016-06-06,"Yep, closed... parking lot tore up. Today, received an email from Wendy&#39;s calling attention to their new Mediterranean Chicken Salad. Deciding it would be a nice add-on for dinner, headed for this Wendy&#39;s (closest for me), and found the place closed. A lot of work is being done on the outside of the parking lot."
wendys-hoffman-estates-2,Ericka A.,To0GTLW5MGZwOg5TxxZIQA,"Chicagoland, IL",1,1,1,1096,138,Mz9bE7rJuSV9QRWeXU5OWg,2.0,2014-12-06,"I&#39;m trying to avoid fast food. I should know better by now.

We ordered lunch to bring to Mom and it was pretty unappetizing. I went with the Pretzel Bacon Cheeseburger and ended up with a somewhat warm burger between a dense, oddly rubbery bun with cheese that didn&#39;t seem to be melted at all. It had the telltale sign of being aged around the edges with discoloration, and not in the delicious way. The fries were barely heated.

It&#39;s sad because Wendy&#39;s, in my opinion, used to be one of the better grab-n-go options. Their quality has greatly declined and I&#39;m not sure why we were asked to pull ahead and wait for our order when what we received clearly wasn&#39;t as fresh as it could have been."
wendys-hoffman-estates-2,Charlotte W.,_ubOmguUF7BdptpIXsua4A,"Addison, IL",1,1,1,144,189,qiOSgH_MgHHGIPBGNUcD3A,5.0,2014-10-10,"My review is from a drive-thru experience...
I haven&#39;t been to a Wendy&#39;s since high school probably, it had grown to be kinda meh and outdated. My boyfriend and his brother are fond of it though and word of improvement has been reaching my ears. 
Well well, Wendy&#39;s has made us happy today. I wasn&#39;t sure what to order, they were patient. Our coupon was apparently expired, the lass working the window said she&#39;d ask her manager about it: the manager happily honored it (i wish I knew both of their names, this was at 2:30 on 10/10/14). Tasted the food: it was hot and good! I got the chicken caesar wrap, great price, reasonable size. 
If they are all like this, then welcome back to the competitive floor, Ginger. 5 stars for surprising me."
wendys-hoffman-estates-2,Kimsy S.,hjqYKZ3Ej175eeT1_ZgiTg,"Schaumburg, IL",1,1,1,133,10,7ypAcf7J0bPCwd52xIEvwg,1.0,2013-07-30,"I really don&#39;t know why I bother.

Every time I come to this Wendy&#39;s location, the experience has gotten worse and worse. 

This time was a big disappointment. I ordered the new pretzel bread cheeseburger. Being in a fast-food place, I wasn&#39;t expecting anything as nice as Fuddruckers or Smashburger, but I did expect something edible. I stood and waited for what felt like forever for my burger, and I took a bite. It was pretty bad; the pretzel bun was too chewy and slightly cold. I decided to take a look between the buns and saw the problem: my sandwich was not fresh. At all. The cheese was practically plasticized and fused to the bun. Yes, I waited close to 10 minutes for that. It was absolutely gross. My appetite was ruined and I ended up throwing the food away.  I hated that I wasted almost $9 on this crap, but pleased that I didn&#39;t put that garbage in my body.

I am finished with this location. The orders are usually messed up, the service is slow, and the food is awful. I may even quit Wendy&#39;s altogether, it hasn&#39;t been good in years. 

Bye, now. My body needs fresh fruits and vegetables to detox from whatever the hell I attempted to eat."
wendys-hoffman-estates-2,Curtis L.,vkXIIlPwzdsLtNM6j9ecVA,"Barrington, IL",0,1,0,1,35,-6103TDKFm0520QiX7FxnQ,1.0,2015-12-09,After multiple attempts to order and then pulling up and correcting the order the girl at the drive through  still got our order wrong.  The staff was distracted and seem poorly trained.  The service was poor but the food was hot but did not match the quality im used to at other locations. All in all this location should be avoided
wendys-hoffman-estates-2,Andrea C.,YTx2_8lHvbZGUOtpn4gfiA,"Schaumburg, IL",0,1,0,6,9,n6pS0pvTz8wgwWySJ7tXwA,1.0,2015-06-09,"Not Fresh at all. VERY cheap with ALL toppings. Didnt realize I was charged for a double cheeseburger $5.29! Must have been a mistake. But needless to say, seems the patties were made way before and NOT fresh to order!"
wendys-hoffman-estates-2,Khuram J.,lsU6ZxCVlRUB_eaGBsSleg,"Hoffman Estates, IL",0,1,0,7,719,v40z6C8EbcPIymmoHl4gZQ,5.0,2014-09-10,"The best Wendy&#39;s you can find in the area..
Best service you can get people are so good there and they also have hot tea..."
wendys-hoffman-estates-2,Michelle F.,QR8XFFHYU-X0epXOrDbrXw,"Schaumburg, IL",0,1,1,165,35,wSNf13Cb6tGehArB5xlY7Q,2.0,2012-10-03,"I now know why I waited so long to come back to a Wendy&#39;s...

Yes, they have healthier options, but sometimes you&#39;re just in the mood for a GD cheeseburger...and a salad that has chili on it (yes, that exists).  Sadly, it wasn&#39;t fantastic, but i applaud them for trying.

It was slow-going to get my food because they were making a batch of....something they were out of.(I was only half-listening).  But the order was correct, I will give them that much!

The highlight was the nice/funny guy behind the counter, Dean.  He put up with my indecisiveness while I sat in front of the menu for five-ten minutes asking questions like &#34;What comes on a bacon cheeseburger?&#34; and &#34;can I get extra cheese on my cheese fries&#34;.  He was friendly and patient :)

I am not sure I would be back except for a frosty, though!"
wendys-hoffman-estates-2,Katherine K.,ybhCjNidXafXAGspMILE9g,"Chicago, IL",0,1,1,5,45,u4E72juLClDQLTyM-43FiQ,5.0,2014-09-04,"For an area where every place seems to stop serving food at 10pm, this is the go-to locale for late night snacks and desserts.  We went through the drive thru and got a couple of Frosties and they were great!"
wendys-hoffman-estates-2,Dennis P.,ygeYHmUkm6o-ubjbU5XP7Q,"Hoffman Estates, IL",0,1,0,2,2,__9NWycy-hpBYXxYf0fXQA,5.0,2015-02-11,"Best Wendy&#39;s service in the area.  Can&#39;t go wrong with fast food, but every time I order from here fast, prompt, good drive through service and the food is always hot and tasty."
wendys-hoffman-estates-2,Melissa J.,y21NA1mVwV4v_vs0qNuc5A,"Schaumburg, IL",0,1,0,1,6,tZUrF2MKm25NyPCRSAWSyA,1.0,2015-01-27,Asked for honey mustard every single time I order. Probably received it 2/10 times. Would not recommended this location.
